1/6/2020 9:39:21,MA222,LKL,Experimental,"Host-symbiont, Competition-cooperation","""Unfortunately, this study did not have the power to determine to what degree this intraspecific variation was partitioned within versus among populations, or what underlying cause of the variation (genetic, maternal effects, etc.).""","Invader (Alliaria petiolata); native tree species (Platanus occidentalis, Quercus rubra, and Juglans nigra); symbionts such as arbuscular mycorrhizal fungi (AMF), ectomycorrhizal fungi (EMF) and bacteria community","Individual: Leaf and root glucosinolate and alliarinoside concentrations, leaf iso-6- O-b-vitexin concentration, and above-ground biomass;  Population: age",Invader (Alliaria petiolata),"Potentially, ""considerable variation in published studies addressing the allelopathic/anti-mycorrhizal prop- erties of A. petiolata, with studies finding no (McCarthy and Hanson 1998), relatively mild (Burke 2008), or strong effects (Stinson et al. 2006). Some of this variation may derive from methodological differences, but some of this variation may be the result of true biological variation among the A. petiolata populations or the native plants and soil communities studied.""",Species,"Not directly, ""microbial species that best promote native seedling growth also tended to be the most sensitive to allelochemicalssuggesting that A. petiolata affects native plants both by reducing mutualist abundance (Stinson et al. 2006; Wolfe et al. 2008) and by shifting soil communities toward a less mutualistic distribution.""",Mutualistic to antagonistic," ecological/biotic, abiotic factors ",population persistence and local species coexistence; spread and impact of invasive species,Yes,,no clear shift,Maybe,There is no shift in the quality of the interaction,,,,,,,
1/6/2020 9:52:37,MA411,NC,"Observational, Experimental",Host-symbiont,"Inter-specific (>2 species), Intra-specific (between populations)","Asobara wasps, Wolbachia",Species and strain genotypes,Asobara wasps,Between-population differences,"Populations, Species",Continuum of emancipation from symbionts,Obligate symbiosis to no symbiosis,phylogeny (co-evolution?),Potential development of resistance of antibiotics,Yes,,"Only yes/no, not variation within populations. The variation shown has no fitness effects. Fitness is always symbiont-dependent.",Yes,,,,,,,,
1/6/2020 10:11:33,MA162,NC,Experimental,"Competition-cooperation, Consumer-resource/predator-prey","Inter-specific (2 species), Intra-specific (within population)","Ips pini, Thanasimus dubius",predation reduces the effciciency of cheating ,Ips pini,No,Individuals,No,Antagonistic to mutualistic,Predation,Propensity to colonize instead of follow and use provided resources,Yes,,Measures are based on survival - no behaviour/inheritance implied,Maybe,There is no evidence of trait variation,,,,,,,
1/6/2020 11:43:21,MA282,RR,Experimental,Host-symbiont,Inter-specific (>2 species),Ficus hirta (plant) and associated parasitic fig wasps (Philotrypesis josephi and Sycoscapter hirticola), inflorescence receptacle size (fig wall thickness) in  Ficus hirta varies and the parasitoid wasps also respond to this in terms of the variation in their ovipositor length,Ficus hirta (plant). also changes in parasitoid wasps found as a response to changes in plants,"it could be heritable because it is mentioned in the paper that generally, such variation in plant traits is either a direct plastic phenotypic response to local conditions or the product of local adaptation.",,no,,,ecological impact of interaction : diversification of parasitic wasps on the host plants and resulting geographic variation in community composition,there is geographical  varaition existing in both host plants and the parasitic wasps ,NA,No,No,"There is no shift in the quality of the interaction, the paper is about how geographic variation in host plants results in diversification of parasitic  wasps ",,,,,,,
1/7/2020 0:26:11,MA101,RR,Experimental,Host-symbiont,Inter-specific (>2 species),"Epilobium angustifolium (fireweed-host plant), Aphis varians(aphids) and Formica cinerea (ant)",quality of host plants measured in terms of plant height,the fireweed host plants,nothing mentioned specifically in the paper,,no,,NA,NA,NA,NA,NA,No,There is no shift in the quality of the interaction,,,,,,,
1/7/2020 4:01:47,MA280,LKL,Experimental,Host-symbiont,Inter-specific (>2 species),"Solanum spp.(S. berthaultii, S. polyadenum, S. tuberosum STN and S. tuberosum Chilean); potato aphid, Macrosiphum euphorbiae; aphid facultative endosymbiont, Hamiltonella defensa","They determined the influence of plant type, herbivore holobiont and root AM fungal infection on changes in root allocation and parasitism success.",NA,Not mentioned,"Populations, Species",No,NA,NA,NA,NA,NA,NA,No,"There is no shift in the quality of the interaction, The trait varies between species, not within-species",,,,,,,
1/7/2020 5:25:50,MA25,NC,Experimental,physiological mechanisms behind cooperative tasks,Intra-specific (within population),,arginine vasotocin suppression,Labroides dimidiatus,no,,no,,variation in arginine vasotocin suppression,unclear,no,,the natural variation of the trait is not clear,No,"There is no evidence of trait variation, There is no shift in the quality of the interaction",,,,,,,
1/7/2020 5:46:16,MA160,NC,Observational,"Host-symbiont, Consumer-resource/predator-prey",Inter-specific (>2 species),"Isoplexis canariensis, mutualists and antagonists",centrality in the mating network allows more mutualist ,Isoplexis canariensis,no,Individuals,yes,Mutualistic to antagonistic,distance to conspecifics,higher reproductive success via higher levels of mutualism for more central plants,yes,spatial rather than phenotypic/genetic determination of the shift,,Yes,,,,,,,,
1/7/2020 22:39:37,MA367,NC,Observational,Host-symbiont,Inter-specific (>2 species),"Amphisorus hemprichii, Symbiodinium spp.",spatial distribution of lineages within host,Symbiodinium lineages,no,,no,,,unknown,yes,,"spatial description of niches, unclear determinants",Maybe,"There is no evidence of trait variation, There is no shift in the quality of the interaction",,,,,,,
1/8/2020 6:56:31,MA379,NC,"Observational, Experimental",Host-symbiont,Intra-specific (within population),"Upupa epops, uropygial gland symbionts ",captivity,Upupa epops,no,NA,no,NA,NA,NA,Yes,NA,NA,No,"There is no shift in the quality of the interaction, No evidence for trait variation in the wild",,,,,,,
1/8/2020 7:15:20,MA199,NC,"Modelling/theory, Review",Consumer-resource/predator-prey,"Inter-specific (>2 species), Intra-specific (within population)",NA,"Size of prey, size-preference of predators, variation in local prey communities",all,no,"Individuals, Populations","No, but possibly relevant","Mutualistic to antagonistic, Antagonistic to mutualistic","Size of prey, size-preference of predators","potentially prey choice and composition, shift from predation to mutualism",Yes,,"very general, no data",Maybe,"Not quantitatively usable, important from a conceptual point of view",,,,,,,
1/8/2020 7:33:29,MA175,NC,Experimental,Consumer-resource/predator-prey,Inter-specific (>2 species),"Aphis craccivora, Harmonia axyridis, Coccinella septempunctata",prey toxicity,Aphis craccivora,clone-specific,Species,between antagonism and apparent mutualism,Antagonistic to mutualistic,Toxicity to one dominant of many predator species,Predator community stability through niche differentiation,yes,,the shift if from +/- to -/-,Yes,,,,,,,,
1/8/2020 8:07:24,MA159,NC,"Observational, Experimental",Host-symbiont,"Inter-specific (>2 species), Intra-specific (within population)","Caryocar brasiliense, 47 species of mutualistic ants, herbivore termites",Plant individual-specific species richness and abundance of ants (network nestedness),Caryocar brasiliense,No,"Individuals, communities of mutualist species",between mutualism and less mutualism,Mutualistic to antagonistic,NA,Better protection from termites through higher nestness (more diverse and abundant ant communities),Yes,,Underlying reason for individuality unknown. Actual selection pressure on trait unknown. ,Yes,,,,,,,,
1/8/2020 9:57:01,MA245,PT,Modelling/theory,Competition-cooperation,Intra-specific (within population),N/A,Variability influences cooperation level (which is an evolving genetic trait),N/A,"Not really, it's all theory (though mentions speices occasionally to keep readers interested).","Individuals, Populations","Yes.  Though it's sort of interesting as the mutualism (or cooperation) level is set genetically for an individual and responds to surroundings, but will also evolve over time (which is a different type of 'shift' in the interaction over time).",Depends on what's happening with variability,Social (level of variability feeds back to influence success of a type),"The variability in the population (e.g., variation in growth rates) and the level of cooperation within it.","Yes, relates to niches.",,"No, I think it's ok to include in the review.",Yes,,,,,,,,
1/8/2020 23:46:26,MA163,LKL,"Observational, Experimental",Host-symbiont,Inter-specific (>2 species),"mountain pine beetle (MPB, Dendroctonus ponderosae Hopkins), Ophiostoma montium, Grosmannia clavigera and Leptographium longiclavatum",growth rate at different temperatures/thermal tolerance,"O. montium, G. clavigera, L. longiclavatum","Yes, variation in growth rates at different temperatures was highly heritable",,No,,NA,NA,Yes,NA,No clear shift,Maybe,There is no shift in the quality of the interaction,,,,,,,
1/9/2020 0:36:29,MA208,RR,Experimental,Competition-cooperation,Inter-specific (2 species),"Spinibarbus sinensis, qingbo - prey and Channa argus, snakehead fish- predator",NA,NA,NA,,NA,,NA,NA,NA,Na,the paper is trying to see if there is a difference in inspection behaviour or cooperation among individuals in conditions of prior predator exposure and food deprivation. the paper only says that the result of no significant difference in their behaviour could be due to inter individual differences in anti-predation strategies. There is not even direct interaction between predator and prey because the predators are caged in the experiments.,No,"There is no shift in the quality of the interaction, there is only mention of a possible inter-individual differences in anti-predation strategies as a reason for the results that came out from the experiment (result: no significant differences in inspection behaviour or cooperation in conditions of food starvation and prior predator exposure). there is also no direct interaction between predator and prey in the experiment.",,,,,,,
1/9/2020 3:17:51,MA337,PT,Review,Competition-cooperation,Intra-specific (within population),n/a,Group size and network structure,n/a,No,Individuals,Somewhat.,Depends which way the numbers are shifting,Group size & network structure,Whether the group is cooperative,"Yes, though it's not a very strong one.","The paper is not a particularly useful one.  It basically says, ""Hey, social network theory might be useful for looking at various things in behavioural ecology; (e.g., cooperation, mate-choice, predator-prey interactions, etc).  So our paper shouldn't make much use of this, but could briefly refer to what's on p980 of it.","It's really just a quick pointer to other studies, rather than particularly useful in and of itself.",Yes,,,,,,,,
1/9/2020 5:24:20,MA338,PT,Modelling/theory,Competition-cooperation,"Intra-specific (within population), Intra-specific (between populations)",n/a,behavioural phenotype,n/a,No,"Individuals, Populations","Yes, though it's more about the emergence of mutualism than antogonism.",Model; simply depends on values.,Social discrimination (which in turn depends on variability in the population),"Emergence of social grouping (into 'tribes', as the authors put it).",Yes.,,I'd not particularly say it was about antagnism -- but a useful model nonetheless.,Yes,,,,,,,,
1/9/2020 10:52:06,MA360,PT,Synthesis (supposedly!),Competition-cooperation,"Inter-specific (2 species), Intra-specific (within population), Intra-specific (between populations)",n/a,"Level of cooperation, which in turn depends on various things like relatedness, resource-generating efficiency, competition, rates of evolution of asymmetric strategies, and outside options.",All.,No,"Individuals, Populations, Species",It focuses on the cooperation side.,"As usual, both -- depends on the circumstances.",Unspecified.,"Mainly just whether they cooperate or not (though left to the reader's imagination what that means if they're more efficient at foraging, etc.","Yes, but it doesn't really get into niches.",,Mainly jsut about cooperation -- not antagonism.,Yes,,,,,,,,
1/10/2020 3:20:06,MA376,PT,Modelling/theory,Competition-cooperation,Intra-specific (within population),n/a,Foraging efficiency (p),All individuals,"No (and, somewhat weirdly, foraging efficiency seems to be assigned randomly!)",Individuals,Yes (though that depends on regarding the hawk-dove game as being between antagonists and mutualists).,"It's a model, so just depends on the values","Resource availability (and variability), level of competition. ",Just whether they compete for a found resource or not.,Not a strong one; it's tenuous at best.,,"It's not clear to me that the trait (p) values really play a crucial role; they could vary betwene 0.49 and 0.51 and still get almost the same results, so far as I understand it; so arguably much more driven by external factors than the variability of traits.. (Also, I need to understand how p gets set -- seems random but the authors mention age & experience, which I don't understand yet.)",Yes,,,,,,,,
1/10/2020 3:52:49,MA130,LKL,Review,"Host-symbiont, Competition-cooperation","Inter-specific (>2 species), Intra-specific (within population), Intra-specific (between populations)",Bark beetles (Coleoptera: Curculionidae: Scolytinae); unspecified tree hosts; competitors such as other tree-boring insects; unspecified microbial symbionts,"(tree host)defensive resin and allelochemical contents can reduce competitor of other species; (bark beetle) detoxification ability (to resist host defences), allomonal interference(deter other species/individuals to reduce inter-/intra-specific competitiveness), host choice and colonisation/gallery construction behaviours (transform tree defensive terpenoids into pheromones)",,Not clearly stated but a paper (Wallin 2002-Heritability of host acceptance and gallery construction behaviors of the bark beetle Ips pini (Coleoptera: Scolytidae)) seems relevant.,,Not clear,,NA,NA,"Yes, e.g. niche partitioning, coexistence",,no clear shift,Maybe,There is no shift in the quality of the interaction,,,,,,,
1/11/2020 1:33:00,MA48,NL,"Observational, Observers provoked antagonistic interactions between individuals",Competition-cooperation,Intra-specific (within population),"Barbary macaques, Macaca sylvanus","Age, Behavioural phenotype",Barbary macaque,no,NA,no,NA,NA,NA,no,,no clear shift in the interaction between mutualism and antagonism,No,No relevant interaction,,,,,,,
1/12/2020 0:56:04,MA281,LKL,Review,Host-symbiont,"Inter-specific (2 species), Inter-specific (>2 species)","Plant, microbes",only ,,,Species,"No, they only mentioned environmental factors can cause interactions to shift from antagonistic to mutualistic but didn't provide revenant examples. Should refer to the original paper cited (Partita-Martinez and Heil 2011- The microbe-free plant: fact or artifact?)",,No concrete samples but abiotic/ecological factors were suggested,NA,Not the review but the original papers mentioned,NA,no clear trait variations in this context of interaction shift and no clear shift in interaction,No,"There is no evidence of trait variation, There is no shift in the quality of the interaction",,,,,,,
1/12/2020 3:25:59,MA399,PT,Modelling/theory,Contibution to a goup pool,Intra-specific (within population),n/a (though the model is aimed at humans).,Rich/poor,The focal one of the model (aimed at humans),No,Individuals,Just about how much individuals will contribute to the pool (arguably a kind of cooperation),Depends whether you make the rich more poor or vice versa.,"Level of risk (i.e., how uncertain the payoff is, given a level of total contributions), uncertainty (which increases with number of players)",Just how much they contribute,Not much.,,No real antagonism -- the closest to that is to not contribute anything.,Maybe,Model is pitched at humans.,,,,,,,
1/13/2020 5:05:35,MA81,NL,Observational,Competition-cooperation,Intra-specific (within population),"Meerkats, Suricata suricatta",behavioural phenotype,"Meerkats, Suricata suricatta",no,NA,no,NA,NA,NA,yes,,no antagonistic interaction (behaving less cooperatively does not mean antagonistic),No,no relevant interaction,,,,,,,
1/16/2020 22:05:01,MA118,NM,Modelling/theory,"Host-symbiont, Consumer-resource/predator-prey, Plant-animal (pollinator-seed parasite)",Inter-specific (2 species),"NA (based on a flowering plants and an obligate pollinator/seed predator,  specifically fig wasps and fig trees or yucca moths and yucca plants)","In the animal: density, the amount of eggs it had to lay, if it was a seed parasite (so potentially traits that may vary within species); in the plant: whether pollinators needed to search for the flowers on the plant or not (different structured plants).",Potentially both plant and animal traits could vary,NA,"Species, In terms of interspecific interactions shifting",Yes ,"Mutualistic to antagonistic, Antagonistic to mutualistic","Primarily the density shifts the interaction, but the potential traits (e.g. number of eggs in the animal, plant structure relating to the need to search for flowers) changes the type of the function response",The type of functional response between the pollinator/seed-parasite and plant,Relevant to the implications of individual variation (i.e. Individual variation changes the type of functional response in an interspecific interaction),Individual based model (IBM),"The model was run based on a mutualism, but the authors state that this is analagous with seed-parasitism in pollinators so I have included it based on that increasing the rate of seed parasitism as a shift between a mutualistic pollinator and anatagostic parasite",Yes,,,,,,,,
1/17/2020 0:25:23,MA124,NM,Modelling/theory,"Competition-cooperation, Social interactions between conspecifics",Intra-specific (within population),NA (based on human cultural traits),"Cultural traits (they cite such as personal ornaments, languages, rituals, etc. but within the model it is not specified)",NA (but intended to be human),"Not necessarily inherited traits (although the model is about that), can be transmitted vertically and horizontally with conspecifics",Individuals,"Yes, possession of an arbitrary trait leads to cooperation, not having the trait leads to competition","Mutualistic to antagonistic, Antagonistic to mutualistic",Cultural differences,Resource allocation and segregation within socially interacting networks,Maintenance and evolution of novel individual behavioural traits,Gene-culture co-evolutionary model,"Issue is that it is based on human traits, but the principles should apply generally to species capable of displaying cultural traits.",Maybe,Humans as a study subject (note: this is currently being treated as an exclusion criteria),,,,,,,
1/21/2020 21:19:31,MA258,NM,Modelling/theory,Competition-cooperation,Intra-specific (within population),"NA (based on species that exhibit both a colonial and nomadic behavioural form, cites jellyfish medusae vs. polyps, and humans)","Behavioural (nomadic v individual strategy, the propensity to switch between strategies/plasticity)",NA,Not considered,"Individuals, sub-populations","Maybe, switching between colonial to nomadic strategy is considered a switch from high-competition/cooperation to low competition/cooperation, not from one to the other. Although the amount of plasticity may be seen as enhancing cooperation and reducing competition when it becomes detrimental to the population. ","Mutualistic to antagonistic, Antagonistic to mutualistic",Related to the environmental deterioration of having larger groups,long term population growth v decay,impacts of behavioral/phenotypic plasticity ,Population models,,Maybe,The issue is whether the degree of behavioral plasticity can be considered and individual trait that shifts the interactions within population between competition-cooperation (I think it possibly can) ,,,,,,,
1/21/2020 22:22:02,MA294,NM,Modelling/theory,interdependency of functions between organisms (something like cooperation),"Inter-specific (2 species), Intra-specific (between populations)",NA (designed on microbial interactions primarily),"Leaky traits (i.e. generalized traits that provide benefits to other organisms, particularly chemical production) ",NA,"The degree of privatization of 'leaky functions', i.e. the level that the benefits of the function are isolation to the organism performing the function",Model refers to strains (so could apply  to populations inter- or intraspecifically interacting),"Yes, high privatization leads to independent genotypes, low levels lead to some exploitation, intermediate levels lead to mutually interdependent genotypes ","Mutualistic to antagonistic, Antagonistic to mutualistic",the model directly manipulates the degree of function privatization,the degree of interdependency between interacting 'strains',unclear,,,Yes,,,,,,,,
1/21/2020 22:29:47,MA340,NM,Commentary,Competition-cooperation,Intra-specific (within population),NA,NA,NA,NA,,NA,,NA,NA,,,,No,"Paper is a commentary, primarily focused on definitions of cooperative behavioral and cooperative breeding",,,,,,,
1/22/2020 1:22:42,MA370,NM,Modelling/theory,"Competition-cooperation, Cooperation (in prey attack)- Disease transfer",Intra-specific (within population),NA (generalized social group. but based on group hunting social spider Stegodyphus dumicola),"Social influence (keystone individual with a high degree of influence on the behavioural composition and/ collective behaviour of a group, in the study species this is a high boldness individual)",NA,Not stated in the paper,"Individuals, Populations","Yes, shows a trade-off between positive and negative outcomes of collective behaviour that is influenced by the presence of keystone (high boldness) individuals in the group","Mutualistic to antagonistic, Antagonistic to mutualistic, A trade-off between negative and positive collective outcome implies it moves in both directions.",The persistence of behaviours within the group; the degree of behavioural influence between group members; and patterns of interactions between group members,influences the costs and benefits of collective behaviours (terms collective outcomes),shows factors influencing intraspecific social niches,,,Yes,,,,,,,,
1/22/2020 1:36:41,MA390,NM,"Modelling/theory, Review",Competition-cooperation,Intra-specific (within population),NA,Individual quality,Between individuals in an interacting social group,No,Individuals,"Only if you consider that competition inherently exist within social groups between individuals, and participating in cooperative 'helping' behavior makes inter-individual interactions more antagonistic and less mutualistic","Mutualistic to antagonistic, Antagonistic to mutualistic","The costs of helping (performance costs and opportunity costs are distinguished), and whether there are menefits of helping to the individual",Determines roles in a social group,factors influencing individual social niches,,Need a second opinion on whether is can be considered a shift towards more antagonistic interactions simply by not helping.,Maybe,"No explicitly a shift towards antagonism (due to the not participating in helping behaviour), but increased competition could be implied",,,,,,,
1/22/2020 1:53:14,MA408,NM,Review,Competition-cooperation,"Intra-specific (within population), Intra-specific (between populations)","NA (34 cas studies, each based on a variety of species examples)",Behavioural: the level of individual investment in cooperative interactions,NA,"Yes, shows examples of species where there is genetically hertiable components to investment in cooperation; suggests there is also a epigenetic component",Individuals,"Yes, suggests individuals will vary in their investment in cooperative interactions based on the costs/benefits to the individual, but also due to heritable/genetic/epigenetic amoung individual behavioural variation","Mutualistic to antagonistic, Antagonistic to mutualistic","NA, suggests that pre-existing behavioural variation in populations will influence the interaction between individuals on a cooperation-competition continuum ","""bi-parental care; cooperative breeding; cooperative hunting; and human cooperation """,individual variation influencing between individual interactions,,,Yes,,,,,,,,
1/22/2020 2:04:51,MA77,NM,Modelling/theory,Competition-cooperation,"Between cells (suggests results are applicable across scales, 'from solitary organisms to societies')",NA (designed based on single cell interactions),"NA (no separate individual, so no trait variation)",NA,implies that cells have a heritable level of among-cell cooperation,Within-Individual ,Not between organisms (only by analogy),Antagonistic to mutualistic,,,,,,No,"There is no evidence of trait variation, No trait variation between individuals (variation is within-individual)",,,,,,,
1/22/2020 2:18:17,MA83,NM,Review,Competition-cooperation,"Intra-specific (within population), Intra-specific (between populations)",NA (ranges from evolution of muticellularity to human societies),No intraspecific trait that appears to very,NA,,,,,,,,,,No,"There is no evidence of trait variation, Only briefly mentions a paper (Couzin 2005) that may be relevant. Otherwise, not on our topic.",,,,,,,
