abstract.id,row.id,TaskforceAllocation,FulltextTopicIdentifier,FulltextReviewer.initial,title,author,journal,volume,number,pages,year,doi,Timestamp,FulltextReviewer,StudyType,InteractionType,Scale,SpeciesInteracting,TraitDescription,SpeciesTraitVariation,GeneticNotes,What.is.the.scale.of.the.shift,Is.there.a.shift.in.the.interaction,What.is.the.direction.of.shift,What.factors.are.driving.that.shift,What.is.the.ecological.impact.of.the.interaction.and.shift.of.that.interaction,Is.there.a.connection.to.the.NC3,Reviewer.notes,Reviewer.outstanding.concerns,ReviewerDecision,ReviewerDecisionReason,ReviewerDecision.checked.by,FinalDecision,FinalDecisionReason,FinalDecisionNotes
MA197,87,Intraspecific,competition-cooperation,UE,Individual and genetic task specialization in policing behaviour in the European honeybee,"Ernst, U.R. and Cardoen, D. and Cornette, V. and Ratnieks, F.L.W. and de Graaf, D.C. and Schoofs, L. and Verleyen, P. and Wenseleers, T.",Animal Behaviour,128,NA,95-102,2017,10.1016/j.anbehav.2017.04.005,02/05/2020 05:11,UE,Experimental,Competition-cooperation,Intra-specific (within population),Apis mellifera,policing behaviour,Apis mellifera,yes; patriline specialisation,"Individuals, patrilines",no,"Not really a shift; some patrilines do police more than others, but most likely all do",NA,None,"yes; indiviudal differences, patriline differences",NA,NA,No,There is no shift in the quality of the interaction,MW/NM,pending,,"[NM: I think it should be included, as this is about policing non-cooperative behaviours, which fits in with systematic mechanisms controlling shifts between cooperation and competition in social groups (we have also included 2 other papers about policing, MA286, MS297)]"
MA32,14,Intraspecific,competition-cooperation,BC,"Behavioural type, status and social context affect behaviour and resource allocation in cooperatively breeding cichlids","Riebli, Thomas and Taborsky, Michael and Chervet, Noemie and Apolloni, Nadine and Zuercher, Yvonne and Heg, Dik",ANIMAL BEHAVIOUR,84,4,925-936,2012,10.1016/j.anbehav.2012.07.017,11/24/2019 20:11:38,BC,Experimental,Competition-cooperation,Intra-specific (within population),Neolamprologus pulcher,body size,Neolamprologus pulcher,,Individuals,no,no shift,NA,NA,no,NA,no,No,"There is no evidence of trait variation, There is no shift in the quality of the interaction",MW/NM,pending,,"[NM: I think it may be included, as behavioural trait variation (aggression), is influencing social interactions where competition and cooperation covary]"
MA48,23,Intraspecific,competition-cooperation,NL,Coalitions destabilize dyadic dominance relationships in male Barbary macaques (Macaca sylvanus),"Berghaenel, Andreas and Ostner, Julia and Schuelke, Oliver",BEHAVIOUR,148,Nov-13,1257-1275,2011,10.1163/000579511X600628,01/11/2020 01:33,NL,"Observational, Observers provoked antagonistic interactions between individuals",Competition-cooperation,Intra-specific (within population),"Barbary macaques, Macaca sylvanus","Age, Behavioural phenotype",Barbary macaque,no,NA,no,NA,NA,NA,no,,no clear shift in the interaction between mutualism and antagonism,No,No relevant interaction,MW/NM,pending,,"[NM: I think it may be included, you could consider variation in size/power with age decreases the likelihood of cooperative relationships forming with other males, in the context of competition for dominance]"
MA264,117,Interspecific,host-symbiont,RR,Ontogenetic shifts in a freshwater cleaning symbiosis: consequences for hosts and their symbionts,"Thomas, Michael J. and Creed, Robert P. and Skelton, James and Brown, Bryan L.",ECOLOGY,97,6,1507-1517,2016,10.1890/15-1443.1,12/27/2019 8:49:51,RR,Experimental,Host-symbiont,Inter-specific (>2 species),Cambarus bartonii (cray fish) and Cambarincola philadelphicus and Cambarincola ingens (  branchiobdellidan annelids ),size or ontogenic stage,host (cray fish),"No, it is about the variation in size at different life stages",the symbiont composition changes with the size difference at different life changes.,the study shows a rapid removal rate of the worms by smaller hosts. ALso there was  gill scarring by the worms on the hosts but dont have a net negative effect.But in general it is stated about the interaction that the worms can turn parasites when there is food limitation.,the dominating symbiotic species changes with host ontogeny due to removal of the symbiont species by host differentially at different life stages.,the shift in symbiont composition was due to ability of the symbionts to avoid removal by host which inturn depends on the size of the specific symbiont species and the specific life stage (size) of the host,no such information obtained from the paper,no,,,No,"The trait varies between species, not within-species",MW/NM,pending,,"[NM: I think it may be included, as there is an interaction (host-symbiont), variation (body size), and in smaller crayfish Cambarincola philadelphicus did some damage to the host (mutualistic interaction became more antagonistic). It is not the primary focus, and not a super clear shift, but it does seem like the symbionts can become damaging parasites depending on the size/state of the host car]"
MA345,154,Modelling,n/a,KJB,Spatial evolutionary dynamics produce a negative cooperation-population size relationship,"Tekwa, Edward W. and Gonzalez, Andrew and Loreau, Michel",THEORETICAL POPULATION BIOLOGY,125,NA,94-101,2019,10.1016/j.tpb.2018.12.003,2/15/2020 10:23:58,KJB,Modelling/theory,Competition-cooperation,Intra-specific (within population),NA,"Discrete types, cooperator type and defector type",NA,NA,Populations,"Yes, abiotic factors (degree of clustering) affect whether cooperators are maintained in the population.",Antagonistic to mutualistic,Abiotic,Population density,"Maybe, there are two discrecte types that can be maintained.",NA,No clear connection between trait *variation* and interaction.,No,There is no evidence of trait variation,MW/NM,pending,,"[NM: I think it may be included, considing the trait to be the 'level of movement', It just really seems relevant enough]"
MA371,166,Modelling,n/a,KJB,The effects of behavioral plasticity and leadership on the predictions of optimal skew models,"Hamilton, Ian M.",BEHAVIORAL ECOLOGY,24,2,444-456,2013,10.1093/beheco/ars182,2/15/2020 7:14:52,KJB,Modelling/theory,Group persistence,Intra-specific (within population),NA,model 1 : Share of group productivity allocated to partner and partner's threshold for group dissolution. Model 2: competitive ability of both partners,"The traits don't really vary (multiple trait values are being considered, but populations with multiple trait values in them at the same time are not)","No, although relatedness is taken as a parameter.",Individuals,Not in the sense that we are looking for. Group dissolution is discussed though as the outcome of an interaction.,Mutualistic to antagonistic,The willingness to share the group productivity.,unknown,"Yes, in the sense that the paper distinguishes two types of individuals that play different roles (leaders and subordinates).",NA,No,No,There is no evidence of trait variation,MW/NM,pending,,"[NM: I think it may be included, as there is intraspecific variation (among groups) in trait values, and resulting changes in reproductive skew could be interpreted as variation in the cooperation-competition relationship between group members.]"
MA28,13,Intraspecific,competition-cooperation,BC,"Bargaining power and adolescent aggression: the role of fighting ability, coalitional strength, and mate value","Sell, Aaron and Eisner, Manuel and Ribeaud, Denis",EVOLUTION AND HUMAN BEHAVIOR,37,2,105-116,2016,10.1016/j.evolhumbehav.2015.09.003,11/24/2019 20:01:29,BC,testing hypothesis on an existing observational data set,Competition-cooperation,Intra-specific (within population),Homo sapiens,"fighting ability, coalitional strength, and mate value",humans,no,Individuals,"no, coalitional strength and fighting ability (i.e. bargaining power) correlates with aggressive behaviour",no shift present,NA,NA,"perhaps, individual variation in bargaining power and aggression ","It does report coalition strength (mutualism) and aggression (antagonism), but there is no shift, both traits correlate positively,  ",no,Yes,Humans as a study subject (note: this is currently being treated as an exclusion criteria),MW/NM,pending,,"[NM: This will be excluded, as empirical studies on humans are being excluded (note, modelling, theory studies that are based on humans but are generalisable may be included)]"
MA351,155,Interspecific,host-symbiont,NC,State-dependent parasitism by a facultative parasite of fruit flies,"Luong, L.T. and Brophy, T. and Stolz, E. and Chan, S.J.",Parasitology,144,11,1468-1475,2017,10.1017/S0031182017000890,01/06/2020 09:07,NC,Experimental,Consumer-resource/predator-prey,Inter-specific (2 species),"Macrocheles subbadius, Drosophila nigrospiracula","Starvation, mating status of mite, previous infection and injury of host",both,No,Individuals,"Yes, from free-living to antagonism/parasitism",Mutualistic to antagonistic,"Ecological, resource-availability",Increase of parasitism,Yes,,Shift is from neutral to antagonism and is resource-availability/demand -driven,Yes,,MW/NM,pending,,"[NM: I would exclude as no evidence of variation in mutualism (only anagonistic variation, not along the m-a continuum)]"
MA359,159,Modelling,n/a,KJB,Symbiotic sympatric speciation through interaction-driven phenotype differentiation,"Kaneko, K and Yomo, T",EVOLUTIONARY ECOLOGY RESEARCH,4,3,317-350,2002,NA,02/04/2020 06:33,KJB,Modelling/theory,Competition-cooperation,"Inter-specific (2 species), Intra-specific (within population), Moving from one species to multiple",NA,Competititive similarity,All,"Heritability is initially low, but later increases (as a product of the model)",Individuals,"Yes (competition decreases, the paper is between neutral and antagonistic)",Antagonistic to less antagonistic,Avoiding similarity to decrease competitive pressure,Speciation,Individuals develop different genotypes to fit their self-formed niche.,,"Mutualism doesn't seem to appear.Also, the notation was hard to follow, unsure if I understood the paper fully.",Yes,,MW/NM,pending,,"[NM: I would exclude as no evidence of variation in mutualism (only anagonistic variation, not along the m-a continuum)]"
MA159,73,Interspecific,plant-animal,NC,From species to individuals: does the variation in ant-plant networks scale result in structural and functional changes?,"Koch, Elmo B. A. and Dattilo, Wesley and Camarota, Flavio and Vasconcelos, Heraldo L.",POPULATION ECOLOGY,60,4,309-318,2018,10.1007/s10144-018-0634-5,01/08/2020 08:07,NC,"Observational, Experimental",Host-symbiont,"Inter-specific (>2 species), Intra-specific (within population)","Caryocar brasiliense, 47 species of mutualistic ants, herbivore termites",Plant individual-specific species richness and abundance of ants (network nestedness),Caryocar brasiliense,No,"Individuals, communities of mutualist species",between mutualism and less mutualism,Mutualistic to antagonistic,NA,Better protection from termites through higher nestness (more diverse and abundant ant communities),Yes,,Underlying reason for individuality unknown. Actual selection pressure on trait unknown.,Yes,,MW/NM,pending,,"[NM: I would exclude as no evidence of variation in antagonism (only mutualistic variation, not along the m-a continuum)]"
MA198,88,Intraspecific,male-female,JW,Individual contributions to territory defence in a cooperative breeder: weighing up the benefits and costs,"Mares, Rafael and Young, Andrew J. and Clutton-Brock, Tim H.",PROCEEDINGS OF THE ROYAL SOCIETY B-BIOLOGICAL SCIENCES,279,1744,3989-3995,2012,10.1098/rspb.2012.1071,1/28/2020 22:40:50,JW,Observational,Competition-cooperation,Intra-specific (within population),Meerkats (Suricata suricatta),individual differences in cooperative contributions to territory defence,Meerkats (Suricata suricatta),NA,Individuals,Slight shift in amount contributed to territory defense,Antagonistic to mutualistic,"Tradeoffs in investment between different cooperative behaviors (i.e., territory defense vs pup feeding rates)",Group genetic diversity and reproductive success of individuals,Yes,NA,No,Yes,,MW/NM,pending,,"[NM: I would exclude as no evidence of variation in antagonism (only mutualistic variation, not along the m-a continuum)]"
MA352,156,Intraspecific,competition-cooperation,ET,State-dependent sentinels: an experimental study in the Arabian babbler,"Wright, J and Maklakov, AA and Khazin, V",PROCEEDINGS OF THE ROYAL SOCIETY B-BIOLOGICAL SCIENCES,268,1469,821-826,2001,10.1098/rspb.2000.1574,11/22/2019 2:10:34,ET,Experimental,Competition-cooperation,Intra-specific (within population),Argya squamiceps,Sentinel behaviour,Argya squamiceps,"It's a species trait, so it's inherited",Individuals,"It's rather a shift toward altruism. But if we assume mutualism=altruism and non-altruism=antagonism, then yes.","Mutualistic to antagonistic, Antagonistic to mutualistic","Resource use, Body size",Colony survival,"Yes, it describes individual differences",Increased body size leads to increased sentinel behaviour (and vice versa),,Yes,,MW/NM,pending,,"[NM: I would exclude as no evidence of variation in antagonism (only mutualistic variation, not along the m-a continuum)]"
MA209,97,Interspecific,host-symbiont,RR,Inter individual variations of the fish skin microbiota: Host genetics basis of mutualism?,"Boutin, S. and Sauvage, C. and Bernatchez, L. and Audet, C. and Derome, N.",PLoS ONE,9,7,NA,2014,10.1371/journal.pone.0102649,12/29/2019 23:07:48,RR,Experimental,Host-symbiont,Inter-specific (>2 species),brook charr (Salvelinus fontinalis) and their skin microbiota (different bacteria)),"No such trait mentioned, it is about the possible regulation of the abundance of specific genera of skin microbiota by the genotype of host (brook charr).",,the paper reports that the genotype of host (brook charr) may regulate the abundance of specific genera of skin microbiota.,There is possible regulation of the abundance of the genera of skin microbiota according to the genotype of host and some of the genera can provide protection for the host from pathogens.,The study reports about a possible genetic basis of mutualism between the host and the commensal skin microbiota,"depending on host genotype, possible change from commensalism to mutualism",genotype of host,no such information provided,"yes, it mentions about potenial genetic basis of hosts for mutualism between the host and its commensal skin microbiota.",,,Yes,,MW/NM,pending,,"[NM: I would exclude as no evidence of variation in antagonism (only mutualistic-commensal variation, not along the m-a continuum)]"
MA175,80,Interspecific,predator-prey,NC,Heritable variation in prey defence provides refuge for subdominant predators,"Lenhart, Paul A. and Jackson, Kelly A. and White, Jennifer A.",PROCEEDINGS OF THE ROYAL SOCIETY B-BIOLOGICAL SCIENCES,285,1879,NA,2018,10.1098/rspb.2018.0523,01/08/2020 07:33,NC,Experimental,Consumer-resource/predator-prey,Inter-specific (>2 species),"Aphis craccivora, Harmonia axyridis, Coccinella septempunctata",prey toxicity,Aphis craccivora,clone-specific,Species,between antagonism and apparent mutualism,Antagonistic to mutualistic,Toxicity to one dominant of many predator species,Predator community stability through niche differentiation,yes,,the shift if from +/- to -/-,Yes,,MW/NM,pending,,"[NM: I think it may be excluded, as I don't see how intraspecific variation in a species influences an interaction of that species (only the 3rd party interactions). This is >2 species system where intraspecific variation in a prey species effects competive relationship between predator species, and this kind of indirect benefit does not really sound like variation along the m-a continuum]"
MA396,181,Interspecific,host-symbiont,JW,"Traps of carnivorous pitcher plants as a habitat: Composition of the fluid, biodiversity and mutualistic activities","Adlassnig, W. and Peroutka, M. and Lendl, T.",Annals of Botany,107,2,181-194,2011,10.1093/aob/mcq238,1/30/2020 1:12:15,JW,Observational,Host-symbiont,Inter-specific (>2 species),"Carnivorous pitcher plants (Genus: Nepenthes, Sarracenia, Heliamphora, Darlingtonia, Cephalotus, Brocchinia, Catopsis, Paepalanthus) and their pitcher inquilines (organisms that inhabit pitcher plants)",composition of pitcher fluid,"Carnivorous pitcher plants (Genus: Nepenthes, Sarracenia, Heliamphora, Darlingtonia, Cephalotus, Brocchinia, Catopsis, Paepalanthus)",Much variation in fluid composition is between species,"Individuals, Species",Yes,Antagonistic to mutualistic,"Ecological, chemical (abiotic)",food webs and pitcher fluid communities,Yes,NA,No,Yes,,MW/NM,pending,,"[NM: I think it may be excluded, I am unsure if there is enough evidence of within-species variation (although there is definitely some intraspecific variation: 'In Nepenthes sp., for example, the pH of the pitcher fluid decreases a few days after prey capture, when the number of bacteria has reached its maximum, in order to inhibit further bacterial growth (Higashi et al., 1993).')]"
MA62,28,Modelling,n/a,NM,COMPETITION VERSUS COOPERATION - SUCCESS OF INDIVIDUALS FORAGING ALONE AND IN GROUPS,"RANTA, E and RITA, H and LINDSTROM, K",AMERICAN NATURALIST,142,1,42-58,1993,10.1086/285528,11/15/2019 14:10:29,NM,Modelling/theory,"Competition-cooperation, Cooperation in group foraging behaviour",Intra-specific (within population),NA (based on the behaviour of the three-spined stickleback (Gasterosteus aculeatus)),Social rank within the group using the probability of an individual's being among the ones sharing the food in a patch found by the group (also termed competitive ability);,"NA (general, modelling)",NA,Individuals,"Yes, decrease in social status reduced the benefits of cooperation and pushes individual towards more solitary behaviour",Mutualistic to antagonistic,Variation in the individual benefits of group foraging for the individual,"Collective behaviour, within-population foraging dynamics",Shows factors the drive behaviour in a group towards greater individualization and niche differentiation.,Information-sharing model,No,Yes,,MW,pending,,
MA67,30,Modelling,n/a,NM,Complex network representation of multiagent systems with cooperative and competitive interactions,"Caram, L.F. and Caiafa, C.F. and Proto, A.N.","AAPP Atti della Accademia Peloritana dei Pericolanti, Classe di Scienze Fisiche, Matematiche e Naturali",92,NA,NA,2014,10.1478/AAPP.92S1B2,11/28/2019 11:06:57,NM,Modelling/theory,"Competition-cooperation, Based on predator-prey models, with agent competing/cooperating for common resources","Non-specific, interactions between individual organisms, potentially inter- or intraspecific",NA,"size (an abstract property of the agents, but analogies could be drawn with body size, it is a enhanced by resources gained and impacts capacity for resource acquisition)",NA,NA,Individuals,"Unclear, it shows competitive and cooperative scenarios that arise from different initial model conditions, not necessarily from the agent 'trait' variability which only determines the strength (not direction) of the interaction",NA,Imposed model parameters,Resource distribution among competing-cooperating agents,Modelling the formation and maintenance of individualised niches,Modified Lotka-Volterra model of n interacting agents,"Yes, the shift in quality of the interaction arises from model parameters, not from individual 'traits' of agents",Maybe,"modelling with individual traits incorporated appears relevant, but the shift in the direction of the interaction is due to an imposed model parameter (lean exclude)",MW,pending,,
MA77,36,Modelling,n/a,NM,Cooperation and conflict in the evolution of individuality .1. Multilevel selection of the organism,"Michod, RE",AMERICAN NATURALIST,149,4,607-645,1997,10.1086/286012,1/22/2020 2:04:51,NM,Modelling/theory,Competition-cooperation,"Between cells (suggests results are applicable across scales, 'from solitary organisms to societies')",NA (designed based on single cell interactions),"NA (no separate individual, so no trait variation)",NA,implies that cells have a heritable level of among-cell cooperation,Within-Individual,Not between organisms (only by analogy),Antagonistic to mutualistic,,,,,,No,"There is no evidence of trait variation, No trait variation between individuals (variation is within-individual)",MW,pending,,"[NM: We have included some other similar papers from Michod and others (MA43, MA73, MA263), although I initially excluded this one because the focus is on cellular conflict within an oraganism. It says that the findings are transferable across scales, so guess it could be included, but is a bit more of a stretch than the others.]"
MA83,41,Modelling,n/a,NM,"Crossing scales, crossing disciplines: Collective motion and collective action in the Global Commons","Levin, S.",Philosophical Transactions of the Royal Society B: Biological Sciences,365,1537,13-18,2010,10.1098/rstb.2009.0197,1/22/2020 2:18:17,NM,Review,Competition-cooperation,"Intra-specific (within population), Intra-specific (between populations)",NA (ranges from evolution of muticellularity to human societies),No intraspecific trait that appears to very,NA,,,,,,,,,,No,"There is no evidence of trait variation, Only briefly mentions a paper (Couzin 2005) that may be relevant. Otherwise, not on our topic.",MW,pending,,
MA118,57,Modelling,n/a,NM,Emergence of ratio-dependent and predator-dependent functional responses for pollination mutualism and seed parasitism,"DeAngelis, DL and Holland, JN",ECOLOGICAL MODELLING,191,03-Apr,551-556,2006,10.1016/j.ecolmodel.2005.06.005,1/16/2020 22:05:01,NM,Modelling/theory,"Host-symbiont, Consumer-resource/predator-prey, Plant-animal (pollinator-seed parasite)",Inter-specific (2 species),"NA (based on a flowering plants and an obligate pollinator/seed predator,  specifically fig wasps and fig trees or yucca moths and yucca plants)","In the animal: density, the amount of eggs it had to lay, if it was a seed parasite (so potentially traits that may vary within species); in the plant: whether pollinators needed to search for the flowers on the plant or not (different structured plants).",Potentially both plant and animal traits could vary,NA,"Species, In terms of interspecific interactions shifting",Yes,"Mutualistic to antagonistic, Antagonistic to mutualistic","Primarily the density shifts the interaction, but the potential traits (e.g. number of eggs in the animal, plant structure relating to the need to search for flowers) changes the type of the function response",The type of functional response between the pollinator/seed-parasite and plant,Relevant to the implications of individual variation (i.e. Individual variation changes the type of functional response in an interspecific interaction),Individual based model (IBM),"The model was run based on a mutualism, but the authors state that this is analagous with seed-parasitism in pollinators so I have included it based on that increasing the rate of seed parasitism as a shift between a mutualistic pollinator and anatagostic parasite",Yes,,MW,pending,,
MA124,60,Modelling,n/a,NM,Evolution of culture-dependent discriminate sociality: A gene-culture coevolutionary model,"Ihara, Y.",Philosophical Transactions of the Royal Society B: Biological Sciences,366,1566,889-900,2011,10.1098/rstb.2010.0247,1/17/2020 0:25:23,NM,Modelling/theory,"Competition-cooperation, Social interactions between conspecifics",Intra-specific (within population),NA (based on human cultural traits),"Cultural traits (they cite such as personal ornaments, languages, rituals, etc. but within the model it is not specified)",NA (but intended to be human),"Not necessarily inherited traits (although the model is about that), can be transmitted vertically and horizontally with conspecifics",Individuals,"Yes, possession of an arbitrary trait leads to cooperation, not having the trait leads to competition","Mutualistic to antagonistic, Antagonistic to mutualistic",Cultural differences,Resource allocation and segregation within socially interacting networks,Maintenance and evolution of novel individual behavioural traits,Gene-culture co-evolutionary model,"Issue is that it is based on human traits, but the principles should apply generally to species capable of displaying cultural traits.",Maybe,Humans as a study subject (note: this is currently being treated as an exclusion criteria),MW,pending,,[NM: This should now be includable because it is a model that may apply to non-human species]
