"label","title","author","journal","issn","volume","number","pages","year","doi","abstract","n_duplicates"
"X.ISI.000317472000022","The effects of behavioral plasticity and leadership on the predictions of optimal skew models","Hamilton, Ian M.","BEHAVIORAL ECOLOGY","1045-2249","24","2","444-456","2013","10.1093/beheco/ars182","Skew models predict how reproduction or resources produced by the group are divided between dominant and subordinate group members. These include transactional models, in which one group member may allocate some group productivity to another to prevent group dissolution and tug-of-war inefficiency models, in which group members compete for access to resources at a cost to group productivity. Although skew models involve a transactional or competitive interaction among group members, most existing models do not allow individuals to respond to new information about the strategy of their group mate. Here, I expand transactional and tug-of-war models to allow one individual (the follower) to respond plastically to a fixed strategy of its partner (the leader). I solve for the Stackelberg equilibrium conditions for each model. For the transactional model, leadership results in a greater share of group productivity to the leader compared with models that do not include leadership. When the follower's information about the leader's strategy is perfect, the equilibrium division of productivity does not vary with relatedness, in contrast to the predictions of previous skew models, and the effects of ecological variables may change. In the tug-of-war model, leadership influences equilibrium investment in competition only if relatedness is greater than zero. Dominant leaders receive a larger share of group productivity, but group productivity declines and grouping is mutually beneficial over a smaller parameter range than in the absence of leadership. Subordinate leaders receive a smaller share of group productivity, but benefit from overall higher group productivity.",2
"X.ISI.000315467700008","Does prey mobility affect niche width and individual specialization in hunting wasps? A network-based analysis","Polidori, Carlo and Santoro, Davide and Bluethgen, Nico","OIKOS","0030-1299","122","3","385-394","2013","10.1111/j.1600-0706.2012.20387.x","Niche width and inter-individual diet variation in predator populations are known to be affected by intrinsic factors such as body size, age, cognitive constraints, and by intra- and interspecific competition. By contrast, how variation in prey biological traits may affect niche width and partitioning is still a poorly explored topic. One of these candidate traits is prey mobility, which can affect the predators' niche because acting on the rate of encounter and, assuming mobility as a proxy for escape capability, on the success of predator attacks. Here we analysed 20 wasp populations and their prey as individual-based food-webs to test if prey mobility may explain niche width (here defined by the Shannon entropy-based index ) and patterns of inter-individual diet variation (here defined by the interaction-exclusiveness index H2 and the interaction evenness index E2). Niche width was very variable among populations and overall network specialization (H2) was always higher than the expected by null models. In case of high-speed flying prey (e.g. flies, bees), wasps showed wider niches () and lower specialization (H2) than in case of non-flying or slow-flying prey (e.g. spiders, beetles). Evenness (E2), on the other side, did not vary with prey mobility. Altogether, these results suggest that highly elusive prey may lead to wider predators' niche but somehow limit their individual niche specialization.",2
"X.ISI.000313509400010","Experimental evolution of multicellularity using microbial pseudo-organisms","Queller, David C. and Strassmann, Joan E.","BIOLOGY LETTERS","1744-9561","9","1",NA,"2013","10.1098/rsbl.2012.0636","In a major evolutionary transition to a new level of organization, internal conflicts must be controlled before the transition can truly be successful. One such transition is that from single cells to multicellularity. Conflicts among cells in multicellular organisms can be greatly reduced if they consist of genetically identical clones. However, mutations to cheaters that experience one round of within-individual selection could still be a problem, particularly for certain life cycles. We propose an experimental evolution method to investigate this issue, using micro-organisms to construct multicellular pseudo-organisms, which can be evolved under different artificial life cycles. These experiments can be used to test the importance of various life cycle features in maintaining cooperation. They include structured reproduction, in which small propagule size reduces within-individual genetic variation. They also include structured growth, which increases local relatedness within individual bodies. Our method provides a novel way to test how different life cycles favour cooperation, even for life cycles that do not exist.",2
"X.ISI.000314366900009","The Ecological Perspective of Microbial Communities in Two Pairs of Competitive Hawaiian Native and Invasive Macroalgae","Wang, Xin and Liu, Xianhua and Kono, Shoko and Wang, Guangyi","MICROBIAL ECOLOGY","0095-3628","65","2","361-370","2013","10.1007/s00248-012-0144-5","Marine macroalgae are known to harbor large populations of microbial symbionts, and yet, microbe symbiosis in invasive macroalgae remains largely unknown. In this study, we applied molecular methods to study microbial communities associated with two invasive algae Acanthophora spicifera and Gracilaria salicornia and the two native algae Gracilaria coronopifolia and Laurencia nidifica at spatial and temporal scales in Hawaiian coral reef ecosystems. Bacterial communities of both the invasive and native macroalgae displayed little spatial and temporal variations, suggesting consistent and stable bacterial associations with these macroalgae. Results of this study identified three types of bacterial populations: nonspecific (present in both algal and water samples); algae-specific (found in all algal species); and species-specific (only found in individual species). The bacterial diversity of invasive algae was lower than that of their native counterparts at phylum and species levels. Notably, the vast majority (71 \%) of bacterial communities associated with the invasive algae G. salicornia were representatives of Cyanobacteria, suggesting a potential ecological significance of symbiotic Cyanobacteria.",2
"X.ISI.000314366900023","Does the Reproductive Strategy Affect the Transmission and Genetic Diversity of Bionts in Cyanolichens? A Case Study Using Two Closely Related Species","Otalora, Monica A. G. and Salvador, Clara and Martinez, Isabel and Aragon, Gregorio","MICROBIAL ECOLOGY","0095-3628","65","2","517-530","2013","10.1007/s00248-012-0136-5","Observed levels of population genetic diversity are often associated with differences in species dispersal and reproductive strategies. In symbiotic organisms, the genetic diversity level of each biont should also be highly influenced by biont transmission. In this study, we evaluated the influence of the reproductive strategies of cyanolichen species on the current levels of population genetic diversity of bionts. To eliminate any phylogenetic noise, we selected two closely related species within the genus Degelia, which only differ in their reproductive systems. We sampled all known populations of both species in central Spain and genotyped the fungal and cyanobacterial components of lichen samples using DNA sequences as molecular markers. We applied population genetics approaches to evaluate the genetic diversity and population genetic structure of the symbiotic components of both lichen species. Our results indicate that fungal and cyanobiont genetic diversity is highly influenced by the reproductive systems of lichen fungus. We detected higher bionts genetic diversity values in the sexual species Degelia plumbea. By contrast, the levels of fungal and cyanobiont genetic diversity in the asexual species Degelia atlantica were extremely low (almost clonal), and the species shows a high specificity towards its cyanobiont. Our results indicate that reproduction by vegetative propagules, in species of the genus Degelia, favors vertical transmission and clonality, which affects the species' capacity for resources and competition, thereby limiting the species to restricted niches.",2
"X.ISI.000311943100014","Harsh childhood environmental characteristics predict exploitation and retaliation in humans","McCullough, Michael E. and Pedersen, Eric J. and Schroder, Jaclyn M. and Tabak, Benjamin A. and Carver, Charles S.","PROCEEDINGS OF THE ROYAL SOCIETY B-BIOLOGICAL SCIENCES","0962-8452","280","1750",NA,"2013","10.1098/rspb.2012.2104","Across and within societies, people vary in their propensities towards exploitative and retaliatory defection in potentially cooperative interaction. We hypothesized that this variation reflects adaptive responses to variation in cues during childhood that life will be harsh, unstable and short-cues that probabilistically indicate that it is in one's fitness interests to exploit co-operators and to retaliate quickly against defectors. Here, we show that childhood exposure to family neglect, conflict and violence, and to neighbourhood crime, were positively associated for men (but not women) with exploitation of an interaction partner and retaliatory defection after that partner began to defect. The associations between childhood environment and both forms of defection for men appeared to be mediated by participants' endorsement of a `code of honour'. These results suggest that individual differences in mutual benefit cooperation are not merely due to genetic noise, random developmental variation or the operation of domain-general cultural learning mechanisms, but rather, might reflect the adaptive calibration of social strategies to local social-ecological conditions.",2
"X.ISI.000311433600008","Effects of social immunity and unicoloniality on host-parasite interactions in invasive insect societies","Ugelvig, Line V. and Cremer, Sylvia","FUNCTIONAL ECOLOGY","0269-8463","26","6","1300-1312","2012","10.1111/1365-2435.12013","1. Social insects have a very high potential to become invasive pest species. Here, we explore how their social lifestyle and their interaction with parasites may contribute to this invasive success. 2. Similar to solitary species, parasite release followed by the evolution of increased competitive ability can promote establishment of introduced social insect hosts in their introduced range. 3. Genetic bottlenecks during introduction of low numbers of founder individuals decrease the genetic diversity at three levels: the population, the colony and the individual, with the colony level being specific to social insects. Reduced genetic diversity can affect both the individual immune system and the collective colony-level disease defences (social immunity). Still, the dual immune system is likely to make social insects more robust to parasite attack. 4. Changes in social structure from small, family-based, territorially aggressive societies in native populations towards huge networks of cooperating nests (unicoloniality) occur in some invasive social insects, for example, most invasive ants and some termites. 5. Unicoloniality is likely to affect disease dynamics in multiple ways. The free exchange of individuals within the population leads to an increased genetic heterogeneity among individuals of a single nest, thereby decreasing disease transmission. However, the multitude of reproductively active queens per colony buffers the effect of individual diseased queens and their offspring, which may result in a higher level of vertical disease transmission in unicolonial societies. Lastly, unicoloniality provides a competitive advantage over native species, allowing them to quickly become the dominant species in the habitat, which in turn selects for parasite adaptation to this common host genotype and thus eventually a high parasite pressure. 6. Overall, invasions by insect societies are characterized by general features applying to all introduced species, as well as idiosyncrasies that emerge from their social lifestyle. It is important to study these effects in concert to be able to develop efficient management and biocontrol strategies.",2
"X.ISI.000313606500006","Host-parasite dynamics lead to mixed cooperative games","Stopka, Pavel and Johnson, Dominic D. P.","FOLIA ZOOLOGICA","0139-7893","61","3-4","233-238","2012",NA,"Although the Prisoner's dilemma is a leading metaphor for the evolution of sociality, only a few studies demonstrate that this game indeed operates in nature. We offer an alternative perspective, in which parasites and their hosts are used as a model system, suggesting that Prisoner's dilemma may be rare due to different individuals experiencing variation in the payoffs they receive from alternative strategies. Ectoparasites (such as fleas) move stochastically between hosts, causing differential parasite burdens. The resulting variance in the need for cooperation - in this case cooperative allogrooming - means that payoffs for different strategies (e.g. cooperate and defect) are not fixed. Our simulations revealed that due to parasite dynamics, cooperation among hosts conforms to a mixture of two games: Mutualism and Cruel Bind, both of which are more likely to coerce individuals into mutual cooperation than Prisoner's dilemma. Though interesting, Prisoner's dilemma is in fact the least likely scenario. If payoff variation is common, the dominance of the Prisoner's dilemma paradigm may have made us unnecessarily puzzled by cooperation in nature.",2
"X.ISI.000310554300008","Ecological effects on gut bacterial communities in wild bumblebee colonies","Koch, Hauke and Cisarovsky, Gabriel and Schmid-Hempel, Paul","JOURNAL OF ANIMAL ECOLOGY","0021-8790","81","6","1202-1210","2012","10.1111/j.1365-2656.2012.02004.x","1. Animal hosts harbour diverse and often specific bacterial communities (microbiota) in their gut. These microbiota can provide crucial services to the host such as aiding in digestion of food and immune defence. However, the ecological factors correlating with and eventually shaping these microbiota under natural conditions are poorly understood. 2. Bumblebees have recently been shown to possess simple and highly specific microbiota. We here examine the dynamics of these microbiota in field colonies of the bumblebee Bombus terrestris over one season. The gut bacteria were assessed with culture-independent methods, that is, with terminal restriction fragment length profiles of the 16S rRNA gene. 3. To further understand the factors that affect the microbiota, we experimentally manipulated field-placed colonies in a fully factorial experiment by providing additional food or by priming the workers immune system by injecting heat-killed bacteria. We furthermore looked at possible correlates of diversity and composition of the microbiota for (i) natural infections with the microbial parasites Crithidia bombi and Nosema bombi, (ii) bumblebee worker size, (iii) colony identity, and (iv) colony age. 4. We found an increase in diversity of the microbiota in individuals naturally infected with either C. bombi or N. bombi. Crithidia bombi infections, however, appear to be only indirectly linked with higher microbial diversity when comparing colonies. The treatments of priming the immune system with heat-killed bacteria and additional food supply, as well as host body size, had no effect on the diversity or composition of the microbiota. Host colony identity had only a weak effect on the composition of the microbiota at the level of resolution of our method. We found both significant increases and decreases in the relative abundance of selected bacterial taxa over the season. 5. We present the first study on the ecological dynamics of gut microbiota in bumblebees and identify parasite infections, colony identity and colony age as important factors influencing the diversity and composition of the bacterial communities. The absence of an effect of our otherwise effective experimental treatments suggests a remarkable ability of the host to maintain a homoeostasis in this community under widely different environments.",2
"X.ISI.000310266600004","The role of frugivory in the diversification of bats in the Neotropics","Rojas, Danny and Vale, Angel and Ferrero, Victoria and Navarro, Luis","JOURNAL OF BIOGEOGRAPHY","0305-0270","39","11","1948-1960","2012","10.1111/j.1365-2699.2012.02709.x","Aim Ecological interactions are among the most important biotic factors influencing the processes of speciation and extinction. Our aim was to test whether diversification rates of New World Noctilionoidea bats are associated with specialization for frugivory, and how this pattern differs between the mainland and the West Indies. Location The New World. Methods We reconstructed a time-calibrated molecular phylogenetic hypothesis for the New World genera of the superfamily Noctilionoidea. We compiled data on diet, morphology, geographical distribution and number of ecoregions in which each genus occurs. Then, using the phylogenetic tree constructed, we tested whether diversification was driven by diet (animalivorous and sanguinivorous versus nectarivorous and frugivorous) and specialization for frugivory. Afterwards, we conducted phylogenetic comparative analyses to identify correlates of species richness and net diversification rates. Results The diversification rate was higher in mutualistic than in antagonistic clades in mainland and Antillean biogeographical scenarios, but only strictly frugivorous clades showed a markedly higher diversification rate than the rest of the genera. Geographical range and number of ecoregions were positively associated with species richness and diversification rate in continental and insular lineages. Lower body mass, lower forearm length and specialization for frugivory were significantly positively correlated with higher diversification rates in continental lineages, whereas these parameters were negatively correlated in Antillean lineages. Main conclusions The direction of the relationship of intrinsic factors (specialization for frugivory and body size) with diversification of noctilionoid bats depends on the biogeographical context, whereas the direction of the relationship of extrinsic factors (geographical range and number of ecoregions) with diversification is consistent in both mainland and the West Indian lineages.",2
"X.ISI.000310127900022","Culture-Free Survey Reveals Diverse and Distinctive Fungal Communities Associated with Developing Figs (Ficus spp.) in Panama","Martinson, Ellen O. and Herre, Edward Allen and Machado, Carlos A. and Arnold, A. Elizabeth","MICROBIAL ECOLOGY","0095-3628","64","4","1073-1084","2012","10.1007/s00248-012-0079-x","The ancient association of figs (Ficus spp.) and their pollinating wasps (fig wasps; Chalcidoidea, Hymenoptera) is one of the most interdependent plant-insect mutualisms known. In addition to pollinating wasps, a diverse community of organisms develops within the microcosm of the fig inflorescence and fruit. To better understand the multipartite context of the fig-fig wasp association, we used a culture-free approach to examine fungal communities associated with syconia of six species of Ficus and their pollinating wasps in lowland Panama. Diverse fungi were recovered from surface-sterilized flowers of all Ficus species, including gall- and seed flowers at four developmental stages. Fungal communities in syconia and on pollinating wasps were similar, dominated by diverse and previously unknown Saccharomycotina, and distinct from leaf- and stem endophyte communities in the same region. Before pollination, fungal communities were similar between gall- and seed flowers and among Ficus species. However, fungal communities differed significantly in flowers after pollination vs. before pollination, and between anciently diverged lineages of Ficus with active vs. passive pollination syndromes. Within groups of relatively closely related figs, there was little evidence for strict-sense host specificity between figs and particular fungal species. Instead, mixing of fungal communities among related figs, coupled with evidence for possible transfer by pollinating wasps, is consistent with recent suggestions of pollinator mixing within syconia. In turn, changes in fungal communities during fig development and ripening suggest an unexplored role of yeasts in the context of the fig-pollinator wasp mutualism.",2
"X.ISI.000308239500013","Individual contributions to territory defence in a cooperative breeder: weighing up the benefits and costs","Mares, Rafael and Young, Andrew J. and Clutton-Brock, Tim H.","PROCEEDINGS OF THE ROYAL SOCIETY B-BIOLOGICAL SCIENCES","0962-8452","279","1744","3989-3995","2012","10.1098/rspb.2012.1071","While investment in territory defence is expected to be influenced by its benefits, the additional role that costs may play is rarely considered. Here, we quantify both benefits and costs of repelling prospecting males in cooperative meerkats, and demonstrate that both are required to explain the substantial variation in individual contributions to the defence observed. Males benefit more from repelling prospectors than females, as males may lose dominance and be expelled during intrusions. Accordingly, males invest the most in repelling prospectors. We also show that males experience an associated cost in the form of reduced weight gain and, as such, heavier males contribute more to chasing prospectors. Finally, we show evidence of a cost not restricted to individuals engaged in chasing: both males and females reduce their contributions to feeding dependent pups when prospectors are present, resulting in a reduction in pup weight gain in this context. Males appear to adjust their contributions to chasing in light of this cost, chasing at lower rates when their group contains dependent young. Our findings support the view that investment in cooperative behaviours can be attributed to benefits and costs, and highlight the additional importance of considering trade-offs in investment between cooperative behaviours.",2
"X.ISI.000309601400025","Behavioural type, status and social context affect behaviour and resource allocation in cooperatively breeding cichlids","Riebli, Thomas and Taborsky, Michael and Chervet, Noemie and Apolloni, Nadine and Zuercher, Yvonne and Heg, Dik","ANIMAL BEHAVIOUR","0003-3472","84","4","925-936","2012","10.1016/j.anbehav.2012.07.017","Individuals often show consistent differences in behavioural traits that may belong to a behavioural syndrome. Aggressive propensity is usually an important component of consistent behavioural types, potentially generating benefits in resource competition with conspecifics that may be traded off against costs in other contexts (e.g. acquisition of mates or coexistence with group members). Such trade-offs have not yet been studied in highly social species. We investigated how aggressive propensity influences competition for dominance, shelters and mates in the cooperatively breeding cichlid Neolamprologus pulcher. Following an established protocol we compared growth trajectories of groups of four fish either matched or unmatched for aggressive type. Furthermore, we analysed social interactions, the acquisition of shelter and possible mating partners (by proximity to shelters and prospective mates) according to aggressive type, showing either high or low aggression levels. Contrary to prediction we found that differences in behavioural idiosyncrasies affected the likelihood of obtaining the dominant position and high-quality territories only marginally. Social interactions, growth rates and body reserve accumulation were affected by behavioural differences. However, the patterns observed in this experiment differed from previous studies and suggest a modulating effect of the social environment on the link between behavioural types and life history decisions. Hence, we suggest that in future studies this relationship should be thoroughly investigated under varying social contexts, especially in highly social species. (C) 2012 The Association for the Study of Animal Behaviour. Published by Elsevier Ltd. All rights reserved.",2
