abstract.id,row.id,TaskforceAllocation,FulltextTopicIdentifier,FulltextReviewer.initial,title,author,journal,volume,number,pages,year,doi,Timestamp,FulltextReviewer,StudyType,InteractionType,Scale,SpeciesInteracting,TraitDescription,SpeciesTraitVariation,GeneticNotes,What.is.the.scale.of.the.shift,Is.there.a.shift.in.the.interaction,What.is.the.direction.of.shift,What.factors.are.driving.that.shift,What.is.the.ecological.impact.of.the.interaction.and.shift.of.that.interaction,Is.there.a.connection.to.the.NC3,Reviewer.notes,Reviewer.outstanding.concerns,ReviewerDecision,ReviewerDecisionReason,ReviewerDecision.checked.by,FinalDecision,FinalDecisionReason,FinalDecisionNotes
MA79,38,Intraspecific,competition-cooperation,ET,Cooperation in humans: competition between groups and proximate emotions,"Burton-Chellew, Maxwell N. and Ross-Gillespie, Adin and West, Stuart A.",EVOLUTION AND HUMAN BEHAVIOR,31,2,104-108,2010,10.1016/j.evolhumbehav.2009.07.005,11/21/2019 22:41:16,ET,Experimental,Competition-cooperation,Intra-specific (within population),Homo sapiens,Behavioural phenotype,,No,,No,No shift,No shift,,,,,No,There is no shift in the quality of the interaction,NM,Exclude,human empirical study,"Empirical studies on humans are being excluded (note, modelling, theory studies that are based on humans but are generalisable may be included)"
MA80,39,Modelling,n/a,PT,Cooperation promotes the evolution of separate sexes from hermaphrodites with unitary growth,"Xu, Ying and Yang, Jiang-Nan",JOURNAL OF THEORETICAL BIOLOGY,341,NA,102-110,2014,10.1016/j.jtbi.2013.09.033,12/12/2019 06:21,PT,Modelling/theory,Male-female,Intra-specific (within population),n/a,Shape of the function of reproduction (number) against investment cost.,n/a,n/a,There's no antagonism,No.  Just looking at cooperation; there's not antagonism.,n/a,n/a,Evolution of males/females compared to hermaphrodites,Not really.,,I don't think it's relevant for us.,No,Not about the antagonism-mutualism scale.,NM,Exclude,no shift in the interaction,Agree with reviewer decision
MA81,40,Intraspecific,competition-cooperation,NL,Cooperative personalities and social niche specialization in female meerkats,"Carter, A.J. and English, S. and Clutton-Brock, T.H.",Journal of Evolutionary Biology,27,5,815-825,2014,10.1111/jeb.12358,02/02/2020 20:00,NL,Observational,Competition-cooperation,Intra-specific (within population),Suricata suricatta,"age, dominance aquisition",Suricata suricatta,no,Individuals,no,Intensities of cooperative behaviour,,,niche spezialization,,no clear mut-ant interaction,Maybe,There is no shift in the quality of the interaction,NM,Exclude,no shift in the interaction,"Following reviewer reasoning, no variation in mutualism"
MA84,42,Modelling,n/a,MW,Culture and the evolution of social learning,"Flinn, MV",EVOLUTION AND HUMAN BEHAVIOR,18,1,23-67,1997,10.1016/S1090-5138(96)00046-3,01/02/2020 22:18,MW,Review,"Male-female, Competition-cooperation",Intra-specific (within population),Homo sapiens,discusses various traits related to social learning,humans,NA,,no,,NA,NA,NA,NA,NA,No,"There is no evidence of trait variation, There is no shift in the quality of the interaction, Humans as a study subject (note: this is currently being treated as an exclusion criteria)",NM,Exclude,no shift in the interaction,Agree with reviewer decision
MA86,43,Modelling,n/a,PT,Deciphering the Interdependence between Ecological and Evolutionary Networks,"Melian, Carlos J. and Matthews, Blake and de Andreazzi, Cecilia S. and Rodriguez, Jorge P. and Harmon, Luke J. and Fortuna, Miguel A.",TRENDS IN ECOLOGY \& EVOLUTION,33,7,504-512,2018,10.1016/j.tree.2018.04.009,12/12/2019 09:24,PT,Modelling/theory,Consumer-resource/predator-prey,"Inter-specific (>2 species), Intra-specific (within population), Intra-specific (between populations)",n/a,n/a,n/a,No,Paper is not relevant,No.  Paper is not relevant.,Paper is not relevant,n/a,n/a,Quite possibly -- but the paper does not get into the topic of antagonism-mutualism.,,"Not relevant, despite the abstract making it seem so.",No,Does not get into the antagonism-mutualism continuum.,NM,Exclude,no evidence of trait variation,"Agree with reviewer decision, paper is not on topic so removed as 'no evidence of trait variation' by default"
MA94,45,Interspecific,host-symbiont,JK,Divergent host phenotypes create opportunities and constraints on the distribution of two wing-dwelling feather mites,"Fernandez-Gonzalez, S. and De la Hera, I. and Prez-Rodrguez, A. and Prez-Tris, J.",Oikos,122,8,1227-1237,2013,10.1111/j.1600-0706.2012.00241.x,2/25/2020 8:54:58,JK,Observational,Host-symbiont,Inter-specific (>2 species),"Sylvia atricapilla, Proctophyllodes sylviae and Trouessartia bifurcata",host migratory phenotype,Sylvia atricapilla,no,,"no, only antagonism",,NA,NA,no,NA,no shift,No,There is no shift in the quality of the interaction,NM,Exclude,no shift in the interaction,Agree with reviewer decision
MA99,46,Interspecific,plant-animal,CM,Do seed-dispersing birds exert selection on optimal plant trait combinations? Correlated phenotypic selection on the fruit and seed size of hawthorn (Crataegus monogyna),"Sobral, Mar and Larrinaga, Asier R. and Guitian, Jose",EVOLUTIONARY ECOLOGY,24,"6, SI",1277-1290,2010,10.1007/s10682-010-9380-7,12/11/2019 17:55,CM,Observational,"Consumer-resource/predator-prey, plant-seed dispersers",Inter-specific (>2 species),Crataegus monogyna (plant) and not further specified birds,"fruit and seed measures (length, diameter)",plant (Crataegus monogypna),NA,Individuals,Potential discussed but study does not reveal such a shift,Only potential mutualistic vs. antagonistic interactions discussed,selection of plant traits by seed-dispersing birds,temporal and spatial changes in environmental conditions may alter selective forced and the optimum phenotype in each situation,NA,NA,no clear shift in the interaction,No,There is no shift in the quality of the interaction,NM,Exclude,no shift in the interaction,Agree with reviewer decision
MA101,47,Interspecific,host-symbiont,RR,DOES HOST-PLANT QUALITY MEDIATE APHID-ANT MUTUALISM,"BRETON, LM and ADDICOTT, JF",OIKOS,63,2,253-259,1992,10.2307/3545385,01/07/2020 00:26,RR,Experimental,Host-symbiont,Inter-specific (>2 species),"Epilobium angustifolium (fireweed-host plant), Aphis varians(aphids) and Formica cinerea (ant)",quality of host plants measured in terms of plant height,the fireweed host plants,nothing mentioned specifically in the paper,,no,,NA,NA,NA,NA,NA,No,There is no shift in the quality of the interaction,NM,Exclude,no shift in the interaction,Agree with reviewer decision
MA105,49,Intraspecific,competition-cooperation,ET,Dominance hierarchies and associated signalling in a cooperative passerine,"Rat, M. and van Dijk, R.E. and Covas, R. and Doutrelant, C.",Behavioral Ecology and Sociobiology,69,3,437-448,2015,10.1007/s00265-014-1856-y,11/21/2019 22:53:48,ET,Observational,Competition-cooperation,Intra-specific (within population),Philetairus socius,Behavioural phenotype (social stauts),,Social status is not heritable. But bib size is.,Individuals,No,No shift,No shift,Social interactions / Hierarchy,Yes,,,No,There is no shift in the quality of the interaction,NM,Exclude,no shift in the interaction,Agree with reviewer decision
MA108,51,Modelling,n/a,MW,Dominant and subordinate outside options alter help and eviction in a pay-to-stay negotiation model,"Hellmann, Jennifer K. and Hamilton, Ian M.",BEHAVIORAL ECOLOGY,29,3,553-562,2018,10.1093/beheco/ary006,12/11/2019 05:02,MW,Modelling/theory,Competition-cooperation,Intra-specific (within population),NA,"Dominants and subordinates, but no relevant trait variation as far as I understand.",NA,NA,,no,,NA,NA,NA,NA,NA,No,"There is no evidence of trait variation, There is no shift in the quality of the interaction",NM,Exclude,no evidence of trait variation,Agree with reviewer decision
MA110,53,Interspecific,host-symbiont,LKL,Ecological characteristics of insects that affect symbiotic relationships with mites,"Okabe, K.",Entomological Science,16,4,363-378,2013,10.1111/ens.12050,3/14/2020 18:39:12,LKL,Review,Host-symbiont,Inter-specific (2 species),mites and insect host (various degree of sociality),"development of acarinaria which is ""pocket-like structures that are externally located on insects (particularly hymenopterans) to facilitate mite transportation"". However, the paper mostly focus on factors like developmental stage, ecological characteristics (habitat & social organisation)",NA,NA,Species,Yes,Antagonistic to mutualistic,"ecological, social",NA,Maybe,,Traits that vary between species,No,"The trait varies between species, not within-species",NM,Exclude,trait varies between species,Agree with reviewer decision
MA112,54,Interspecific,host-symbiont,JK,Ectosymbiosis is a critical factor in. the local benthic biodiversity of the Antarctic deep sea,"Heterier, Vincent and David, Bruno and De Ridder, Chantal and Rigaud, Thierry",MARINE ECOLOGY PROGRESS SERIES,364,NA,67-76,2008,10.3354/meps07487,2/25/2020 9:06:43,JK,Observational,Host-symbiont,Inter-specific (>2 species),cidaroids (echinoids) and sessile species,presence of cidaroids as biotic substrate,NA,no,,no,,NA,species diversity,no,NA,no shift,No,There is no shift in the quality of the interaction,NM,Exclude,no shift in the interaction,Agree with reviewer decision
MA114,55,Intraspecific,competition-cooperation,ET,Effects of competitive and cooperative interaction among neighboring trees on tree growth in a naturally regenerated even-aged Larix sibirica stand in considering height stratification,"Mitsuda, Y. and Ito, S. and Takata, K.",Journal of Forest Research,7,4,185-191,2002,10.1007/BF02763131,11/21/2019 23:06:21,ET,Observational,Competition-cooperation,Intra-specific (within population),Larix sibirica,Growth,,,,No,,,,No,,,No,There is no shift in the quality of the interaction,NM,Exclude,no shift in the interaction,Agree with reviewer decision
MA117,56,Intraspecific,competition-cooperation,UE,"Elephants, donuts and hamburgers: Young children co-operating to co-operate and co-operating to compete in two primary schools","Maras, P. and Lewis, A. and Simonds, L.",International Journal of Phytoremediation,19,3,245-258,1999,10.1080/0144341990190301,02/06/2020 09:22,UE,"Observational, Experimental",Competition-cooperation,Intra-specific (within population),Homo sapiens,,,,Individuals,,,,,,,,No,"Humans as a study subject (note: this is currently being treated as an exclusion criteria), I did not read the paper, because it was about school kids.",NM,Exclude,human empirical study,"Empirical studies on humans are being excluded (note, modelling, theory studies that are based on humans but are generalisable may be included)"
MA123,59,Interspecific,host-symbiont,JK,Evolution and invasion dynamics of multiple infections with Wolbachia investigated using matrix based models,"Vautrin, E. and Charles, S. and Genieys, S. and Vavre, F.",JOURNAL OF THEORETICAL BIOLOGY,245,2,197-209,2007,10.1016/j.jtbi.2006.09.035,2/25/2020 10:00:52,JK,Modelling/theory,Host-symbiont,Inter-specific (>2 species),Wolbachia and host,Frequency of Wolbachia strain in population,host,NA,Individuals,yes,Antagonistic to mutualistic,"shift to mutualism at high frequency of W. in pop., carrying a common strain of W. (or several) ",persistence of multiple infections,"potentially yes (fitness depends on population frequency of W.), could e.g. promote niche choice",NA,NA,Maybe,not sure if we would like to include studies on Wolbachia?,NM,Exclude,no evidence of trait variation,"Following reviewer reasoning, Wolbachia variation is not considered intraspecific variation here as relatedness of strains is unknown, while intraspecific trait variation in hosts is not considered"
MA126,61,Modelling,n/a,MW,Evolution of equal division among unequal partners,"Debove, Stephane and Baumard, Nicolas and Andre, Jean-Baptiste",EVOLUTION,69,2,561-569,2015,10.1111/evo.12583,12/11/2019 04:59,MW,Modelling/theory,Competition-cooperation,Intra-specific (within population),NA,"competitive dominance, also referred to as resource-holding potential",NA,assumed to be non-heritable here,,"No, they rather find that variation in dominance does not matter. Individuals evolve to share equally, i.e. cooperate, in any case.",,NA,NA,NA,They cite a few references that sound interesting. I will include them in the additional papers table.,NA,Maybe,There is no shift in the quality of the interaction,NM,Exclude,no shift in the interaction,"Following reviewer reasoning, this does not appear to lead to variation along a m-a continuum"
MA128,63,Intraspecific,competition-cooperation,JW,Evolution of intra-ejaculate sperm interactions: Do sperm cooperate?,"Higginson, D.M. and Pitnick, S.",Biological Reviews,86,1,249-270,2011,10.1111/j.1469-185X.2010.00147.x,1/28/2020 1:28:57,JW,Review,Competition-cooperation,Intra-specific (within population),sperm,"sperm form (i.e., heteromorphism or conjugation) to promote cooperation",sperm,"No evidence to suggest that sperm genomic diversity translates to individual sperm phenotypes (e.g., sperm form is a trait of males, not of individual sperm)",Individuals,Yes,Antagonistic to mutualistic,"Individual sperm cooperation is a higher-level male trait (e.g., no selection acting on sperm individuals themselves)","Sperm form (which influences functional cooperation) is a male-selected trait, influencing sexual selection",Yes,NA,No,Maybe,"Trait variation (sperm form) which leads to sperm cooperation is a male-selected trait, and sperm can not be viewed as individuals cooperating for their own evolutionary interests.",NM,Exclude,no evidence of trait variation,"Following reviewer reasoning, sperm variation is not considered trait variation at the individual organism level"
MA130,64,Interspecific,plant-animal,LKL,Evolution of tree killing in bark beetles (Coleoptera: Curculionidae): Trade-offs between the maddening crowds and a sticky situation,"Lindgren, B.S. and Raffa, K.F.",Canadian Entomologist,145,5,471-495,2013,10.4039/tce.2013.27,01/10/2020 03:52,LKL,Review,"Host-symbiont, Competition-cooperation","Inter-specific (>2 species), Intra-specific (within population), Intra-specific (between populations)",Bark beetles (Coleoptera: Curculionidae: Scolytinae); unspecified tree hosts; competitors such as other tree-boring insects; unspecified microbial symbionts,"(tree host)defensive resin and allelochemical contents can reduce competitor of other species; (bark beetle) detoxification ability (to resist host defences), allomonal interference(deter other species/individuals to reduce inter-/intra-specific competitiveness), host choice and colonisation/gallery construction behaviours (transform tree defensive terpenoids into pheromones)",,Not clearly stated but a paper (Wallin 2002-Heritability of host acceptance and gallery construction behaviors of the bark beetle Ips pini (Coleoptera: Scolytidae)) seems relevant.,,Not clear,,NA,NA,"Yes, e.g. niche partitioning, coexistence",,no clear shift,Maybe,There is no shift in the quality of the interaction,NM,Exclude,no shift in the interaction,"Following reviewer reasoning, no shift in the interaction as beetles always have a negative impact on trees, but degree to which they can exploit them varies depending on the tree's level of chemical defence, with indirect effects on competitor supression"
MA136,65,Intraspecific,competition-cooperation,NL,"Exploration is dependent on reproductive state, not social state, in a cooperatively breeding bird","Edwards, Hannah A. and Dugdale, Hannah L. and Richardson, David S. and Komdeur, Jan and Burke, Terry",BEHAVIORAL ECOLOGY,27,6,1889-1896,2016,10.1093/beheco/arw119,02/02/2020 20:35,NL,"Observational, Experimental","Competition-cooperation, Personality traits (Exploration)",Intra-specific (within population),Acrocephalus sechellensis,"reproductive state, insect abundance, age",Acrocephalus sechellensis,no,,no,Mainly focussing on explorative behaviour,,,niche spezialization,,no clear shift in the interaction between mutualism and antagonism,No,"There is no shift in the quality of the interaction, no mut-ant interaction",NM,Exclude,no relevant interaction,Agree with reviewer decision
MA138,66,Intraspecific,competition-cooperation,CF,Factors affecting individual participation in group-level aggression among non-human primates,"Kitchen, D.M. and Beehner, J.C.",Behaviour,144,12,1551-1581,2007,10.1163/156853907782512074,3/26/2020 19:51:33,CF,Review,"Competition-cooperation, less cooperation, more group level aggression",Intra-specific (between populations),several as this is a review on primates,"they mainly considered resource levels, sex and rank",NA,NA,,NA,,I guess the topics considered fall under all three,NA,"Towards the end of the review, they focus on individual level based analysis, so there might be some interesting information, otherwise there is rank and dominance status, which might be of interest",,again it is about the participation in and level of intergroup aggression,Maybe,,NM,Exclude,no shift in the interaction,"Following reviewer reasoning, no variation in mutualism"
MA140,67,Intraspecific,competition-cooperation,ET,"Facultative control of offspring sex in the cooperatively breeding bell miner, Manorina melanophrys","Ewen, J.G. and Crozier, R.H. and Cassey, P. and Ward-Smith, T. and Painter, J.N. and Robertson, R.J. and Jones, D.A. and Clarke, M.F.",Behavioral Ecology,14,2,157-164,2003,10.1093/beheco/14.2.157,11/21/2019 23:17:55,ET,Observational,Consumer-resource/predator-prey,Inter-specific (2 species),"Manorina melanophrys, Psyllidae insects",Insect distribution influences sex ratio of offspring,,Facultative control of offspring sex ratio is heritable,Populations,No,No shift,,,,,,No,There is no shift in the quality of the interaction,NM,Exclude,no shift in the interaction,Agree with reviewer decision
MA143,68,Interspecific,host-symbiont,JW,Feather mite abundance varies but symbiotic nature of mite-host relationship does not differ between two ecologically dissimilar warblers,"Matthews, A.E. and Larkin, J.L. and Raybuck, D.W. and Slevin, M.C. and Stoleson, S.H. and Boves, T.J.",Ecology and Evolution,8,2,1227-1238,2018,10.1002/ece3.3738,1/28/2020 2:10:03,JW,Observational,Host-symbiont,Inter-specific (2 species),"Cerulean Warbler (Setophaga cerulea); Prothonotary Warbler (Protonotaria citrea);  Feather mites subfamily (Astigmata: Analgoidea, Pterolichoidea), genus (Amerodectes)","Feather mite density, host breeding ecology, host age and sex",Hosts (warbler species),No,"Individuals, Species",No,No shift,NA,NA,Yes,NA,"No clear shift in host-symbiont relationship. All symbionts were observed to be commensal, regardless of trait variation.",No,There is no shift in the quality of the interaction,NM,Exclude,no shift in the interaction,Agree with reviewer decision
MA145,69,Interspecific,predator-prey,CM,Feeding repellence in Antarctic bryozoans,"Figuerola, B. and Nez-Pons, L. and Moles, J. and Avila, C.",Naturwissenschaften,100,11,1069-1081,2013,10.1007/s00114-013-1112-8,12/11/2019 18:07,CM,Experimental,Consumer-resource/predator-prey,Inter-specific (>2 species),prey: various bryozoans; predators: Odontaster validus and Cheirimedon femoratus,chemical compounds,bryozoans,NA,"Individuals, Species",No,"no shift, the paper is only about the different bioactivity",,different repellent compounds play important role in bryozoans as defences against predators,NA,NA,not clear shift,No,There is no shift in the quality of the interaction,NM,Exclude,no shift in the interaction,Agree with reviewer decision
MA153,70,Interspecific,plant-animal,CM,Foraging strategy predicts foraging economy in a facultative secondary nectar robber,"Richman, Sarah K. and Irwin, Rebecca E. and Bronstein, Judith L.",OIKOS,126,9,1250-1257,2017,10.1111/oik.04229,12/11/2019 18:31,CM,Experimental,Consumer-resource/predator-prey,Inter-specific (2 species),"plant Linaria vulgaris, nectar robber: Bombus bifarius","flower visits, bouts spent nectar feeding",Bombus bifarius,NA,Individuals,No,"no shift, but different foraging strategies of nectar robbers",flower state,Nectar robbing,NA,NA,"nectar robbers are antagonists, their different strategies are described",No,There is no shift in the quality of the interaction,NM,Exclude,no shift in the interaction,Agree with reviewer decision
MA163,76,Interspecific,host-symbiont,LKL,Genetic and genomic evidence of niche partitioning and adaptive radiation in mountain pine beetle fungal symbionts,"Alayon, Dario I. Ojeda and Tsui, Clement K. M. and Feau, Nicolas and Capron, Arnaud and Dhillon, Braham and Zhang, Yiyuan and Alamouti, Sepideh Massoumi and Boone, Celia K. and Carroll, Allan L. and Cooke, Janice E. K. and Roe, Amanda D. and Sperling, Felix A. H. and Hamelin, Richard C.",MOLECULAR ECOLOGY,26,"7, SI",2077-2091,2017,10.1111/mec.14074,01/08/2020 23:46,LKL,"Observational, Experimental",Host-symbiont,Inter-specific (>2 species),"mountain pine beetle (MPB, Dendroctonus ponderosae Hopkins), Ophiostoma montium, Grosmannia clavigera and Leptographium longiclavatum",growth rate at different temperatures/thermal tolerance,"O. montium, G. clavigera, L. longiclavatum","Yes, variation in growth rates at different temperatures was highly heritable",,No,,NA,NA,Yes,NA,No clear shift,Maybe,There is no shift in the quality of the interaction,NM,Exclude,no shift in the interaction,"Following reviewer reasoning, relationship between symbiont and host appears always positive, potential variation in the compeitive cooperative relationship between fungal symbionts, but I can't find evidence for any direct mutualistic benefits between symbionts (only vaying levels of compeitition)"
MA164,77,Intraspecific,male-female,BC,Genetic clusters and sex-biased gene flow in a unicolonial Formica ant,"Holzer, Barbara and Keller, Laurent and Chapuisat, Michel",BMC EVOLUTIONARY BIOLOGY,9,NA,NA,2009,10.1186/1471-2148-9-69,12/16/2019 5:13:52,BC,Observational,Competition-cooperation,"Intra-specific (within population), not clear, cooperation within the colony and competition among colonies",Formica paralugubris,colony member or not,Formica paralugubris,no,Individuals,no,,"social , being a nest mate or not",,no,"The paper did not investigate the shift in that trait, it investigated the underlying fine scale population genetic structure",,Maybe,"As mentioned, the authors do not really investigate the trait variation or trait shift, but only the population genetic structure",NM,Exclude,no evidence of trait variation,"Following reviewer reasoning, trait variation is not a focus of the paper"
MA173,78,Intraspecific,competition-cooperation,BC,Harsh childhood environmental characteristics predict exploitation and retaliation in humans,"McCullough, M.E. and Pedersen, E.J. and Schroder, J.M. and Tabak, B.A. and Carver, C.S.",Proceedings of the Royal Society B: Biological Sciences,280,1750,NA,2013,10.1098/rspb.2012.2104,12/16/2019 5:56:59,BC,Observational,Competition-cooperation,Intra-specific (within population),Humans,Childhood environment,humans,no,Individuals,yes,Mutualistic to antagonistic,Childhood exposure to neighbourhood violence and crime,,yes,,,No,Humans as a study subject (note: this is currently being treated as an exclusion criteria),NM,Exclude,human empirical study,"Empirical studies on humans are being excluded (note, modelling, theory studies that are based on humans but are generalisable may be included)"
MA180,81,Intraspecific,competition-cooperation,NL,Hormonal underpinnings of status conflict: Testosterone and cortisol are related to decisions and satisfaction in the hawk-dove game,"Mehta, Pranjal H. and DesJardins, Nicole M. Lawless and van Vugt, Mark and Josephs, Robert A.",HORMONES AND BEHAVIOR,92,SI,141-154,2017,10.1016/j.yhbeh.2017.03.009,02/08/2020 03:09,NL,Observational,Competition-cooperation,Intra-specific (within population),Homo sapiens,decision-making,Homo sapiens,no,Individuals,yes,NA,Hormonal profiles (testosterone and cortisol),status-seeking,maybe?,,humans are study subject,No,Humans as a study subject (note: this is currently being treated as an exclusion criteria),NM,Exclude,human empirical study,"Empirical studies on humans are being excluded (note, modelling, theory studies that are based on humans but are generalisable may be included)"
MA181,82,Interspecific,host-symbiont,JK,Host sharing by the honey bee parasites Lotmaria passim and Nosema ceranae,"Tritschler, M. and Retschnig, G. and Yaez, O. and Williams, G.R. and Neumann, P.",Ecology and Evolution,7,6,1850-1857,2017,10.1002/ece3.2796,2/25/2020 10:19:52,JK,Observational,"Host-symbiont, Competition-cooperation",Inter-specific (>2 species),"Apis mellifera, Lotmaria passim, Nosema ceranae",presence of the other parasite species in host individual," Lotmaria passim, Nosema ceranae",no,Individuals,no (hypothesised but not found),interaction between 2 species of parasites in host (expected: from competition to mutualism),"not found, but could e.g. be host condition","it could be relevant for host survival, epidemics","yes: niche of parasite inside host depends on presence of other parasites (could e.g. lead to niche choice, i.e. host choice)",NA,"interaction not found, positive correlation between parasite loads interpreted as driven by host condition",Maybe,"no traits that vary, just presence/absence of parasite species",NM,Exclude,no evidence of trait variation,"Following reviewer reasoning, to trait variation, also no interaction between the parasites detected"
