"label","title","author","journal","issn","volume","number","pages","year","doi","abstract","n_duplicates"
"X.ISI.000472121700001","Inclusive fitness, asymmetric competition and kin selection in plants","Ehlers, Bodil K. and Bilde, Trine","OIKOS","0030-1299","128","6","765-774","2019","10.1111/oik.06390","The findings that some plants alter their competitive phenotype in response to genetic relatedness of its conspecific neighbour (and presumed competitor) has spurred an increasing interest in plant kin-interactions. This phenotypic response suggests the ability to assess the genetic relatedness of conspecific competitors, proposing kin selection as a process that can influence plant competitive interactions. Kin selection can favour restrained competitive growth towards kin, if the fitness loss from reducing own growth is compensated by increased fitness in the related neighbour. This may lead to positive frequency dependency among related conspecifics with important ecological consequences for species assemblage and coexistence. However, kin selection in plants is still controversial. First, many studies documenting a plastic response to neighbour relatedness do not estimate fitness consequences of the individual that responds, and when estimated, fitness of individuals grown in competition with kin did not necessarily exceed that of individuals grown in non-kin groups. Although higher fitness in kin groups could be consistent with kin selection, this could also arise from mechanisms like asymmetric competition in the non-kin groups. Here we outline the main challenges for studying kin selection in plants taking genetic variation for competitive ability into account. We emphasize the need to measure inclusive fitness in order to assess whether kin selection occurs, and show under which circumstances kin selected responses can be expected. We also illustrate why direct fitness estimates of a focal plant, and group fitness estimates are not suitable for documenting kin selection. Importantly, natural selection occurs at the individual level and it is the inclusive fitness of an individual plant - not the mean fitness of the group - that can capture if a differential response to neighbour relatedness is favoured by kin selection.",2
"X.ISI.000469449100002","Transitivity and structural balance in marmot social networks","Wey, Tina W. and Jordan, Ferenc and Blumstein, Daniel T.","BEHAVIORAL ECOLOGY AND SOCIOBIOLOGY","0340-5443","73","6",NA,"2019","10.1007/s00265-019-2699-3","Social relationships are composed of both positive (affiliative) and negative (agonistic) interactions, representing opposing effects. Social network theory predicts that positive relationships should be transitive; thus, the friend of a friend is more likely to be a friend. Further, when considering both positive and negative relationships jointly, structural balance theory predicts that certain configurations of positive and negative relationships in a triad are inherently less stable (unbalanced) and should tend to be eliminated. However, structural balance has been rarely examined in nonhuman social systems. We tested for transitivity and structural balance in social networks of socially flexible yellow-bellied marmots (Marmota flaviventer) and asked if group size, network density, or group composition affected the degree of structural balance. We found a consistent pattern of significant transitivity in positive interactions, some transitivity in negative interactions, and some evidence of structural balance. In particular, a weak definition of structural balance is probably more common than strong structural balance, which used a stricter definition of balance. Network size limited the ability to detect these social processes, and smaller networks were less likely to show significant transitivity or structural balance. The proportion of adult females in a group affected the level of transitivity but did not affect the degree of structural balance. Our study suggests that there are intriguing similarities in social processes across diverse animal societies and that studying triads and network motifs may help identify basic social mechanisms linking local to global structure.Significance statementSocial network theory predicts that basic social mechanisms should lead to similar structural properties across different societies. For example, positive relationships should be transitive (a friend of a friend is a friend), and certain combinations of positive and negative relationships represent conflict and should be unstable over time (e.g., a friend of a friend being an enemy is an unstable state). This latter theory, called structural balance, has rarely been examined in nonhuman societies; hence, we tested for transitivity and structural balance in groups of free-living yellow-bellied marmots. Positive interactions were generally transitive, but evidence for structural balance was inconsistent. Furthermore, group composition could affect network transitivity, and small network size (associated with few interactions) limits ability to detect significant patterns. Our results suggest that transitivity is fundamental in structuring positive relationships, while some forms of structural balance are present but not widespread.",2
"X.ISI.000468068400001","Trait-Based Modeling of Multihost Pathogen Transmission: Plant-Pollinator Networks","Truitt, Lauren L. and McArt, Scott H. and Vaughn, Andrew H. and Ellner, Stephen P.","AMERICAN NATURALIST","0003-0147","193","6","E149-E167","2019","10.1086/702959","Epidemiological models for multihost pathogen systems often classify individuals taxonomically and use species-specific parameter values, but in species-rich communities that approach may require intractably many parameters. Trait-based epidemiological models offer a potential solution but have not accounted for within-species trait variation or between-species trait overlap. Here we propose and study trait-based models with host and vector communities represented as trait distributions without regard to species identity. To illustrate this approach, we develop susceptible-infectious-susceptible models for disease spread in plant-pollinator networks with continuous trait distributions. We model trait-dependent contact rates in two common scenarios: nested networks and specialized plant-pollinator interactions based on trait matching. We find that disease spread in plant-pollinator networks is impacted the most by selective pollinators, universally attractive flowers, and cospecialized plant-pollinator pairs. When extreme pollinator traits are rare, pollinators with common traits are most important for disease spread, whereas when extreme flower traits are rare, flowers with uncommon traits impact disease spread the most. Greater nestedness and specialization both typically promote disease persistence. Given recent pollinator declines caused in part by pathogens, we discuss how trait-based models could inform conservation strategies for wild and managed pollinators. Furthermore, while we have applied our model to pollinators and pathogens, its framework is general and can be transferred to any kind of species interactions in any community.",2
"X.ISI.000467692300001","Signal categorization by foraging animals depends on ecological diversity","Kikuchi, David William and Dornhaus, Anna and Gopeechund, Vandana and Sherratt, Thomas N.","ELIFE","2050-084X","8",NA,NA,"2019","10.7554/eLife.43965","Warning signals displayed by defended prey are mimicked by both mutualistic (Mullerian) and parasitic (Batesian) species. Yet mimicry is often imperfect: why does selection not improve mimicry? Predators create selection on warning signals, so predator psychology is crucial to understanding mimicry. We conducted experiments where humans acted as predators in a virtual ecosystem to ask how prey diversity affects the way that predators categorize prey phenotypes as profitable or unprofitable. The phenotypic diversity of prey communities strongly affected predator categorization. Higher diversity increased the likelihood that predators would use a `key' trait to form broad categories, even if it meant committing errors. Broad categorization favors the evolution of mimicry. Both species richness and evenness contributed significantly to this effect. This lets us view the behavioral and evolutionary processes leading to mimicry in light of classical community ecology. Broad categorization by receivers is also likely to affect other forms of signaling.",2
"X.ISI.000471294800006","Capuchin monkeys (Sapajus {[}Cebus] apella) play Nash equilibria in dynamic games, but their decisions are likely not influenced by oxytocin","Smith, Mackenzie F. and Leverett, Kelly L. and Wilson, Bart J. and Brosnan, Sarah F.","AMERICAN JOURNAL OF PRIMATOLOGY","0275-2565","81","4",NA,"2019","10.1002/ajp.22973","Comparative approaches to experimental economics have shed light on the evolution of social decision-making across a range of primate species, including humans. Here we replicate our previous work looking at six pairs of capuchin monkeys' (Sapajus {[}Cebus] apella) responses to scenarios requiring both coordination (Assurance Game) and anti-coordination (Hawk-Dove Game). This then provides a foundation for assessing their responses to two additional games, one with a scenario of beneficial cooperation with a temptation to defect (Prisoner's Dilemma) and one with an environment requiring changing strategies within short temporal proximity (Alternating Economic Game). We additionally explored the effects of exogenous oxytocin on decision-making. Oxytocin did not affect decisions in any of our games. Results from the first two games largely replicated our previous findings. Responses to the Prisoner's Dilemma were more varied than was seen in previous games, with pairs respectively cooperating, defecting, and failing to establish stable strategies. Such variability indicates that this game may be a good assay for individual differences in social decision-making. Finally, capuchins were able to flexibly switch between their previously established strategies within each of the different games, even when the games were presented within the same session, requiring strategy adjustments within short temporal proximity. These results build on earlier findings showing that capuchins can alter decision-making strategies as the context demands, which is likely essential for decision-making in naturally occurring contexts.",2
"X.ISI.000464407800001","How individual and relative size affect participation in territorial defense and cortisol levels in a social fish","Ligocki, Isaac Y. and Earley, Ryan L. and Hamilton, Ian M.","JOURNAL OF EXPERIMENTAL ZOOLOGY PART A-ECOLOGICAL AND INTEGRATIVE PHYSIOLOGY","2471-5638","331","4","217-226","2019","10.1002/jez.2255","For many species, behaviors such as territory defense and parental care are energetically costly, but are nonetheless can provide substantial fitness gains. In systems in which both parents provide parental care, each of the parents benefits from exhibiting (or having their partner exhibit) these behaviors. However, in many cases, costs and benefits differ between parents due to factors such as size or sex. Different intruder types may also impose different costs on parents. Predatory intruders might consume offspring, whereas conspecifics might threaten the social status of a parent, or provide benefits as a potential group joiner or mate. Responses to these intrusions may also be associated with variation in individual stress responses. We investigated associations among male and female sizes, and the interaction between these, with defense against conspecific and heterospecific territorial intruders by members of successfully breeding pairs in the cichlid fish Neolamprologus pulcher. We also investigated whether cortisol levels were associated with size or participation in territory defense because each may be a cause or consequence of individual variation in the stress response. We found that females paired with large males performed fewer defensive behaviors than females paired with smaller males. Males paired with relatively large females had higher baseline cortisol levels than those paired with smaller females. Collectively, individual characteristics such as size have consequences for each individual's behavior, and also influence the behavior, and endocrine state of social partners.",2
"X.ISI.000460668800007","Evolutionary maintenance of genomic diversity within arbuscular mycorrhizal fungi","Scott, Thomas W. and Kiers, E. Toby and Cooper, Guy A. and dos Santos, Miguel and West, Stuart A.","ECOLOGY AND EVOLUTION","2045-7758","9","5","2425-2435","2019","10.1002/ece3.4834","Most organisms are built from a single genome. In striking contrast, arbuscular mycorrhizal fungi appear to maintain genomic variation within an individual fungal network. Arbuscular mycorrhizal fungi dwell in the soil, form mutualistic networks with plants, and bear multiple, potentially genetically diverse nuclei within a network. We explore, from a theoretical perspective, why such genetic diversity might be maintained within individuals. We consider selection acting within and between individual fungal networks. We show that genetic diversity could provide a benefit at the level of the individual, by improving growth in variable environments, and that this can stabilize genetic diversity even in the presence of nuclear conflict. Arbuscular mycorrhizal fungi complicate our understanding of organismality, but our findings offer a way of understanding such biological anomalies.",2
"X.ISI.000461000300014","Sociosexuality, testosterone, and life history status: prospective associations and longitudinal changes among men in Cebu, Philippines","Gettler, Lee T. and Kuo, Patty X. and Rosenbaum, Stacy and Avila, Josephine L. and McDade, Thomas W. and Kuzawa, Christopher W.","EVOLUTION AND HUMAN BEHAVIOR","1090-5138","40","2","249-258","2019","10.1016/j.evolhumbehav.2018.11.001","Sociosexuality is defined as an individual's interest in uncommitted sexual activity and can be measured in terms of both psychological orientations and behavioral expression. In socio-ecological contexts in which adults monogamously partner and cooperate to raise children, individuals with unrestricted sociosexuality are likely to prioritize mating/competition over committed partnering and parenting. Given the importance of mother-father cooperation in the evolutionary past, humans may have the capacity to facultatively and opportunistically downregulate sociosexuality to focus on priorities related to invested partnering and parenting. To date, no prior studies have used longitudinal data to track within-individuals changes in sociosexuality as it relates to such life history transitions. Given the lack of prior longitudinal research in this area, it is likewise unknown what physiological mechanisms might mediate within-individual changes in sociosexuality through time but testosterone is a plausible candidate. To explore these questions, we drew on a large, long-running study of Filipino men (n = 288), who were single non-fathers at 25.9 years of age and were followed up 4-5 years later. We found that men with more unrestricted sociosexuality at baseline were more likely to experience relationship dissolution by follow-up, consistent with past work. Compared to men who remained single non-fathers at followup, men who became married residential fathers showed shifts towards more restricted global sociosexuality as well as sociosexual behavior. Relative to their own baseline values, married residential fathers also had more restricted sociosexuality in all domains at follow-up. They were the only group for whom this was found. We found theoretically-consistent but modest support for positive correlations between men's testosterone and their sociosexuality, but no evidence that the two change in tandem together through time. Our results suggest that some amount of between-individual differences in sociosexuality are not stable and can facultatively shift alongside other aspects of male reproductive effort.",2
"X.ISI.000458341800009","Spatial evolutionary dynamics produce a negative cooperation-population size relationship","Tekwa, Edward W. and Gonzalez, Andrew and Loreau, Michel","THEORETICAL POPULATION BIOLOGY","0040-5809","125",NA,"94-101","2019","10.1016/j.tpb.2018.12.003","Natural selection can favour cooperation, but it is unclear when cooperative populations should be larger than less cooperative ones. While experiments have shown that cooperation can increase population size, cooperation and population size can become negatively correlated if spatial processes affect both variables in opposite directions. We use a simple mathematical model of spatial common-pool resource production to investigate how space affects the cooperation-population size relationship. We find that only cooperation that is sufficiently beneficial to neighbours increases population size. However, spatial clustering variations can create a negative cooperation-population relationship between populations even when cooperation is highly beneficial, because clustering selects for cooperation but decreases population size. Individual-based simulations with variable individual movement rates produced variation in spatial clustering and the hypothesized negative cooperation-population relationships. These results suggest that variation in spatial clustering can limit the size of evolutionarily stable cooperating populations - an ecological dilemma of cooperation. (C) 2018 Elsevier Inc. All rights reserved.",2
"X.ISI.000457622300003","Fitness costs of phoretic nematodes in the burying beetle, Nicrophorus vespilloides","Wang, Yin and Rozen, Daniel E.","ECOLOGY AND EVOLUTION","2045-7758","9","1","26-35","2019","10.1002/ece3.4570","Nicrophorusvespilloides is a social beetle that rears its offspring on decomposing carrion. Wild beetles are frequently associated with two types of macrobial symbionts, mites, and nematodes. Although these organisms are believed to be phoretic commensals that harmlessly use beetles as a means of transfer between carcasses, the role of these symbionts on N. vespilloides fitness is poorly understood. Here, we show that nematodes have significant negative effects on beetle fitness across a range of worm densities and also quantify the density-dependent transmission of worms between mating individuals and from parents to offspring. Using field-caught beetles, we provide the first report of a new nematode symbiont in N. vespilloides, most closely related to Rhabditoides regina, and show that worm densities are highly variable across individuals isolated from nature but do not differ between males and females. Next, by inoculating mating females with increasing densities of nematodes, we show that worm infections significantly reduce brood size, larval survival, and larval mass, and also eliminate the trade-off between brood size and larval mass. Finally, we show that nematodes are efficiently transmitted between mating individuals and from mothers to larvae, directly and indirectly via the carcass, and that worms persist through pupation. These results show that the phoretic nematode R. regina can be highly parasitic to burying beetles but can nevertheless persist because of efficient mechanisms of intersexual and intergenerational transmission. Phoretic species are exceptionally common and may cause significant harm to their hosts, even though they rely on these larger species for transmission to new resources. However, this harm may be inevitable and unavoidable if transmission of phoretic symbionts requires nematode proliferation. It will be important to determine the generality of our results for other phoretic associates of animals. It will equally be important to assess the fitness effects of phoretic species under changing resource conditions and in the field where diverse interspecific interactions may exacerbate or reduce the negative effects of phoresy.",2
"X.ISI.000456690800006","Social influences on survival and reproduction: Insights from a long-term study of wild baboons","Alberts, Susan C.","JOURNAL OF ANIMAL ECOLOGY","0021-8790","88","1","47-66","2019","10.1111/1365-2656.12887","For social species, the environment has two components: physical and social. The social environment modifies the individual's interaction with the physical environment, and the physical environment may in turn impact individuals' social relationships. This interplay can generate considerable variation among individuals in survival and reproduction. Here, I synthesize more than four decades of research on the baboons of the Amboseli basin in southern Kenya to illustrate how social and physical environments interact to affect reproduction and survival. For immature baboons, social behaviour can both mitigate and exacerbate the challenge of survival. Only c. 50\% of live-born females and c. 44\% of live-born males reach the median age of first reproduction. Variation in pre-adult survival, growth and development is associated with multiple aspects of the social environment. For instance, conspecifics provide direct care and are a major source of social knowledge about food and the environment, but conspecifics can also represent a direct threat to survival through infanticide. In adulthood, both competition (within and between social groups) and cooperative affiliation (i.e. collective action and/or the exchange of social resources such as grooming) are prominent features of baboon social life and have important consequences for reproduction and survival. For instance, adult females with higher social dominance ranks have accelerated reproduction, and adult females that engage in more frequent affiliative social interactions have higher survival throughout adulthood. The early life environment also has important consequences for adult reproduction and survival, as in a number of other bird and mammal species. In seasonal breeders, early life effects often apply to entire cohorts; in contrast, in nonseasonal and highly social species such as baboons, early life effects are more individual-specific, stemming from considerable variation not only in the early physical environment (even if they are born in the same year) but also in the particulars of their social environment.",2
"X.ISI.000456143400011","Social complexity: patterns, processes, and evolution","Kappeler, Peter M. and Clutton-Brock, Tim and Shultz, Susanne and Lukas, Dieter","BEHAVIORAL ECOLOGY AND SOCIOBIOLOGY","0340-5443","73","1",NA,"2019","10.1007/s00265-018-2613-4","Animal and human societies exhibit extreme diversity in the size, composition and cohesion of their social units, in the patterning of sex-specific reproductive skew, in the nature of parental care, in the form and frequency of cooperation and in their competitive regime, creating a diversity of socially complex societies. However, there is an ongoing debate about whether social complexity is a real, emergent property of a society or whether it only provides a conceptual framework for studying the diversity and evolution of societies. In this introduction to our topical collection, we identify three areas of current research addressing relevant challenges in the study of social complexity. First, previous studies have suffered from a lack of a common conceptual framework, including shared definitions, and existing measures of social complexity do not acknowledge its multiple components and dimensions. Second, most previous studies have ignored intraspecific variation, and the proximate and ultimate determinants of variation in social complexity, as well as their interactions, remain poorly known. Third, comparative studies of social complexity offer opportunities to explore its biological causes and correlates and but it is frequently difficult to identify the causal relationships involved and the development of general insights has been hampered by conceptual and methodological difficulties. In this paper, we briefly characterize these three challenges and offer guidance to the other contributions to this topical collection on social complexity by placing their key results in the context of these three topics.Significance statementIn this paper, we address the main current challenges in the study of social complexity and combine our brief overview with a synopsis of the other contributions to this topical collection on various aspects of social complexity.",2
