"label","title","author","journal","issn","volume","number","pages","year","doi","abstract","n_duplicates"
"X.ISI.000251810600012","Determinants of reproductive success in dominant female meerkats","Hodge, Sarah J. and Manica, A. and Flower, T. P. and Clutton-Brock, T. H.","JOURNAL OF ANIMAL ECOLOGY","0021-8790","77","1","92-102","2008","10.1111/j.1365-2656.2007.01318.x","1. In cooperative societies with high reproductive skew, selection on females is likely to operate principally through variation in the probability of acquiring dominant status and variation in reproductive success while dominant. Despite this, few studies of cooperative societies have investigated the factors that influence which females become dominant, and/or their reproductive output while in the dominant position. 2. Here we use long-term data from a wild meerkat population to describe variation in the breeding success of dominant female meerkats Suricata suricatta and investigate its causes. 3. Female meerkats compete intensely for breeding positions, and the probability of acquiring the breeding role depends upon a female's age in relation to competitors and her weight, both at the time of dominance acquisition and early in life. 4. Once dominant, individual differences in breeding success depend principally on the duration of dominance tenure. Females remain for longer in the dominant position if they are heavier than their competitors at the start of dominance, and if the number of adult female competitors at the start is low. 5. Female breeding success is also affected by variation in fecundity and pup survival, both of which increase with group size. After controlling for these effects, female body weight has a positive influence on breeding rate and litter size, while the number of adult female competitors reduces litter survival. 6. These findings suggest that selection for body weight and competitive ability will be high in female meerkats, which may moderate their investment in cooperative activities. We suggest that similar consequences of competition may occur among females in other cooperative societies where the benefits of attaining dominance status are high.",2
"X.ISI.000258810800006","Ectosymbiosis is a critical factor in. the local benthic biodiversity of the Antarctic deep sea","Heterier, Vincent and David, Bruno and De Ridder, Chantal and Rigaud, Thierry","MARINE ECOLOGY PROGRESS SERIES","0171-8630","364",NA,"67-76","2008","10.3354/meps07487","In deep-sea benthic environments, competition for hard substrates is a critical factor in the distribution and diversity of organisms. In this context, the occurrence of biotic substrates in addition to mineral substrates may change the characteristics of sessile fauna. We tested this hypothesis at different localities of the Weddell Sea (Antarctica) by Studying the diversity of ectosymbionts living on the spines of cidaroids (echinoids), The presence of cidaroids promoted a higher total specific richness and increased sessile species abundance, but did riot change the diversity. Analyses of species distribution suggested that the cidaroids are a favourable habitat for sessile organisms, compared to rocks, but are colonized by relatively specialist sessile Species, leaving the unfavourable rock habitat to more generalist species. Therefore, our study highlights the role of some living organisms, such as cidaroids, as key species increasing Antarctic benthic deep-sea species richness through the niche they provide to symbiotic species.",2
"X.ISI.000252007200006","Reproductive skew and the evolution of group dissolution tactics: a synthesis of concession and restraint models","Buston, P. M. and Reeve, H. K. and Cant, M. A. and Vehrencamp, S. L. and Emlen, S. T.","ANIMAL BEHAVIOUR","0003-3472","74","6","1643-1654","2007","10.1016/j.anbehav.2007.03.003","Reproductive skew theory provides a compelling explanation for the partitioning of reproduction among individuals within animal societies. One constructive criticism of the theory is that there are too many models, all of which have different assumptions and predictions, which makes it difficult to know what to test. Here we begin the process of tackling this problem, by re-examining the assumptions and predictions of basic concession and restraint models, two transactional models that are often tested as alternatives. Concession models assume that the dominant has complete control over the allocation of reproduction but may yield some of the group's reproduction to prevent the subordinate from voluntarily departing. Restraint models assume that the subordinate has complete control over the allocation of reproduction but may not claim all of the group's reproduction to prevent the dominant from forcibly evicting it. We show that the group dissolution tactics that individuals use ( forcible eviction or voluntary departure) need not be an assumption of the model, but rather they can be predicted using Hamilton's rule and the standard variables of skew models. We reveal that the assumption that one individual ( dominant or subordinate) has complete control over the allocation of reproduction is an idea common to both models, and we resolve this semantic difference by calling this individual `the allocator'. We show that, regardless of the group dissolution tactics that individuals adopt, the allocator's share of the reproduction always increases as relatedness increases, as group productivity increases, and as constraints on leaving to breed elsewhere intensify. We conclude that concession and restraint type models make qualitatively similar predictions, and should not be tested as alternatives. In summary, this study makes the transactional framework of reproductive skew more general, by eliminating restrictive assumptions, and more amenable to testing in the field, by clarifying assumptions and predictions. (c) 2007 The Association for the Study of Animal Behaviour. Published by Elsevier Ltd. All rights reserved.",2
"X.ISI.000251184700006","Factors affecting individual participation in group-level aggression among non-human primates","Kitchen, Dawn M. and Beehner, Jacinta C.","BEHAVIOUR","0005-7959","144","12","1551-1581","2007","10.1163/156853907782512074","Group members do not always act cohesively when facing extra-group rivals. When benefits such as group-defence are not monopolizable, it poses an economics problem: who should contribute to public goods and who should freeload? A collective action framework compliments existing theoretical explanations for cooperation, and provides testable hypotheses about group-level behaviour based on individual costs and benefits. Using this approach, we review research on intergroup encounters in non-human primates published over the last 20 years, focusing on participation by different classes of individuals. While food- and matedefence explain much between-sex variation in participation, rank and reproductive access frequently explain within-sex variation. In some species, individuals may use intergroup interactions to survey potential transfer locations and mating options, which might coincidently intimidate rivals. Experimental evidence suggests that when intergroup dominance is based on relative number of fighters, individual participation still varies with sex, rank, companion behaviour and dependent offspring presence. Relatively few studies have examined how factors such as relationships within and between groups or individual temperament mediate aggression. Long-term studies of multiple habituated groups and methodological advances (e.g., playback experiments) will continue to improve our understanding of how complex group-level patterns are predictable when viewed from an individual perspective.",2
"X.ISI.000251520500003","Selfish punishment: Altruism can be maintained by competition among cheaters","Eldakar, Omar Tonsi and Farrell, Dene Leo and Wilson, David Sloan","JOURNAL OF THEORETICAL BIOLOGY","0022-5193","249","2","198-205","2007","10.1016/j.jtbi.2007.07.024","Altruistic punishment refers to a class of behaviors that deters cheating at a cost to the punisher, making it a form of second-order altruism. Usually, it is assumed that the punishers are themselves ``solid citizens{''} who refrain from cheating. We show in a simulation model that altruism and punishment paradoxically become negatively correlated, leading to a form of selfish punishment. Examples of selfish punishment can be found in organisms as diverse as wasps, birds, and humans. (C) 2007 Elsevier Ltd. All rights reserved.",2
"X.ISI.000249981500002","Models of density-dependent genic selection and a new rock-paper-scissors social system","Sinervo, Barry and Heulin, Benoit and Surget-Groba, Yann and Clobert, Jean and Miles, Donald B. and Corl, Ammon and Chaine, Alexis and Davis, Alison","AMERICAN NATURALIST","0003-0147","170","5","663-680","2007","10.1086/522092","We describe new ESS models of density regulation driven by genic selection to explain the cyclical dynamics of a social system that exhibits a rock-paper-scissors (RPS) set of three alternative strategies. We tracked changes in morph frequency and fitness of Lacerta vivipara and found conspicuous RPS cycles. Morphs of Uta and Lacerta exhibited parallel survival-performance trade-offs. Frequency cycles in both species of lizards are driven by genic selection. In Lacerta, frequency of each allele in adult cohorts had significant impacts on juvenile recruitment, similar to mutualistic, altruistic, and antagonistic relations of RPS alleles in Uta. We constructed evolutionarily stable strategy (ESS) models in which adults impact juvenile recruitment as a function of self versus nonself color recognition. ESS models suggest that the rapid 4-year RPS cycles exhibited by Lacerta are not possible unless three factors are present: behaviors evolve that discriminate self versus nonself morphs at higher rates than random, self- versus non-self-recognition contributes to density regulation, and context-dependent mate choice evolves in females, which choose sire genotypes to enhance progeny survival. We suggest genic selection coupled to density regulation is widespread and thus fundamental to theories of social system evolution as well as theories of population regulation in diverse animal taxa.",2
"X.ISI.000251466400008","Lethal male-male combat in the parasitoid Melittobia acasta: are size and competitive environment important?","Reece, Sarah E. and Innocent, Tabitha M. and West, Stuart A.","ANIMAL BEHAVIOUR","0003-3472","74","5","1163-1169","2007","10.1016/j.anbehav.2006.10.027","Interactions between organisms can lie anywhere along the spectrum from fatal conflict to total cooperation. To understand this variation, knowledge of the strategies that individuals use to acquire their resources is required. We tested theoretical predictions relating to conflict behaviour in a species of parasitoid wasp, Melittobia acasta, in which males compete for mates in their closed, natal patches. They engage in lethal combat to gain access to the females developing in their host. Environmental factors and individual traits both influenced conflict behaviour and contest outcome: fighting behaviour increased with the density of competitors and larger contestants were more successful. Our results also indicate that opponent assessment did not influence conflict behaviour and contests were always resolved by fighting. Crown Copyright (C) 2007 Published by Elsevier Ltd on behalf of The Association for the Study of Animal Behaviour. All rights reserved.",2
"X.ISI.000250298300018","Social heterosis and the maintenance of genetic diversity","Nonacs, P. and Kapheim, K. M.","JOURNAL OF EVOLUTIONARY BIOLOGY","1010-061X","20","6","2253-2265","2007","10.1111/j.1420-9101.2007.01418.x","Genetic diversity in species is often high in spite of directional selection or strong genetic drift. One resolution to this paradox may be through fitness benefits arising from interactions of genetically diverse individuals. Advantageous phenotypes that are impossible in single individuals (e.g. being simultaneously bold and shy) can be expressed by groups composed of genetically different individuals. Genetic diversity, therefore, can produce mutualistic benefits shared by all group members. We define this effect as `social heterosis', and mathematically demonstrate maintenance of allelic diversity when diverse groups or neighbourhoods are more reproductively successful than homogenous ones. Through social heterosis, genetic diversity persists without: frequency dependence within groups, migration, balancing selection, genetic linkages, overdominance, antagonistic pleiotropy or nonrandom allele assortment. Social heterosis may also offer an alternative evolutionary pathway to cooperation that does not require clustering of related individuals, nepotistic favouritism towards kin, or overt reciprocity.",2
"X.ISI.000249502900012","Kinetics of aggregate formation in social insects","Nicolis, S. C.","BULLETIN OF MATHEMATICAL BIOLOGY","0092-8240","69","7","2387-2403","2007","10.1007/s11538-007-9224-y","A model for the kinetics of aggregation in social insects which accounts for stochastic effects arising from individual variability and covers both the early and the mature stages of the process is developed. Different aggregation scenarios are studied, depending on the degree of cooperativity and the mean population density. It is shown that under certain conditions, the system evolves slowly to a single cluster incorporating all individuals, or to two coexisting clusters of similar sizes.",2
"X.ISI.000249879800001","Evolution of dispersal and life history strategies - Tetrahymena ciliates","Fjerdingstad, Else J. and Schtickzelle, Nicolas and Manhes, Pauline and Gutierrez, Arnaud and Clobert, Jean","BMC EVOLUTIONARY BIOLOGY","1471-2148","7",NA,NA,"2007","10.1186/1471-2148-7-133","Background: Considerable attention has focused on how selection on dispersal and other core life-history strategies (reproductive effort, survival ability, colonization capacity) may lead to so-called dispersal syndromes. Studies on genetic variation in these syndromes within species could importantly increase our understanding of their evolution, by revealing whether traits co-vary across genetic lineages in the manner predicted by theoretical models, and by stimulating further hypotheses for experimental testing. Yet such studies remain scarce. Here we studied the ciliated protist Tetrahymena thermophila, a particularly interesting organism due to cells being able to transform into morphs differing dramatically in swim-speed. We investigated dispersal, morphological responses, reproductive performance, and survival in ten different clonal strains. Then, we examined whether life history traits co-varied in the manner classically predicted for ruderal species, examined the investment of different strains into short- and putative long-distance dispersal, while considering also the likely impact of semi-sociality (cell aggregation, secretion of `growth factors') on dispersal strategies. Results: Very significant among-strain differences were found with regard to dispersal rate, morphological commitment and plasticity, and almost all core life-history traits (e. g. survival, growth performance and strategy), with most of these traits being significantly intercorrelated. Some strains showed high short- distance dispersal rates, high colonization capacity, bigger cell size, elevated growth performance, and good survival abilities. These well performing strains, however, produced fewer fast-swimming dispersal morphs when subjected to environmental degradation than did philopatric strains performing poorly under normal conditions. Conclusion: Strong evidence was found for a genetic covariation between dispersal strategies and core life history traits in T. thermophila, with a fair fit of observed trait associations with classic colonizer models. However, the well performing strains with high colonization success and short- distance dispersal likely suffered under a long-distance dispersal disadvantage, due to producing fewer fast-swimming dispersal morphs than did philopatric strains. The smaller cell size at carrying capacity of the latter strains and their poor capacity to colonize as individual cells suggest that they may be adapted to greater levels of dependency on clone-mates (stronger sociality). In summary, differential exposure to selection on competitive and cooperative abilities, in conjunction with selective factors targeting specifically dispersal distance, likely contributed importantly to shaping T. thermophila dispersal and life history evolution.",2
"X.ISI.000244959000001","Evolution and invasion dynamics of multiple infections with Wolbachia investigated using matrix based models","Vautrin, E. and Charles, S. and Genieys, S. and Vavre, F.","JOURNAL OF THEORETICAL BIOLOGY","0022-5193","245","2","197-209","2007","10.1016/j.jtbi.2006.09.035","Endosymbiotic bacteria are often transmitted vertically from one host generation to the next via oocytes cytoplasm. The generally small number of colonizing bacteria in the oocytes leads to a bottleneck at each generation, resulting in genetic homogenization of the symbiotic population. Nevertheless, in many of the species infected by Wolbachia (maternally transmitted bacteria), individuals do sometimes simultaneously harbor several bacterial strains, owing to the fact that Wolbachia induces cytoplasmic incompatibility (CI) that maintains multiple infections. CI occurs in crosses in which the male is infected by at least one Wolbachia strain that the female lacks, and consequently it favors individuals with the greatest symbiotic diversity. CI results in death of offspring in diploid species. In haplodiploid individuals, unfertilized eggs hatch normally into mates and fertilized ones, which would lead to females, either die (female mortality type: FM) or develop into males (male development type: MD). Until now, only one theoretical study, restricted to diploid species, has investigated the associations where multiple CI-inducing Wolbachia co-exist, and explored the conditions under which multiple infections can spread. The consequences of double infections on Wolbachia maintenance in host populations, and the selective pressures to which it is subjected have not yet been analysed. Here, we have re-written a model previously developed for single infection in matrix form, which allows easy extension to multiple infections and introduction of mutant strains. We show that (i) the CI type has a strong influence on invasiveness and maintenance of multiple infections; (ii) double infection lowers the invasion threshold of less competitive strains that hitch-hike with their companion strain; (iii) when multiple infections occur, as in single infections, the strains selected are those which maximize the production of infected offspring; and (iv) for the MD CI type, invasion of mutant strains can carry the whole infection to extinction. (c) 2006 Elsevier Ltd. All rights reserved.",2
"X.ISI.000242964100017","Does soil type drive social organization in southern hairy-nosed wombats?","Walker, Faith M. and Taylor, Andrea C. and Sunnucks, Paul","MOLECULAR ECOLOGY","0962-1083","16","1","199-208","2007","10.1111/j.1365-294X.2006.03131.x","Spatiotemporal distributions of key resources are hypothesized to underpin sociobiological patterns. Burrow availability and quality is of paramount importance to fossorial animals. The southern hairy-nosed wombat (Lasiorhinus latifrons) burrows in both hard and friable soils. Theoretical and empirical studies suggest that the harder substrate should promote closer geographical clustering of burrows than in softer soils. Clustered burrows are expected to be associated with larger group sizes. If sociality is driven by constraint rather than advantage, patterns of spatial and temporal distribution of animals within and among groups may show indications of avoidance or even antagonism, and `making the best of a bad job' via positive kin associations to offset the disadvantages of high-density living. To test these ideas, we compared warren relatedness and social structure of L. latifrons on friable soils (Nullarbor Plain) and hard calcrete (Brookfield Conservation Park, BCP). Individuals were sampled by noninvasive collection of hairs for genotyping to identify individuals and to estimate their space-use and associative behaviour with respect to relatedness. Burrows in calcrete were indeed more clumped, and warren and group size larger. Differences in spatiotemporal organization and relatedness structure between sites were in the expected direction: (i) Nullarbor males associated and shared warrens less than at BCP; and (ii) Nullarbor spatial relatedness patterning data were not consistent with proposed female breeding dispersal, in contrast to those at BCP. Under Nullarbor (low density) conditions, cooperation or tolerance between males may be less advantageous, and accessing or digging burrows should be less of a constraint for juvenile females.",2
"X.ISI.000242897000014","Ant stoichiometry: elemental homeostasis in stage-structured colonies","Kay, A. D. and Rostampour, S. and Sterner, R. W.","FUNCTIONAL ECOLOGY","0269-8463","20","6","1037-1044","2006","10.1111/j.1365-2435.2006.01187.x","1. Organisms facing variation in food quality maintain elemental composition within limited bounds. Such stoichiometric homeostasis has often been considered a species-specific parameter, but stoichiometry can also vary intraspecifically across life stages, sexes and sizes. In colonial organisms with overlapping generations, stoichiometric variation among stages could lead to flexibility in colony-level elemental composition due to changes in internal demography 2. We examine how the balance of energy (sucrose) and nutrients (prey) affects growth rate and carbon : nitrogen : phosphorus (C : N : P) homeostasis in a eusocial insect, the pavement ant Tetramorium caespitum. 3. Colony growth depended heavily on prey availability. However, sucrose scarcity led to higher worker mortality and production of smaller workers, suggesting sucrose availability will affect colony-level performance in a competitive environment. 4. In contrast, C : N : P stoichiometry of larvae, pupae, and workers varied mostly with sucrose availability. Biomass P content within life stages was lower in colonies receiving less access to sucrose. We suggest this difference arose primarily from shifts in individual ant mass coupled with negative P-body mass relationships. 5. Life stages differed considerably in elemental composition, and resource conditions affected colony stage structure. Nevertheless, variation in colony-level stoichiometry primarily reflected compositional differences within stages rather than shifts in internal demography.",2
"X.ISI.000241065200007","Sexual conflict, ecology, and breeding systems in shorebirds","Szekely, Tamas and Thomas, Gavin H. and Cuthill, Innes C.","BIOSCIENCE","0006-3568","56","10","801-808","2006","10.1641/0006-3568(2006)56{[}801:SCEABS]2.0.CO;2","Evolutionary biologists strive to understand the immense variation in animals' breeding systems. Shorebirds represent an ideal model system for this endeavor, because they exhibit diverse breeding systems that include monogamy, with the parents cooperating to rear the young, and polygamy by the male, the female, or both parents, with one parent taking full responsibility for incubating the eggs and rearing the young. Recent experimental manipulations, mathematical models, and phylogenetic analyses reveal that evolutionary pressures may diverge as they act on mated pairs of shorebirds, favoring one parent at a cost to the other. We argue that different reproductive payoffs for the male and the female have had fundamental implications for the evolution of diverse breeding systems.",2
