"label","title","author","journal","issn","volume","number","pages","year","doi","abstract","n_duplicates"
"X.ISI.000390195000003","A common framework for identifying linkage rules across different types of interactions","Bartomeus, Ignasi and Gravel, Dominique and Tylianakis, Jason M. and Aizen, Marcelo A. and Dickie, Ian A. and Bernard-Verdier, Maud","FUNCTIONAL ECOLOGY","0269-8463","30","12","1894-1903","2016","10.1111/1365-2435.12666","1. Species interactions, ranging from antagonisms to mutualisms, form the architecture of bio-diversity and determine ecosystem functioning. Understanding the rules responsible for who interacts with whom, as well as the functional consequences of these interspecific interactions, is central to predict community dynamics and stability. 2. Species traits sensu lato may affect different ecological processes by determining species interactions through a two-step process. First, ecological and life-history traits govern species distributions and abundance, and hence determine species co-occurrence and the potential for species to interact. Secondly, morphological or physiological traits between co-occurring potential interaction partners should match for the realization of an interaction. Here, we review recent advances on predicting interactions from species co-occurrence and develop a probabilistic model for inferring trait matching. 3. The models proposed here integrate both neutral and trait-matching constraints, while using only information about known interactions, thereby overcoming problems originating from undersampling of rare interactions (i.e. missing links). They can easily accommodate qualitative or quantitative data and can incorporate trait variation within species, such as values that vary along developmental stages or environmental gradients. 4. We use three case studies to show that the proposed models can detect strong trait matching (e.g. predator-prey system), relaxed trait matching (e.g. herbivore-plant system) and barrier trait matching (e.g. plant-pollinator systems). 5. Only by elucidating which species traits are important in each process (i.e. in determining interaction establishment and frequency), we can advance in explaining how species interact and the consequences of these interactions for ecosystem functioning.",2
"X.ISI.000389773900037","Exploration is dependent on reproductive state, not social state, in a cooperatively breeding bird","Edwards, Hannah A. and Dugdale, Hannah L. and Richardson, David S. and Komdeur, Jan and Burke, Terry","BEHAVIORAL ECOLOGY","1045-2249","27","6","1889-1896","2016","10.1093/beheco/arw119","Personality is an intriguing phenomenon in populations because it constrains behavioral flexibility. One theory suggests that personality could be generated and maintained if dependent on asset protection. It is predicted that trade-offs with fitness expectations and survival probability encourage consistent behavioral differences among individuals (personality). Although not mutually exclusive, the social niche specialization hypothesis suggests that a group of individuals that repeatedly interact will develop personality to avoid costly social conflict. The point at which behavioral consistency originates in the social niche hypothesis is still unclear, with predictions for development after a change in social status. In the facultative cooperatively breeding Seychelles warbler (Acrocephalus sechellensis), residing on Cousin Island, breeding vacancies are limited and this forces individuals into different social roles. We used this system to test whether reproductive and social state predicted among-individual differences in exploration. We had 2 predictions. First, that an individual's start in life can predict personality, whereby young individuals with a good start to life (associated with early age reproduction and earlier onset survival senescence) are fast explorers, suggesting reproductive state-dependence. Second, that an individual's social status can predict personality, whereby dominant individuals will be fast explorers, suggesting that the behavior is social state-dependent. Neither of the behaviors was associated with social state and social state did not affect behavioral consistency. However, novel object exploration was associated with a proxy of reproductive state. Our results provide further support for state being a mechanism for generating individual differences in behavior.",2
"X.ISI.000388353400027","Prey size and scramble vs. contest competition in a social spider: implications for population dynamics","Sharpe, Ruth V. and Aviles, Leticia","JOURNAL OF ANIMAL ECOLOGY","0021-8790","85","5","1401-1410","2016","10.1111/1365-2656.12559","1. There are many benefits of group living, but also substantial costs, one of which is competition for resources. How scarce food resources are distributed among different members of a population or social group -whether via scramble or contest competition - can influence not only the variance in individual fitness, but also the stability and therefore survival of the group or population. 2. Attributes of the food resources themselves, such as their size, may influence the type of intraspecific competition that occurs and therefore the intrinsic stability of a group or population. 3. By experimentally manipulating the size of prey fed to artificial colonies of the social spider Anelosimus eximius, we investigated whether prey size could alter the degree of scramble vs. contest competition that takes place and, thus, potentially influence colony population dynamics. 4. We found that large prey were shared more evenly than small prey and that individuals in poor condition were more likely to feed when prey were large than when prey were small. Additionally, we show that individuals participating in prey capture are also more likely to feed on the captured prey. 5. We developed a simple mathematical model to explore the prey sizes that would be energetically worth defending, i.e. prey that are `economically defendable'. The model shows that neither very small prey, nor prey above a certain size is worth monopolizing, with only intermediate size prey being `economically defendable'. We therefore suggest the small and large prey in our experiment corresponds to our model's intermediate and large prey categories, respectively. 6. As the size of prey captured by social spider colonies increases with colony size, our findings suggest that scramble competition may predominate in large colonies. Scramble competition, combined with the fact that prey biomass per capita declines as colonies grow beyond a certain size, would then explain why extremely large colonies of this social spider may suddenly go extinct. Our project thus illustrates the potential triple link between characteristics of the resources, individual behaviour and population dynamics, a link rarely considered in an empirical setting.",2
"X.ISI.000381225300008","Variable ecological conditions promote male helping by changing banded mongoose group composition","Marshall, Harry H. and Sanderson, Jennifer L. and Mwanghuya, Francis and Businge, Robert and Kyabulima, Solomon and Hares, Michelle C. and Inzani, Emma and Kalema-Zikusoka, Gladys and Mwesige, Kenneth and Thompson, Faye J. and Vitikainen, Emma I. K. and Cant, Michael A.","BEHAVIORAL ECOLOGY","1045-2249","27","4","978-987","2016","10.1093/beheco/arw006","Ecological conditions are expected to have an important influence on individuals' investment in cooperative care. However, the nature of their effects is unclear: both favorable and unfavorable conditions have been found to promote helping behavior. Recent studies provide a possible explanation for these conflicting results by suggesting that increased ecological variability, rather than changes in mean conditions, promote cooperative care. However, no study has tested whether increased ecological variability promotes individual-level helping behavior or the mechanisms involved. We test this hypothesis in a long-term study population of the cooperatively breeding banded mongoose, Mungos mungo, using 14 years of behavioral and meteorological data to explore how the mean and variability of ecological conditions influence individual behavior, body condition, and survival. Female body condition was more sensitive to changes in rainfall leading to poorer female survival and pronounced male-biased group compositions after periods of high rainfall variability. After such periods, older males invested more in helping behavior, potentially because they had fewer mating opportunities. These results provide the first empirical evidence for increased individual helping effort in more variable ecological conditions and suggest this arises because of individual differences in the effect of ecological conditions on body condition and survival, and the knock-on effect on social group composition. Individual differences in sensitivity to environmental variability, and the impacts this has on the internal structure and composition of animal groups, can exert a strong influence on the evolution and maintenance of social behaviors, such as cooperative care.",2
"X.ISI.000382423700009","Independent origins of parasitism in Animalia","Weinstein, Sara B. and Kuris, Armand M.","BIOLOGY LETTERS","1744-9561","12","7",NA,"2016","10.1098/rsbl.2016.0324","Nearly half of all animals may have a parasitic lifestyle, yet the number of transitions to parasitism and their potential for species diversification remain unresolved. Based on a comprehensive survey of the animal kingdom, we find that parasitism has independently evolved at least 223 times in just 15 phyla, with the majority of identified independent parasitic groups occurring in the Arthropoda, at or below the level of Family. Metazoan parasitology is dominated by the study of helminthes; however, only 20\% of independently derived parasite taxa belong to those groups, with numerous transitions also seen in Mollusca, Rotifera, Annelida and Cnidaria. Parasitism is almost entirely absent from deuterostomes, and although worm-like morphology and host associations are widespread across Animalia, the dual symbiotic and trophic interactions required for parasitism may constrain its evolution from antecedent consumer strategies such as generalist predators and filter feeders. In general, parasitic groups do not differ from their free-living relatives in their potential for speciation. However, the 10 largest parasitic clades contain 90\% of described parasitic species, or perhaps 40\% of all animal species. Hence, a substantial fraction of animal diversity cm the Earth arose following these few transitions to a parasitic trophic strategy.",2
"X.ISI.000377219900014","Ontogenetic shifts in a freshwater cleaning symbiosis: consequences for hosts and their symbionts","Thomas, Michael J. and Creed, Robert P. and Skelton, James and Brown, Bryan L.","ECOLOGY","0012-9658","97","6","1507-1517","2016","10.1890/15-1443.1","Animal fitness is influenced by diverse assemblages of internal and external symbionts. These assemblages often change throughout host ontogeny, but the mechanisms that underlie these changes and their consequences for host fitness are seldom revealed. Here we examine a cleaning symbiosis between crayfish and an assemblage of ectosymbiotic branchiobdellidan worms to uncover what mechanisms drive changes in symbiont composition during host ontogeny and the consequences of these changes for both the host and symbionts. In surveys of a North Carolina river, the dominant worm species shifted from Cambarincola philadelphicus to Cambarincola ingens as crayfish (Cambarus bartonii) increased in size. We demonstrate that this shift is a function of host regulation by small crayfish and exclusion by a dominant symbiont on large crayfish. In a controlled lab experiment, small crayfish often removed their symbionts but C. ingens was removed at a higher rate than C. philadelphicus. In contrast, C. ingens had higher survivorship and reproduction than C. philadelphicus on large crayfish. We also measured the effect of each worm species on crayfish growth through ontogeny; neither worm species had an effect on small crayfish but both species had similar positive effects on the growth of large crayfish relative to controls. Evidence from another experiment suggested that intraguild predation by C. ingens caused a decline in C. philadelphicus on large crayfish. We have shown that shifts in partner fitness are a function of host size and that these shifts can involve the succession of symbionts. Further, our results suggest that changes in the outcome of symbioses can remain robust throughout host ontogeny despite interactive mechanisms that lead to shifts in symbiont community structure.",2
"X.ISI.000374563600003","The social context of a territorial dispute differentially influences the way individuals in breeding pairs coordinate their aggressive tactics","Schuppe, Eric R. and Sanin, Gloria D. and Fuxjager, Matthew J.","BEHAVIORAL ECOLOGY AND SOCIOBIOLOGY","0340-5443","70","5","673-682","2016","10.1007/s00265-016-2088-0","In diverse species, individuals coordinate behavior to accomplish shared goals or tasks. Such coordination, however, often occurs selectively, and the contextual information animals use to determine when they coordinate and when they do not is unclear. We investigate this issue in the highly territorial downy woodpecker (Picoides pubescens) by exploring how individuals within a social breeding pair differentially modulate coordinated aggressive responses during graded simulated territorial intrusions (STIs). Analyses show that resident pairs mount a more robust aggressive response to STIs that represent a greater threat. Moreover, in this social context, pair members produce contact vocalizations in a way that predicts their partner's aggressive behavior. We also show that, when presented with a low threat, individuals that first respond to intrusions decrease their aggressive output once their partner attends to the stimulus; the partner, in turn, increases their levels of aggressive behavior. This does not occur in high-threat STIs, where both partners maintain high levels of aggression throughout the entire encounter. Together, these results show that individuals within a pair flexibly adjust their aggressive tactics in response to different social competitive contexts, and this includes adjusting the way in which individuals coordinate certain aspects of their agonistic repertoire. We speculate that this ability reflects an adaptive mechanism that allows individuals to fine-tune territorial tactics to reduce overall costs of aggression. Although research has demonstrated that individuals often coordinate their behavior to accomplish common tasks, little is known about the factors that determine when such coordination occurs and when it does not. We address this issue for the first time in the highly territorial downy woodpecker by testing how the level of threat associated with a territorial interaction influences the coordination of defensive behavior. We find that, when facing intruders that pose a greater threat, residents adjust levels of aggressive output in response to the number of vocalizations produced by their breeding partner. By contrast, this relationship is not observed when pairs face intruders that pose a relatively lower threat. Our data therefore provide striking evidence that coordination in defensive tactics depends on the residents' appraisal of the social context, such that fiercer competition is associated with greater behavioral coordination.",2
"X.ISI.000374563600015","Intergroup encounters in Verreaux's sifakas (Propithecus verreauxi): who fights and why?","Koch, Flavia and Signer, Johannes and Kappeler, Peter M. and Fichtel, Claudia","BEHAVIORAL ECOLOGY AND SOCIOBIOLOGY","0340-5443","70","5","797-808","2016","10.1007/s00265-016-2105-3","Individuals living in groups have to achieve collective action for successful territorial defense. Because conflicts between neighboring groups always involve risks and costs, individuals must base their decision to participate in a given conflict on an evaluation of the trade-off between potential costs and benefits. Since group members may differ in motivation to engage in group encounters, they exhibit different levels of participation in conflicts. In this study, we investigated factors influencing participation in intergroup encounters in Verreaux's sifakas (Propithecus verreauxi), a group-living primate from Madagascar. Over a period of 12 months, we studied eight adjacent sifaka groups in Kirindy Forest. We observed 71 encounters between known neighboring groups in which adult females and males participated equally as often. No individual participated in every encounter, and non-participation occurred more often in larger groups. Females participated less often in encounters when they had dependent infants, presumably to reduce the risk of infanticide. Male participation was influenced by social status: dominant males participated in most encounters, whereas males with fewer opportunities to reproduce participated less often, hence male participation is influenced by the incentive of maintaining access to females. The number of actively participating individuals in the opponent group positively influenced the participation in both sexes. Thus, sifakas seem to decide joining a given encounter opportunistically, most likely based on a combination of individual incentives and the actual circumstance of each encounter, suggesting that the complexity in intergroup relationships appears to be the product of decisions made by each individual group member. Cooperation among group-living animals is often challenged by collective action problems resulting from individual differences in interests in contributing to collective behaviors. Intergroup encounters involve distinguished costs and benefits for each individual despite being in the same social group. Therefore, encounters between groups offer a good opportunity to investigate individual participation in collective action. In this study, we investigate the influence of different incentives on individual participation in intergroup encounters in wild Malagasy primate, Verreaux's sifakas. We propose a novel approach that takes into account the variable circumstances of each conflict, such as the number of individuals fighting in both groups as a predictor for participation. We believe that our study not only provides novel data on wild sifakas, but it also offers new perspectives for the interpretation of intergroup relationships in other taxa.",2
"X.ISI.000370888300003","Bargaining power and adolescent aggression: the role of fighting ability, coalitional strength, and mate value","Sell, Aaron and Eisner, Manuel and Ribeaud, Denis","EVOLUTION AND HUMAN BEHAVIOR","1090-5138","37","2","105-116","2016","10.1016/j.evolhumbehav.2015.09.003","Basic models of animal conflict show that animals with more bargaining power can expect a larger share of resources and more frequently deploy aggression when challenged. Bargaining power comes from multiple sources including formidability (e.g. personal fighting ability) and cooperative value (e.g. mate value). Here, we apply this basic conceptual framework to human adolescents and test seven core hypotheses derived from this paradigm on a large sample of Swiss students (N = 1447; 15-17 years old). Three components of bargaining power were measured in males and females: fighting ability, coalitional strength, and mate value. Fighting ability and mate value reliably predicted aggression, aggressive attitudes, and delinquent behavior in both boys and girls. The effect of fighting ability on aggression was predictably larger and more robust in males than females. Coalitional strength also reliably predicted aggressive bargaining in boys but less consistently in girls. Regression analyses showed that the effect of each component of bargaining power was independent and survived numerous controls. Results support the thesis that individual differences in aggressive behavior result, in part, from individual differences in bargaining power. (C) 2016 Elsevier Inc. All rights reserved.",2
"X.ISI.000374207800016","Information use and resource competition: an integrative framework","Lee, Alexander E. G. and Ounsley, James P. and Coulson, Tim and Rowcliffe, J. Marcus and Cowlishaw, Guy","PROCEEDINGS OF THE ROYAL SOCIETY B-BIOLOGICAL SCIENCES","0962-8452","283","1825",NA,"2016","10.1098/rspb.2015.2550","Organisms may reduce uncertainty regarding how best to exploit their environment by collecting information about resource distribution. We develop a model to demonstrate how competition can facilitate or constrain an individual's ability to use information when acquiring resources. As resource distribution underpins both selection on information use and the strength and nature of competition between individuals, we demonstrate interdependencies between the two that should be common in nature. Individuals in our model can search for resources either personally or by using social information. We explore selection on social information use across a comprehensive range of ecological conditions, generalizing the producer scrounger framework to a wide diversity of taxa and resources. We show that resource ecology defined by scarcity, depletion rate and monopolizability determines patterns of individual differences in social information use. These differences suggest coevolutionary processes linking dominance systems and social information use, with implications for the evolutionary demography of populations.",2
"X.ISI.000367474300005","Individual variation behind the evolution of cooperation","Barta, Zoltan","PHILOSOPHICAL TRANSACTIONS OF THE ROYAL SOCIETY B-BIOLOGICAL SCIENCES","0962-8436","371","1687",NA,"2016","10.1098/rstb.2015.0087","Life on Earth has two remarkable properties. The first is variation: even apart from the vast number of extant species, there are considerable differences between individuals within a single species. The second property is cooperation. It is surprising that until recently the interactions between these two properties have rarely been addressed from an evolutionary point of view. Here, I concentrate on how inter-individual differences influence the evolution of cooperation. First, I deal with cases where individuality is maintained by random processes like mutation or phenotypic noise. Second, I examine when differences in state cause differences in behaviour. Finally, I investigate the effects of individual role specialization. Variation can be important in several ways. Increased random variation can change the expectation about cooperativeness of future partners, altering behaviour in a current relationship. Differences in state may serve as a book-keeping mechanism that is necessary for the evolution of reciprocity. If the cost of cooperation can depend on state then strategic regulation of state makes it possible to coerce partners to cooperate. If conditions force individuals to specialize, cooperation becomes more valuable. My review of theoretical models suggests that variation plays an important role in the evolution of cooperation.",2
"X.ISI.000367474300013","Adaptations for social cognition in the primate brain","Platt, Michael L. and Seyfarth, Robert M. and Cheney, Dorothy L.","PHILOSOPHICAL TRANSACTIONS OF THE ROYAL SOCIETY B-BIOLOGICAL SCIENCES","0962-8436","371","1687",NA,"2016","10.1098/rstb.2015.0096","Studies of the factors affecting reproductive success in group-living monkeys have traditionally focused on competitive traits, like the acquisition of high dominance rank. Recent research, however, indicates that the ability to form cooperative social bonds has an equally strong effect on fitness. Two implications follow. First, strong social bonds make individuals' fitness interdependent and the `free-rider' problem disappears. Second, individuals must make adaptive choices that balance competition and cooperation-often with the same partners. The proximate mechanisms underlying these behaviours are only just beginning to be understood. Recent results from cognitive and systems neuroscience provide us some evidence that many social and non-social decisions are mediated ultimately by abstract, domain-general neural mechanisms. However, other populations of neurons in the orbitofrontal cortex, striatum, amygdala and parietal cortex specifically encode the type, importance and value of social information. Whether these specialized populations of neurons arise by selection or through developmental plasticity in response to the challenges of social life remains unknown. Many brain areas are homologous and show similar patterns of activity in human and non-human primates. In both groups, cortical activity is modulated by hormones like oxytocin and by the action of certain genes that may affect individual differences in behaviour. Taken together, results suggest that differences in cooperation between the two groups are a matter of degree rather than constituting a fundamental, qualitative distinction.",2
