12/12/2019 6:21:47,MA80,PT,Modelling/theory,Male-female,Intra-specific (within population),n/a,Shape of the function of reproduction (number) against investment cost.,n/a,n/a,There's no antagonism,No.  Just looking at cooperation; there's not antagonism.,n/a,n/a,Evolution of males/females compared to hermaphrodites,Not really.,,I don't think it's relevant for us.,No,Not about the antagonism-mutualism scale.,,,,,,,
12/12/2019 9:24:16,MA86,PT,Modelling/theory,Consumer-resource/predator-prey,"Inter-specific (>2 species), Intra-specific (within population), Intra-specific (between populations)",n/a,n/a,n/a,No,Paper is not relevant,No.  Paper is not relevant.,Paper is not relevant,n/a,n/a,Quite possibly -- but the paper does not get into the topic of antagonism-mutualism.,,"Not relevant, despite the abstract making it seem so.",No,Does not get into the antagonism-mutualism continuum.,,,,,,,
12/12/2019 10:45:24,MA109,PT,Modelling/theory,"Abstract interaction (type not specified, but relates to invasions)",Inter-specific (2 species),u and v,Dispersal switching rate (and rate of local dynamical processes),"In some ways, both.  In another way, neither.",No.,Species,Yes. (Woo hoo!),"Either.  (When switching rate is high, the system is cooperative, when low, it's antagonistic.)",Mainly the switching rate between modes of migration,"Aside from cooperative/antagonistic, the stability of the system and the speed of invasion waves, I think.  (I'd need considerable time to really absorb this paper; it's quite maths-heavy.)","Hmm, probably not (aside from bieng useful for this project)","It's not an easy paper to digest; will take some deep thought to know how best to summarise it for the review, as the inputs are single (rate) values -- so it could be argued to *not* be relevant.  I think it's the sort of approach that Meike is more used to than I am -- so she may be able to digest it much more easily.","It's really that the trait gets set (high or low rate of switching between migration modes) and this then governs mutulaism/antagonism.  So it's not really that the trait itself varies, as it's an input.  However, I think the paper is still relevant to this review, as it says what should happen depending on that input.",Maybe,"There is no evidence of trait variation, It allows at trait to vary, and as that trait value cahnges, so does the cooperation/antagonism.  Which is why it's a maybe; it depends whether we can then interpret results in terms of subpopulations with different input values -- and that will require considerable thought.",,,,,,,
12/12/2019 21:08:56,MA183,PT,Modelling/theory,Cooperation in removing parasites,"Inter-specific (2 species), Intra-specific (within population)",n/a,"Payoffs, which depend on parasite loads, efficiency of grooming and the mobility of parasites.","The host ... but it's not really that a trait varies.  It's more that all individuals use the same evolved settings, but then have different parasite loads, so may behave differently -- and this could lead to cooperation.",No,Not really; just about whether to cooperate or not,"No, just cooperation really (although they address it in terms of the Prisoner's Dilemma)",,Ecological: parasite load changes the payoffs..,Alterations in parasite load,I don't think so.,,"There's not really antagonism, it's more about whether to cooperate or not.  The difference in 'trait' comes about not through inherent differences in the individuals, but thier parasite loads.  The authors don't seem to know the literature well and pitch things a bit weirdly (e.g., having individuals cooperate with 50% probability in the first interaction, rather than that level evolving).  So, it's not great!",Maybe,See answer to Q16,,,,,,,
12/13/2019 5:59:19,MA201,PT,Review,"Competition-cooperation, Review of different routes to evolution of cooperation",Intra-specific (within population),n/a,"Various: variation in potential to remain in the interaction, variation in state, parental care decisions (alternate vs sequential), uncertainty over partner's state, etc.",The focal species,No.,"Individuals, Populations",Not really -- it's about the cooperations spectrum rather than antagonism per se.,"Review mainly of theory, so both ways (but just wrt cooperation)","ecological, abiotic, social, mutational",It's focused on cooperation rather than identifying other (ecological) impacts,To some degree,,Mainly just the concern that it's about cooperation; not about antagonism,Maybe,Not about the antagonism part; just about evol of cooperation.,,,,,,,
12/16/2019 5:13:52,MA164,BC,Observational,Competition-cooperation,"Intra-specific (within population), not clear, cooperation within the colony and competition among colonies", Formica paralugubris,colony member or not, Formica paralugubris,no,Individuals,no,,"social , being a nest mate or not",,no,"The paper did not investigate the shift in that trait, it investigated the underlying fine scale population genetic structure",,Maybe,"As mentioned, the authors do not really investigate the trait variation or trait shift, but only the population genetic structure",,,,,,,
12/16/2019 5:56:59,MA173,BC,Observational,Competition-cooperation,Intra-specific (within population),Humans,Childhood environment ,humans,no,Individuals,yes,Mutualistic to antagonistic,Childhood exposure to neighbourhood violence and crime,,yes,,,No,Humans as a study subject (note: this is currently being treated as an exclusion criteria),,,,,,,
12/16/2019 6:08:25,MA174,BC,Observational,Competition-cooperation,Intra-specific (within population),"Polistes dominulus, Liostenogaster flavolineata",greater expected future fitness,"Polistes dominulus, Liostenogaster flavolineata",no,Individuals,yes,Mutualistic to antagonistic,"expected future fitness, i.e. rank order, or groups size ",,promotion of individual differences  - niche choice or niche conformance,,"no , except that they used data from a previous study",Yes,,,,,,,,
12/17/2019 15:34:06,MA320,BC,"Experimental, Review",Male-female,Intra-specific (within population),,brooding / care of young,Kentish plover,no,Individuals,not within an individual,,adult sex ratio,possibility to remate,"yes niche choice, conformance ",it is a review summarizing multiple papers of the authors,it is not clear whether the trait varies among individuals only or within an individual,Maybe,"There is no shift in the quality of the interaction, as mentioned above not clear whether there is a trait shift within an individual",,,,,,,
12/22/2019 20:40:34,MA332,BC,Experimental,Competition-cooperation,Intra-specific (within population),,sporulation/swarming intensity/frequency,Myxococcus xanthus,"they look at clones, showing or not showing this trait as a result of a mutation","Individuals, Clones",yes,,"mutation, probably driven by social factors (density)",,yes,,,Yes,,,,,,,,
12/22/2019 20:59:52,MA339,BC,Observational,"Male-female, Competition-cooperation",Intra-specific (within population),,MAting status/ child care,humans,no,Individuals,yes,Antagonistic to mutualistic,"mating status (social), presence of offspring",cooperation during child care parenting ,yes,,,No,Humans as a study subject (note: this is currently being treated as an exclusion criteria),,,,,,,
12/22/2019 21:08:22,MA361,BC,Observational,Competition-cooperation,Intra-specific (within population),,social status,Julidochromis ornatus,No,Individuals,no (has not been studied),,social status,,yes,,,Maybe,"There is no shift in the quality of the interaction, at least this shift has not been investigated",,,,,,,
12/22/2019 21:22:12,MA369,BC,Experimental,Competition-cooperation,Intra-specific (within population),,monetary rewards,humans,no,Individuals,yes,both ways,ecological (negative vs. positive environment) and social (human vs computer partner),prosocial Behaviour increases in negative environments,"yes, niche choice",,,No,Humans as a study subject (note: this is currently being treated as an exclusion criteria),,,,,,,
12/23/2019 3:53:56,MA19,LKL,"Observational, Experimental","Host-symbiont, Competition-cooperation",Inter-specific (2 species),67 bacterial isolates from M. annularis coral,Antibacterial activity (Intensity of inhibition against one another coral-associated bacteria),Coral-associated bacteria,No,Species,No,No shift - only antagonistic interactions between coral-associated  was studied ,,antagonistic bacteria help defending their coral host against pathogen invasion,No,Nil,No clear shift,No,There is no shift in the quality of the interaction,,,,,,,
12/23/2019 19:08:52,MA375,BC,Experimental,"Male-female, Competition-cooperation",Intra-specific (within population),NA,Agressive /submissive behaviour,Neolamprologus pulcher,no,,"no, is not investigated. ",,NA,NA,niche conformance,NA,NA,Maybe,There is no shift in the quality of the interaction,,,,,,,
12/24/2019 10:52:29,MA106,BC,Experimental,Competition-cooperation,Intra-specific (within population),,,Elacatinus prochilos,no,Individuals,yes,Mutualistic to antagonistic,presence/absence of larger individuals,,"yes, the maintenance of individual-level traits; niche conformance",,no,Yes,,,,,,,,
12/25/2019 6:31:16,MA9,RR,Experimental,Host-symbiont,Inter-specific (2 species),Anemonia  viridis (sea anemone )and Symbiodinium clade   temperate   A (dinoflagellate),There is no such trait influencing the quality of interaction.  Instead they found a differential gene expression between the symbiotic and aposymbiotic states,The paper only study the variation in gene expression (in Anemonia  viridis ) to decipher the molecular signals that are central for the stability of interaction,,,No.,,gene expression ,"due to the collapse of the symbiotic interaction, the coral reefs are declining- this is the ecological importance of the interaction.",no,,,No,"There is no evidence of trait variation, The study is just trying to understand the molecular signals responsible for the symbiotic and aposymbiotic forms of the sea anemones. The inter-individual variability in gene expression found in the study just indicates that the aposymbiosis could be induced by different pathways.",,,,,,,
12/27/2019 8:49:51,MA264,RR,Experimental,Host-symbiont,Inter-specific (>2 species),Cambarus bartonii (cray fish) and Cambarincola philadelphicus and Cambarincola ingens (  branchiobdellidan annelids ),size or ontogenic stage,host (cray fish),"No, it is about the variation in size at different life stages",the symbiont composition changes with the size difference at different life changes.,the study shows a rapid removal rate of the worms by smaller hosts. ALso there was  gill scarring by the worms on the hosts but dont have a net negative effect.But in general it is stated about the interaction that the worms can turn parasites when there is food limitation.,the dominating symbiotic species changes with host ontogeny due to removal of the symbiont species by host differentially at different life stages.,the shift in symbiont composition was due to ability of the symbionts to avoid removal by host which inturn depends on the size of the specific symbiont species and the specific life stage (size) of the host,no such information obtained from the paper,no,,,No,"The trait varies between species, not within-species",,,,,,,
12/29/2019 23:07:48,MA209,RR,Experimental,Host-symbiont,Inter-specific (>2 species),brook charr (Salvelinus fontinalis) and their skin microbiota (different bacteria)),"No such trait mentioned, it is about the possible regulation of the abundance of specific genera of skin microbiota by the genotype of host (brook charr).",,the paper reports that the genotype of host (brook charr) may regulate the abundance of specific genera of skin microbiota.,There is possible regulation of the abundance of the genera of skin microbiota according to the genotype of host and some of the genera can provide protection for the host from pathogens.,The study reports about a possible genetic basis of mutualism between the host and the commensal skin microbiota ,"depending on host genotype, possible change from commensalism to mutualism",genotype of host,no such information provided,"yes, it mentions about potenial genetic basis of hosts for mutualism between the host and its commensal skin microbiota.",,,Yes,,,,,,,,
12/30/2019 9:27:22,MA22,LKL,"Observational, Experimental",Host-symbiont,Inter-specific (>2 species)," Host (pea aphid, Acyrthosiphon pisum); bacterial symbiont (Hamiltonella defensa);  parasitic wasp (Aphidius ervi)",host resistance (symbiont-/aphid-based) to parasitism by the wasp A. ervi,"Host (pea aphid, Acyrthosiphon pisum)","heritable protective symbiont H. defensa contributes variation in resistance to parasitic wasp, depending on symbiont strain and associated bacteriophage haplotype but still unclear about the relationship between aphid genotype and variation in resistance",Species,No,No shift,"(symbiont-based)symbiont strain, associated bacteriophage haplotype, temperature; (aphid-based)temperature, aphid genotype, host plant"," H. defensa confer their host, pea aphid resistance against the parasitic wasp Aphidius ervi ",Yes,Nil,no clear shift in the interaction,No,There is no shift in the quality of the interaction,,,,,,,
12/30/2019 13:13:28,MA70,RR,Experimental,Host-symbiont,Inter-specific (2 species),potter wasps -Allodynerus delphinalis (Hymenoptera: Vespidae) and mite- Ensliniella parasitica (Astigmata: Winterschmidtiidae),the number of mite symionts ,NA,NA,when number of mites per host larvae exceed the normal level they become parasitic to hosts,Yes,Mutualistic to antagonistic,number of mites per host larvae,NA,"No, there is no mention of variation in individuals that can lead to the shift to parasitism. The study predicts a possible reversion or change from the mutualism to antogonism (parasitism) upon an increase in the number of mites per host.",NA,NA,No,There is no evidence of trait variation,,,,,,,
1/1/2020 3:00:28,MA73,LKL,Review,Host-symbiont,Inter-specific (>2 species),"wood- wasps (Siricidae), their fungal symbionts (Amylostereum), and parasitic Deladenus nematodes",dimorphic nematode can be mycophagous (feeding on fungal symbionts within tree where the host inhabit) or parasitic (bore into host at larval stage and the females are used as vectors),Deladenus nematodes (the parasite),"Probably, judging by the references ","Individuals, Populations",This review referred to two other studies suggesting that symbiont infection could be costly for the host when the parasitoids are absent. ,"Mutualistic to antagonistic, Antagonistic to mutualistic, antagonistic (parasitism) <-> commensalism (parasite feeding on the symbiont and use the host as vector)",species or strain of their fungal symbiont; condition of dwelling tree (extra evidence: mycophagous nematodes turn into parasitic form under high CO2 and low pH in vitro),Nutrient cycles/energy flow/succession(?): Wood degradation process (habitats of other animals within the tree; fungal diversity ,Yes,NA,NA,Yes,,,,,,,,
1/1/2020 5:18:34,MA10,RR,Experimental,"Host-symbiont, Consumer-resource/predator-prey",Inter-specific (>2 species),Cecidomyiid gall midge (Asteromyia carbonifera ) and its fungal symbiont- Botryosphaeria dothidea and different parasitoid wasps,fungal gall morphology (extended phenotype) induced by the midges causes differential attacks by their dfferent predator parasitoid wasps,the symbiont fungus Botryosphaeria dothidea,The paper tells about the genotype of the midges and may be also the genotype of host plants affecting the phenotypes of the fungal gall ,,"Not really, But it shows that the variation in the fungal gall phenotypes in the symbiosis affect the predation of the midge larvae by different parasitoid wasps",,NA,ecological impact of the interaction is mentioned - this paper illustrates the potential importance of consumer-resource and symbiotic species interaction in adaptive radiation,There is maintenance of individual -level traits as shown by the different gall morphologies in the symbiosis,,But there is no clear shift in the interactions mentioned in the paper. The paper is all about potential importance of the consumer-resource and symbiotic species interaction in adaptive radiation.,Maybe,There is no shift in the quality of the interaction,,,,,,,
1/1/2020 23:55:57,MA326,LKL,Observational,Host-symbiont,"Inter-specific (>2 species), Intra-specific (within population), Intra-specific (between populations)","Host, beach hopper amphipod Talorchestia quoyana ; symbionts/parasites including  species of mermithid nematode that resembles Thaumamermis cosgrovei, unidentified rhabditid nematode and phoretic deutonymph stage of the mite Dendrolaelaps sp.",NA,NA,NA,no shift indicated,No,NA,NA,No shift,No,Nil,Nil,No,"There is no evidence of trait variation, There is no shift in the quality of the interaction",,,,,,,
1/2/2020 0:34:38,MA303,LKL,"Observational, Experimental","Host-symbiont, Competition-cooperation",Inter-specific (>2 species),"lucanid beetles (Dorcus rectus and Dorcus striatipennis) and symbiotic mites (Haitlingeria sp. and Sandrophela sp., respectively)",,"Nil, this study focuses on the geographic variation",NA,,No,,,,Yes,Nil,Nil,No,"There is no shift in the quality of the interaction, The trait varies between species, not within-species",,,,,,,
1/2/2020 7:30:46,MA202,RR,"Experimental, network approach",plant-animal,Inter-specific (>2 species), Didelphis albiventris and the different plant species they feed on (29 species),fruit consumption behaviour, Didelphis albiventris,no,,no,,NA,ecological impact of the interaction- seed dispersal,there exists a variation within the population in the fruit consumption behaviour of didelphids,No,No shift in interaction between mutualism and antagonism,Maybe,the paper talks about the variation in fruit consumption behaviour of opossums and also suggests that there could be possible effects of this variations on the individual plant performance and plant community composition. But it doesnot mention about any shift of interaction between mutualism and antagomism.,,,,,,,
1/2/2020 22:18:28,MA84,MW,Review,"Male-female, Competition-cooperation",Intra-specific (within population),Homo sapiens,discusses various traits related to social learning,humans,NA,,no,,NA,NA,NA,NA,NA,No,"There is no evidence of trait variation, There is no shift in the quality of the interaction, Humans as a study subject (note: this is currently being treated as an exclusion criteria)",,,,,,,
1/2/2020 23:21:02,MA403,MW,"Modelling/theory, Review",Competition-cooperation,Intra-specific (within population),NA,"aspects of personality (e.g. trustworthyness, or more specifically number of rounds before defection in an iterated prisoner's dilemma), but also other needs and abilities of individuals",NA,NA,Populations,yes,can be both depending on the direction of parameter change,e.g. mutation rate,NA,"Interesting thought that ""variation in one trait maintains the variation in the other, and vice versa""","Relevant insights: 1) If there is a lot of variation (e.g. due to mutation) in the number of rounds before defection in the iterated prisoner's dilemma, it can make sense for individuals to cooperate for longer than the population average and cooperativeness increases in the population. 2) Variation in partner quality can promote the evolution of choosiness, which penalizes less cooperative individuals and thus promotes cooperation. 3) In fighting situations, costly displays can be seen as cooperative because they help resolve the fight and reduce its costs. Such displays can only evolve if there is sufficient variation in strength among individuals.",NA,Yes,,,,,,,,
1/2/2020 23:29:09,MA63,MW,"Modelling/theory, Review",Competition-cooperation,Intra-specific (within population),NA,generosity,NA,NA,Populations,yes,depends,e.g. the extent to which partner choice is possible,NA,NA,"Key sentence: ""introducing individual differences in
generosity combined with partner choice can lead to
competition for partners and thereby to an escalation in
generosity which is rewarded by greater benefits for those
which choose to or can invest more""",NA,Yes,,,,,,,,
1/3/2020 0:04:06,MA372,MW,Modelling/theory,Competition-cooperation,Intra-specific (within population),NA,investment in an interaction (and/or perception of the investment of the other individual),NA,"Here it is assumed that variation is due to noise, i.e. individuals making errors. The variation is non-heritable.",Populations,Not so clear that there is a shift in response to variation or here the distribution of the errors individuals make.,depends,curvature of cost and benefit functions,NA,,They write that variation due to errors is in many ways qualitatively analogous to variation in individual quality.,"""Under most conditions the magnitude of error has no influence on the evolutionary outcome"". More specifially, they show that the singular solution does not depend on the magnitude of error, but the convergence stability might. In any case, this is not an example of a very clear shift caused by variation.",Maybe,There is no shift in the quality of the interaction,,,,,,,
1/3/2020 0:26:01,MA373,MW,Modelling/theory,Competition-cooperation,Intra-specific (within population),NA,"strength, i.e. fighting ability",NA,assumed non-heritable,Populations,"There should be a shift with changing magnitude of variation in strength, although they don't explore this explicitly (see comment below).",depends,"value of the resource that the fight is about, group size",NA,NA,"Over a range of parameter values, there are alternative stable states (turn-taking and contest competition). Shifts here could also be caused by stochastic processes and initial conditions.","Individual strength is drawn from a uniform distribution between 0 and 1. They do not explore different levels of variation. Therefore we can only indirectly infer the consequences of variation. Since they find that ""a decreasing ability to identify the stronger individual favours the evolutionary stability of the turn-taking strategy"", increasing variation in strength should hinder the evolution of turn-taking.",Yes,,,,,,,,
1/4/2020 5:21:21,MA290,LKL,Experimental,Host-symbiont,Inter-specific (2 species),"invasive mussel (Anodonta woodiana), European bitterling (Rhodeus amarus)",behavioural phenotype,R. amarus (ejecting their parasitic larvae; behavioural avoidance/preference to oviposit in A. woodiana and A. anatina); A. woodiana (the capacity to metamorphose on R. amarus),No,Populations,No ,Not clearly shown by this study but a large body of research has demonstrated the shifts,"invasion of a competitor (native species), rate/degree of adaptations",community structure and interspecific associations,Yes,NA,NA,Maybe,There is no shift in the quality of the interaction,,,,,,,
1/6/2020 5:07:51,MA268,LKL,Experimental,"Host-symbiont, Consumer-resource/predator-prey",,"Trinidadian guppy (Poecilia reticulata), ectoparasite (Gyrodactylus spp.), predators not specified","Instead the study focuses at the differences of guppies' behavioural traits such as activity, sociability (shoaling tendency) and boldness in selection regimes with various predation and parasitism intensities",Trinidadian guppy (Poecilia reticulata),Yes,NA,No,No shift,NA,NA,maintenance of individual-level traits,NA,No shift,Maybe,There is no shift in the quality of the interaction,,,,,,,
1/6/2020 8:22:53,MA344,NC,Observational,Competition-cooperation,"Inter-specific (2 species), Intra-specific (within population)","Tursiops truncatus, Homo sapiens",cooperativeness,Tursiops truncatus,No,,No,,,Cooperativeness decreases necessary foraging area and sometimes increases site conservatism.,"Yes, promotion of individual-level traits ",,No within-individual shift,Yes,,,,,,,,
1/6/2020 8:54:50,MA409,NC,Experimental,"Host-symbiont, Competition-cooperation",Inter-specific (2 species),"Chamaecrista fasciculata & competitors, rhizobia",Resource availability ,Chamaecrista fasciculata,No,,No,,,"Mutualism leads to reduced community diversity, most strongly under resource limitation",No,Mostly effect on community diversity,No clear shift,No,There is no shift in the quality of the interaction,,,,,,,
1/6/2020 9:07:50,MA351,NC,Experimental,Consumer-resource/predator-prey,Inter-specific (2 species),"Macrocheles subbadius, Drosophila nigrospiracula","Starvation, mating status of mite, previous infection and injury of host",both,No,Individuals,"Yes, from free-living to antagonism/parasitism",Mutualistic to antagonistic,"Ecological, resource-availability",Increase of parasitism,Yes,,Shift is from neutral to antagonism and is resource-availability/demand -driven,Yes,,,,,,,,
1/6/2020 9:25:31,MA389,NC,Review,Host-symbiont,,,,,,,,,,,Not for quantitative analyses,"As a review on parasitism - many important points, none quantifiable",,Maybe,"The trait varies between species, not within-species, not quantitative",,,,,,,
