"","abstract.id","title.x","abstract.x","screener.id.x","decision.x","scale.x","topic.x","notes.x","title.y","abstract.y","screener.id.y","decision.y","scale.y","topic.y","notes.y"
"305","MA373","The evolution of cooperative turn-taking in animal conflict","Background: A fundamental assumption in animal socio-ecology is that animals compete over limited resources. This view has been challenged by the finding that individuals might cooperatively partition resources by ""taking turns"". Turn-taking occurs when two individuals coordinate their agonistic behaviour in a way that leads to an alternating pattern in who obtains a resource without engaging in costly fights. Cooperative turn-taking has been largely ignored in models of animal conflict and socio-ecological models that explain the evolution of social behaviours based only on contest and scramble competition. Currently it is unclear whether turn-taking should be included in socio-ecological models because the evolution of turn-taking is not well understood. In particular, it is unknown whether turn-taking can evolve when fighting costs and assessment of fighting abilities are not fixed but emerge from evolved within-fight behaviour. We address this problem with an evolutionary agent-based model. Results: We found that turn-taking evolves for small resource values, alongside a contest strategy that leads to stable dominance relationships. Turn-taking leads to egalitarian societies with unclear dominance relationships and non-linear dominance hierarchies. Evolutionary stability of turn-taking emerged despite strength differences among individuals and the possibility to evolve within-fight behaviour that allows good assessment of fighting abilities. Evolutionary stability emerged from frequency-dependent effects on fitness, which are modulated by feedbacks between the evolution of within-fight behaviour and the evolution of higher-level conflict strategies. Conclusions: Our results reveal the impact of feedbacks between the evolution of within-fight behaviour and the evolution of higher-level conflict strategies, such as turn-taking. Similar feedbacks might be important for the evolution of other conflict strategies such as winner-loser effects or coalitions. However, we are not aware of any study that investigated such feedbacks. Furthermore, our model suggests that turn-taking could be used by animals to partition low value resources, but to our knowledge this has never been tested. The existence of turn-taking might have been overlooked because it leads to societies with similar characteristics that have been expected to emerge from scramble competition. Analyses of temporal interaction patterns could be used to test whether turn-taking occurs in animals.  2011Franz et al; licensee BioMed Central Ltd.","CF","include","intraspecific","Cooperation, modelling","","The evolution of cooperative turn-taking in animal conflict","Background: A fundamental assumption in animal socio-ecology is that animals compete over limited resources. This view has been challenged by the finding that individuals might cooperatively partition resources by ""taking turns"". Turn-taking occurs when two individuals coordinate their agonistic behaviour in a way that leads to an alternating pattern in who obtains a resource without engaging in costly fights. Cooperative turn-taking has been largely ignored in models of animal conflict and socio-ecological models that explain the evolution of social behaviours based only on contest and scramble competition. Currently it is unclear whether turn-taking should be included in socio-ecological models because the evolution of turn-taking is not well understood. In particular, it is unknown whether turn-taking can evolve when fighting costs and assessment of fighting abilities are not fixed but emerge from evolved within-fight behaviour. We address this problem with an evolutionary agent-based model. Results: We found that turn-taking evolves for small resource values, alongside a contest strategy that leads to stable dominance relationships. Turn-taking leads to egalitarian societies with unclear dominance relationships and non-linear dominance hierarchies. Evolutionary stability of turn-taking emerged despite strength differences among individuals and the possibility to evolve within-fight behaviour that allows good assessment of fighting abilities. Evolutionary stability emerged from frequency-dependent effects on fitness, which are modulated by feedbacks between the evolution of within-fight behaviour and the evolution of higher-level conflict strategies. Conclusions: Our results reveal the impact of feedbacks between the evolution of within-fight behaviour and the evolution of higher-level conflict strategies, such as turn-taking. Similar feedbacks might be important for the evolution of other conflict strategies such as winner-loser effects or coalitions. However, we are not aware of any study that investigated such feedbacks. Furthermore, our model suggests that turn-taking could be used by animals to partition low value resources, but to our knowledge this has never been tested. The existence of turn-taking might have been overlooked because it leads to societies with similar characteristics that have been expected to emerge from scramble competition. Analyses of temporal interaction patterns could be used to test whether turn-taking occurs in animals.  2011Franz et al; licensee BioMed Central Ltd.","NM","include","intraspecific","theoretical/modelling; competition-cooperation",""
"307","MA375","The extended personality: indirect effects of behavioural syndromes on the behaviour of others in a group-living cichlid","Consistent individual variation in behaviour is widespread across taxa and behavioural categories. Because social behaviour is often a plastic response to the social environment, consistent variation in social behaviours such as aggression and cooperation may generate consistent variation in the behaviour of social partners and others in the group. In this study, we moved individual subordinate males between groups of a cooperatively breeding cichlid, Neolamprologus pulcher. We found that subordinate males varied consistently in their aggressive interactions with neighbouring fish. The effects of individual subordinate males extended beyond their direct interactions; agonistic interactions between dominant males and dominant females varied consistently with subordinate male identity. We suggest that variation in helping behaviour through territorial defence influences the net fitness effects of subordinate males on dominant males and, thus, the potential for conflict between dominant males and dominant females over subordinate male presence. The existence of indirect phenotypic effects of subordinate males on interactions not directly involving the subordinate male suggests that individual personalities extend into the social environment and may be an important selective influence on social behaviour and on variation among social groups. (C) 2012 The Association for the Study of Animal Behaviour. Published by Elsevier Ltd. All rights reserved.","CM","include","intraspecific","cooperation",NA,"The extended personality: indirect effects of behavioural syndromes on the behaviour of others in a group-living cichlid","Consistent individual variation in behaviour is widespread across taxa and behavioural categories. Because social behaviour is often a plastic response to the social environment, consistent variation in social behaviours such as aggression and cooperation may generate consistent variation in the behaviour of social partners and others in the group. In this study, we moved individual subordinate males between groups of a cooperatively breeding cichlid, Neolamprologus pulcher. We found that subordinate males varied consistently in their aggressive interactions with neighbouring fish. The effects of individual subordinate males extended beyond their direct interactions; agonistic interactions between dominant males and dominant females varied consistently with subordinate male identity. We suggest that variation in helping behaviour through territorial defence influences the net fitness effects of subordinate males on dominant males and, thus, the potential for conflict between dominant males and dominant females over subordinate male presence. The existence of indirect phenotypic effects of subordinate males on interactions not directly involving the subordinate male suggests that individual personalities extend into the social environment and may be an important selective influence on social behaviour and on variation among social groups. (C) 2012 The Association for the Study of Animal Behaviour. Published by Elsevier Ltd. All rights reserved.","MW","include","intraspecific","cooperation/conflict",""
"308","MA376","The forager's dilemma: Food sharing and food defense as risk-sensitive foraging options","Although many variants of the hawk-dove game predict the frequency at which group foraging animals should compete aggressively, none of them can explain why a large number of group foraging animals share food clumps without any overt aggression. One reason for this shortcoming is that hawk-dove games typically consider only a single contest, while most group foraging situations involve opponents that interact repeatedly over discovered food clumps. The present iterated hawk-dove game predicts that in situations that are analogous to a prisoner's dilemma, animals should share the resources without aggression, provided that the number of simultaneously available food clumps is sufficiently large and the number of competitors is relatively small. However, given that the expected gain of an aggressive animal is more variable than the gain expected by nonaggressive individuals, the predicted effect of the number of food items in a clump-clump richness-depends on whether only the mean or both the mean and variability associated with payoffs are considered. More precisely, the deterministic game predicts that aggression should increase with clump richness, whereas the stochastic risk-sensitive game predicts that the frequency of encounters resulting in aggression should peak at intermediate clump richnesses or decrease with increasing clump richness if animals show sensitivity to the variance or coefficient of variation, respectively.","KJB","include","interspecific","modelling, competition","Variation in food items might induce variation in optimal foraging behaviour (and competition behaviour) of predators.","The forager's dilemma: Food sharing and food defense as risk-sensitive foraging options","Although many variants of the hawk-dove game predict the frequency at which group foraging animals should compete aggressively, none of them can explain why a large number of group foraging animals share food clumps without any overt aggression. One reason for this shortcoming is that hawk-dove games typically consider only a single contest, while most group foraging situations involve opponents that interact repeatedly over discovered food clumps. The present iterated hawk-dove game predicts that in situations that are analogous to a prisoner's dilemma, animals should share the resources without aggression, provided that the number of simultaneously available food clumps is sufficiently large and the number of competitors is relatively small. However, given that the expected gain of an aggressive animal is more variable than the gain expected by nonaggressive individuals, the predicted effect of the number of food items in a clump-clump richness-depends on whether only the mean or both the mean and variability associated with payoffs are considered. More precisely, the deterministic game predicts that aggression should increase with clump richness, whereas the stochastic risk-sensitive game predicts that the frequency of encounters resulting in aggression should peak at intermediate clump richnesses or decrease with increasing clump richness if animals show sensitivity to the variance or coefficient of variation, respectively.","NM","include","intraspecific","theoretical/modelling; competition-cooperation",""
"309","MA377","The fundamental role of competition in the ecology and evolution of mutualisms","Mutualisms are interspecific interactions that yield reciprocal benefits. Here, by adopting a consumer-resource perspective, we show how considering competition is necessary in order to understand the evolutionary and ecological dynamics of mutualism. We first review the ways in which competition shapes the ecology of mutualisms, using a graphical framework based on resource flows rather than net effects to highlight the opportunities for competition. We then describe the known mechanisms of competition and show how it is a critical driver of the evolutionary dynamics, persistence, and diversification of mutualism. We argue that empirical and theoretical research on the ecology and evolution of mutualisms will jointly progress by addressing four key points: (i) the existence and shape of physiological trade-offs among cooperation, competition, and other life-history and functional traits; (ii) the capacity for individuals to express conditional responses to variation in their mutualistic and competitive environment; (iii) the existence of heritable variation for mutualistic and competitive traits and their potentially conditional expression; and (iv) the structure of the network of consumer-resource interactions in which individuals are embedded.","KJB","include","interspecific","review","","The fundamental role of competition in the ecology and evolution of mutualisms","Mutualisms are interspecific interactions that yield reciprocal benefits. Here, by adopting a consumer-resource perspective, we show how considering competition is necessary in order to understand the evolutionary and ecological dynamics of mutualism. We first review the ways in which competition shapes the ecology of mutualisms, using a graphical framework based on resource flows rather than net effects to highlight the opportunities for competition. We then describe the known mechanisms of competition and show how it is a critical driver of the evolutionary dynamics, persistence, and diversification of mutualism. We argue that empirical and theoretical research on the ecology and evolution of mutualisms will jointly progress by addressing four key points: (i) the existence and shape of physiological trade-offs among cooperation, competition, and other life-history and functional traits; (ii) the capacity for individuals to express conditional responses to variation in their mutualistic and competitive environment; (iii) the existence of heritable variation for mutualistic and competitive traits and their potentially conditional expression; and (iv) the structure of the network of consumer-resource interactions in which individuals are embedded.","MW","include","interspecific","mutualism, review",""
"314","MA381","The nature and taxonomic composition of coral symbiomes as drivers of performance limits in scleractinian corals","All plants and animals host complex communities of taxonomically diverse microbial assemblages (viruses, Archaea, Bacteria, micro-eukaryotes) that contribute to the functional attributes of the host organism. Scleractinian corals represent particularly provocative subjects for study in this context because they are morphologically complex and associate with a broad diversity of macro invertebrates and vertebrates as well as microorganisms. Representatives of all these taxonomic groupings have been shown to contribute to the function of corals through direct or indirect provisioning and cycling of nutrients, waste removal, defense, and stress tolerance, traits that influence the fitness and environmental thresholds of individual coral colonies. How the taxonomic composition, functional limits and interactive nature of members of these communities vary among and within host species, and scale up to influence community level processes that drive ecosystem structure and function through time and space is unknown; these communities are, however, taxonomically variable among individual corals. Here we draw on the published literature to discuss the ecological and functional significance of the broad and variable taxonomic symbioses found closely associated with corals. Using a comparative approach, we hypothesize that the intra-specific and inter-specific variations in response of corals to environmental disturbance is linked to differences in the specificity, nature and composition of these symbiotic assemblages and reflect variation in the architectural complexity (micro and macro) and capacity of corals to provision habitat. We describe individual coral colonies as symbiomes, unique micro-ecosystems bounded by the physical limits of the coral colony whose performance limits reflect the taxonomic range of the associates (micro and macro) found within the colony. We explicitly recognize the fact that corals represent complex ecological communities composed of organisms that have the potential to compete, as well as interact with one another and the host as commensals, mutualists and parasites, states that likely to be dynamic with nature, context and environment. (C) 2011 Elsevier B.V. All rights reserved.","CF","include","interspecific","symbiosis","","The nature and taxonomic composition of coral symbiomes as drivers of performance limits in scleractinian corals","All plants and animals host complex communities of taxonomically diverse microbial assemblages (viruses, Archaea, Bacteria, micro-eukaryotes) that contribute to the functional attributes of the host organism. Scleractinian corals represent particularly provocative subjects for study in this context because they are morphologically complex and associate with a broad diversity of macro invertebrates and vertebrates as well as microorganisms. Representatives of all these taxonomic groupings have been shown to contribute to the function of corals through direct or indirect provisioning and cycling of nutrients, waste removal, defense, and stress tolerance, traits that influence the fitness and environmental thresholds of individual coral colonies. How the taxonomic composition, functional limits and interactive nature of members of these communities vary among and within host species, and scale up to influence community level processes that drive ecosystem structure and function through time and space is unknown; these communities are, however, taxonomically variable among individual corals. Here we draw on the published literature to discuss the ecological and functional significance of the broad and variable taxonomic symbioses found closely associated with corals. Using a comparative approach, we hypothesize that the intra-specific and inter-specific variations in response of corals to environmental disturbance is linked to differences in the specificity, nature and composition of these symbiotic assemblages and reflect variation in the architectural complexity (micro and macro) and capacity of corals to provision habitat. We describe individual coral colonies as symbiomes, unique micro-ecosystems bounded by the physical limits of the coral colony whose performance limits reflect the taxonomic range of the associates (micro and macro) found within the colony. We explicitly recognize the fact that corals represent complex ecological communities composed of organisms that have the potential to compete, as well as interact with one another and the host as commensals, mutualists and parasites, states that likely to be dynamic with nature, context and environment. (C) 2011 Elsevier B.V. All rights reserved.","MW","include","interspecific","Host-symbiont, review",""
"320","MA387","The social network structure of a wild meerkat population: 3. Position of individuals within networks","Individuals in social groups interact with numerous other group members in a polyadic network. Interactions can depend on the individual's own attributes (age, sex, status etc.), on their partner's attributes, and the group's network of social interactions. Previous studies tend to look at a subset of dyadic interactions, focusing on particular classes of individuals. We used social network analysis to explore how an individual wild meerkat's (Suricata suricatta) attributes related to their positions in three different interaction networks (grooming, dominance interactions, and foraging competitions) across eight groups. We asked whether individuals within groups associated assortatively and whether individuals with similar attributes occupied similar network positions. Differences in an individual's attributes did not consistently influence association patterns across different interaction network types. However, within network types, some attributes were especially influential across all groups. Grooming networks revealed negative assortativity by age and mass. Dominance networks revealed dominant subordinate associations and high assortativity between males. Dominant individuals exhibited higher levels of dominance interactions and were aggressive to more different individuals than subordinates. Heavier individuals received higher levels of dominance interactions. Foraging competition networks revealed that younger and lighter individuals received higher overall levels of competitions and from more group members. Our observations were similar to focused studies on dyadic interactions but also revealed subtle differences. Future descriptions of social interactions should account for networks of social interactions occurring within a group and should be cautious about treating individuals with similar attributes as functionally similar with respect to their position within a social network.","CF","include","intraspecific","sociality, social interactions","","The social network structure of a wild meerkat population: 3. Position of individuals within networks","Individuals in social groups interact with numerous other group members in a polyadic network. Interactions can depend on the individual's own attributes (age, sex, status etc.), on their partner's attributes, and the group's network of social interactions. Previous studies tend to look at a subset of dyadic interactions, focusing on particular classes of individuals. We used social network analysis to explore how an individual wild meerkat's (Suricata suricatta) attributes related to their positions in three different interaction networks (grooming, dominance interactions, and foraging competitions) across eight groups. We asked whether individuals within groups associated assortatively and whether individuals with similar attributes occupied similar network positions. Differences in an individual's attributes did not consistently influence association patterns across different interaction network types. However, within network types, some attributes were especially influential across all groups. Grooming networks revealed negative assortativity by age and mass. Dominance networks revealed dominant subordinate associations and high assortativity between males. Dominant individuals exhibited higher levels of dominance interactions and were aggressive to more different individuals than subordinates. Heavier individuals received higher levels of dominance interactions. Foraging competition networks revealed that younger and lighter individuals received higher overall levels of competitions and from more group members. Our observations were similar to focused studies on dyadic interactions but also revealed subtle differences. Future descriptions of social interactions should account for networks of social interactions occurring within a group and should be cautious about treating individuals with similar attributes as functionally similar with respect to their position within a social network.","MW","include","intraspecific","various interactions",""
