Diversity of algal endosymbionts (zooxanthellae) in octocorals: The roles of geography and host relationships;The presence, genetic identity and diversity of algal endosymbionts (Symbiodinium) in 114 species from 69 genera (20 families) of octocorals from the Great Barrier Reef (GBR), the far eastern Pacific (EP) and the Caribbean was examined, and patterns of the octocoral-algal symbiosis were compared with patterns in the host phylogeny. Genetic analyses of the zooxanthellae were based on ribosomal DNA internal transcribed spacer 1 (ITS1) region. In the GBR samples, Symbiodinium clades A and G were encountered with A and G being rare. Clade B zooxanthellae have been previously reported from a GBR octocoral, but are also rare in octocorals from this region. Symbiodinium G has so far only been found in Foraminifera, but is rare in these organisms. In the Caribbean samples, only Symbiodinium clades B and C are present. Hence, Symbiodinium diversity at the level of phylogenetic clades is lower in octocorals from the Caribbean compared to those from the GBR. However, an unprecedented level of ITS1 diversity was observed within individual colonies of some Caribbean gorgonians, implying either that these simultaneously harbour multiple strains of clade B zooxanthellae, or that ITS1 heterogeneity exists within the genomes of some zooxanthellae. Intracladal diversity based on ITS should therefore be interpreted with caution, especially in cases where no independent evidence exists to support distinctiveness, such as ecological distribution or physiological characteristics. All samples from EP are azooxanthellate. Three unrelated GBR taxa that are described in the literature as azooxanthellate (Junceella fragilis, Euplexaura nuttingi and Stereonephthya sp. 1) contain clade G zooxanthellae, and their symbiotic association with zooxanthellae was confirmed by histology. These corals are pale in colour, whereas related azooxanthellate species are brightly coloured. The evolutionary loss or gain of zooxanthellae may have altered the light sensitivity of the host tissues, requiring the animals to adopt or reduce pigmentation. Finally, we superimposed patterns of the octocoral-algal symbiosis onto a molecular phylogeny of the host. The data show that many losses/gains of endosymbiosis have occurred during the evolution of octocorals. The ancestral state (azooxanthellate or zooxanthellate) in octocorals remains unclear, but the data suggest that on an evolutionary timescale octocorals can switch more easily between mixotrophy and heterotrophy compared to scleractinian corals, which coincides with a low reliance on photosynthetic carbon gain in the former group of organisms.  2005 Blackwell Publishing Ltd.;MA96;CM;exclude;;
Agrobiodiversity;Agrobiodiversity refers to the variety and variability of living organisms that contribute to food and agriculture in the broadest sense, and that are associated with cultivating crops and rearing animals within ecological complexes. It is further expanded in some contexts to include all the organisms present in an agricultural landscape. Examples consist of crops and animal breeds, their wild relatives, and the species that interact with and support these species, for example, pollinators, symbionts, pests, parasites, predators, decomposers, and competitors. Croplands and fields as well as habitats and species outside of farming systems that affect agriculture and ecosystem functions in agricultural landscape are included. Agrobiodiversity can also refer to the extraction and utilization of products from natural ecosystems such as nonforest timber products, or livestock that pasture in grasslands. Utilization and conservation of biodiversity in agricultural landscapes is strongly influenced by socioeconomic factors at local, regional, and global scales. The concepts of agrobiodiversity are also valid for forestry and fisheries, especially in situations where human activities dominate the ecosystem processes.  2013 Elsevier Inc. All rights reserved.;MA13;CM;exclude;;
Mining the Plasmodium genome database to define organellar function: What does the apicoplast do?;Apicomplexan species constitute a diverse group of parasitic protozoa, which are responsible for a wide range of diseases in many organisms. Despite differences in the diseases they cause, these parasites share an underlying biology, from the genetic controls used to differentiate through the complex parasite life cycle, to the basic biochemical pathways employed for intracellular survival, to the distinctive cell biology necessary for host cell attachment and invasion. Different parasites lend themselves to the study of different aspects of parasite biology: Eimeria for biochemical studies, Toxoplasma for molecular genetic and cell biological investigation, etc. The Plasmodium falciparum Genome Project contributes the first large-scale genomic sequence for an apicomplexan parasite. The Plasmodium Genome Database (http://PlasmoDB. org) has been designed to permit individual investigators to ask their own questions, even prior to formal release of the reference P. falciparum genome sequence. As a case in point, PlasmoDB has been exploited to identify metabolic pathways associated with the apicomplexan plastid, or 'apicoplast'- an essential organelle derived by secondary endosymbiosis of an alga, and retention of the algal plastid.;MA244;CM;exclude;;
Pattern of individual participation and cheating in conflicts between groups of free-ranging dogs;Cooperative intergroup aggression provides an example of a costly cooperative behaviour whose benefits spill over to noncooperative animals as well. Consequently, investigating factors that promote individual participation in intergroup contests should prove useful for understanding how cooperation may persist in animal societies despite cheating. Here, we examined variables affecting individual participation in naturally occurring conflicts between groups of free-ranging dogs, Canis lupus familiaris. The overall proportion of cooperating group members decreased significantly with an increasing number of group members present. In one pack, the individual probability of active participation decreased significantly when this pack had a numerical advantage over opponents. Dogs belonging to the smallest pack tended to be more cooperative than those belonging to larger groups. Social prestige ( measured as the number of submissions received during greeting) did not appear to be a consequence of cooperative behaviour. Individual participation increased with an increasing number of affiliative partners. Young and high-ranking dogs tended to cooperate more when their group was outnumbered by opponents but did not stay at the front of the pack during conflicts. These results emphasize the greater opportunity for cheating in larger groups and the complexity of dogs' behaviour. Cooperation appears to be conditional on both the `adversity of the environment' (as measured by relative group size) and the identity/behaviour of companions. (C) 2010 The Association for the Study of Animal Behaviour. Published by Elsevier Ltd. All rights reserved.;MA272;CM;include;intraspecific;cooperation
Hormonal underpinnings of status conflict: Testosterone and cortisol are related to decisions and satisfaction in the hawk-dove game;A contribution to a special issue on Hormones and Human Competition. Testosterone is theorized to influence status-seeking behaviors such as social dominance and competitive behavior, but supporting evidence is mixed. The present study tested the roles of testosterone and cortisol in the hawk dove game, a dyadic economic decision-making paradigm in which earnings depend on one's own and the other player's choices. If one person selects the hawk strategy and the other person selects the dove strategy, the player who selected hawk attains a greater financial pay-off (status differentiation). The worst financial outcome occurs when both players choose the hawk strategy (status confrontation). Ninety-eight undergraduate students (42 men) provided saliva samples and played ten rounds of the hawk-dove game with another same-sex participant. In support of the hypothesis that testosterone is related to status concern, individuals higher in basal testosterone made more hawk decisions decisions that harmed the other player. Acute decreases in cortisol were also associated with more hawk decisions. There was some empirical support for the dual-hormone hypothesis as well: basal testosterone was positively related to satisfaction in the game among low basal-cortisol individuals but not among high basal-cortisol individuals. There were no significant sex differences in these hormonal effects. The present findings align with theories of hormones and status-seeking behavior at the individual level, but they also open up new avenues for research on hormone profiles at the collective level. Our results suggest that the presence of two or more high-testosterone members increases the likelihood of status confrontations over a limited resource that can undermine collective outcomes. (C) 2017 Elsevier Inc. All rights reserved.;MA180;CM;include;intraspecific;social dominance, competition
Variation in individual investment strategies among social animals;Cooperation and conflict are ubiquitous features of life in the vast majority of animals and can occur over a wide range of functional contents and at various levels. In this review I describe known and less well-known proximate aspects of cooperation and conflict over reproductive behaviour in social animals, where individuals other than the genetic parents contribute to the provisioning of care ('alloparental care'). Traditionally the evolution of alloparental care is viewed as a two-step process: the decision to delay dispersal and independent breeding, usually as a consequence of the existence of constraints on independent breeding, and the decision to behave as alloparents by which individuals that have delayed dispersal gain a net fitness benefit. Behavioural ecological theory generally assumes that all individuals are similar in 'make-up' and that life history and behavioural decisions are facultative. However, there is probably more individual variation in the amount and type of social behaviour than originally anticipated. Here, I demonstrate that some of these differences in behaviours are because of environmental factors, which may be associated with 'reaction norms' or the genotype's quantitative phenotypic variation, or which may yield polyethisms. Most evolutionary models of animal cooperation are based on optimality approaches that do not consider individual genetic variation and maternal effects on the variation in the expression of social behaviour. Further research on the genetic basis of cooperations and subordinate-breeder interactions may be crucial for understanding the evolution of social behaviour. If we take individual differences into account our conclusions and explanations of social behaviour may change. Given the conceptual similarities between the various research disciplines addressing different types of cooperation and conflict over investment, the issues described here should lead to more mutual attraction between the different disciplines and stimulate further development in our understanding of cooperation strategies in general.  2006 The Author.;MA405;CM;include;intraspecific;review, cooperation, conflict
Ecological characteristics of insects that affect symbiotic relationships with mites;Parasites and pathogens that begin as symbionts, i.e., organisms living together in the same habitat, are some of the most promising drivers of species evolution. Because insects are highly diverse and important as ecosystem service agents and because mites can exert large effects on insect populations (capable of killing at least juveniles), insect-mite interactions have been analyzed from various perspectives, including evolutionary, ecological and pest-management perspectives. Here, I review and examine insect-mite symbiotic associations to develop hypotheses concerning the factors that maintain and develop their relationships. Previous studies have hypothesized that insect sociality and mite richness and specificity affect insect-mite interactions. I found that both solitary and social insects, including parasocial and subsocial insects, harbor numbers of symbionts including species-specific ones but few dangerous mite symbionts in their nests or habitats under natural conditions. Nest size or the amount of food resources in a nest may affect mite richness. On the basis of this review, I hypothesize that the insect characteristics relevant for mite symbiotic hosting are sharing the same habitat with mites and living in a nutrient-rich habitat. I also suggest that many cases of species-specific symbiosis began with phoresy. To test these hypotheses, phylogenetic information on mites living with insect groups and quantitative analysis to characterize each insect-mite relationship are necessary.  2013 The Entomological Society of Japan.;MA110;CM;include;interspecific;review, insect-mite relationships, host-symbiont
Revealing microparasite diversity in aquatic environments using brute force molecular techniques and subtle microscopy;Aquatic ecosystems (seas, oceans, rivers and lakes) cover >70% of the Earth's surface and play essential roles in geochemical cycling and climate regulation. They are also hugely important for human health, nutrition and economy, providing drinking water, food, transport and leisure resources. These environments harbour complex and cryptic ecosystems dominated in terms of abundance and biomass by planktonic microbes including bacteria, archaea, viruses and eukaryotic organisms (such as protists and fungi). These organisms form numerous and diverse interactions encompassing all kind of exchanges, e.g. predatorprey relationships and all shades of symbiosis from commensalism to parasitism.  Cambridge University Press 2015.;MA311;CM;exclude;;
Cooperation in humans: competition between groups and proximate emotions;Understanding the ultimate and proximate mechanisms that favour cooperation remains one of the greatest challenges in the biological and social sciences. A number of theoretical studies have suggested that competition between groups may have played a key role in the evolution of cooperation within human societies, and similar ideas have been discussed for other organisms, especially cooperative breeding vertebrates. However, there is a relative lack of empirical work testing these ideas. Our experiment found, in public goods games with humans, that when groups competed with other groups for financial rewards, individuals made larger contributions within their own groups. In such situations, participants were more likely to regard their group mates as collaborators rather than competitors. Variation in contribution among individuals, either with or without intergroup competition, was positively correlated with individuals' propensity to regard group mates as collaborators. We found that the levels of both guilt and anger individuals experienced were a function of their own contributions and those of their group mates. Overall, our results arc consistent with the idea that the level of cooperation can be influenced by proximate emotions, which vary with the degree of intergroup competition. (C) 2010 Elsevier Inc. All rights reserved.;MA79;CM;include;intraspecific;cooperation-competition
Decomposer diversity and identity influence plant diversity effects on ecosystem functioning;"Plant productivity and other ecosystem functions often increase with plant diversity at a local scale. Alongside various plant-centered explanations for this pattern, there is accumulating evidence that multi-trophic interactions shape this relationship. Here, we investigated for the first time if plant diversity effects on ecosystem functioning are mediated or driven by decomposer animal diversity and identity using a double-diversity microcosm experiment. We show that many ecosystem processes and ecosystem multifunctionality (herbaceous shoot biomass production, litter removal, and N uptake) were affected by both plant and decomposer diversity, with ecosystem process rates often being maximal at intermediate to high plant and decomposer diversity and minimal at both low plant and decomposer diversity. Decomposers relaxed interspecific plant competition by enlarging chemical (increased N uptake and surface-litter decomposition) and spatial (increasing deep-root biomass) habitat space and by promoting plant complementarity. Anecic earthworms and isopods functioned as key decomposers; although decomposer diversity effects did not solely rely on these two decomposer species, positive plant net biodiversity and complementarity effects only occurred in the absence of isopods and the presence of anecic earthworms. Using a structural equation model, we explained 76\% of the variance in plant complementarity, identified direct and indirect effect paths, and showed that the presence of key decomposers accounted for approximately three-quarters of the explained variance. We conclude that decomposer animals have been underappreciated as contributing agents of plant diversity-ecosystem functioning relationships. Elevated decomposer performance at high plant diversity found in previous experiments likely positively feeds back to plant performance, thus contributing to the positive relationship between plant diversity and ecosystem functioning.";MA87;CM;exclude;;
Spatial consequences for dolphins specialized in foraging with fishermen;"According to theory, individuals forage in ways that maximize net energy intake. Distinct foraging strategies may emerge within a population in response to heterogeneous resources, competition and learning, among other drivers. We assessed individual variation in, and ecological consequences of, an unusual, specialized foraging tactic between animals and humans. In southern Brazil, bottlenose dolphins, Tursiops truncatus, herd fish schools towards artisanal fishermen, who cast nets in response to behavioural cues from the dolphins. This apparent cooperative tactic likely involves costs as well as benefits for both interacting parties, but such trade-offs remain poorly understood, especially for dolphins. We show that individual dolphins vary markedly in the frequency with which they interact with fishermen, and that this foraging variation is linked to ranging behaviour. Not all individual dolphins interact with fishermen; those that routinely do so concentrate around the limited interaction sites and have smaller home ranges than independent foragers. This suggests that foraging with fishermen increases foraging success and reduces search costs (i.e. foraging range). Competition for interaction sites may offset such benefits, since some individuals often forage at the high-quality sites while others forage at low-quality sites. Taken together, our findings suggest that two alternative tactics emerge in the population from trade-offs involving food access, foraging area, learning techniques and competition: dolphins either forage by themselves over larger areas on unpredictable resource patches (passing fish schools), or learn to interact with fishermen to access and compete for more predictable resource patches (interaction sites). By revealing some of the ecological drivers of this remarkable human-animal interaction, our study contributes two broader insights. First, specialized foraging can have ranging consequences for individuals and so structure the population spatially; second, interspecific cooperation may be founded upon intraspecific competition. (c) 2018 The Association for the Study of Animal Behaviour. Published by Elsevier Ltd. All rights reserved.";MA344;CM;include;interspecific;cooperation-competition
Aphid-encoded variability in susceptibility to a parasitoid;"Background: Many animals exhibit variation in resistance to specific natural enemies. Such variation may be encoded in their genomes or derived from infection with protective symbionts. The pea aphid, Acyrthosiphon pisum, for example, exhibits tremendous variation in susceptibility to a common natural enemy, the parasitic wasp Aphidius ervi. Pea aphids are often infected with the heritable bacterial symbiont, Hamiltonella defensa, which confers partial to complete resistance against this parasitoid depending on bacterial strain and associated bacteriophages. That previous studies found that pea aphids without H. defensa (or other symbionts) were generally susceptible to parasitism, together with observations of a limited encapsulation response, suggested that pea aphids largely rely on infection with H. defensa for protection against parasitoids. However, the limited number of uninfected clones previously examined, and our recent report of two symbiont-free resistant clones, led us to explicitly examine aphid-encoded variability in resistance to parasitoids. Results: After rigorous screening for known and unknown symbionts, and microsatellite genotyping to confirm clonal identity, we conducted parasitism assays using fifteen clonal pea aphid lines. We recovered significant variability in aphid-encoded resistance, with variation levels comparable to that contributed by H. defensa. Because resistance can be costly, we also measured aphid longevity and cumulative fecundity of the most and least resistant aphid lines under permissive conditions, but found no trade-offs between higher resistance and these fitness parameters. Conclusions: These results indicate that pea aphid resistance to A. ervi is more complex than previously appreciated, and that aphids employ multiple tactics to aid in their defense. While we did not detect a tradeoff, these may become apparent under stressful conditions or when resistant and susceptible aphids are in direct competition. Understanding sources and amounts of variation in resistance to natural enemies is necessary to understand the ecological and evolutionary dynamics of antagonistic interactions, such as the potential for coevolution, but also for the successful management of pest populations through biological control.  2014 Martinez et al.; licensee BioMed Central Ltd.";MA22;CM;include;interspecific;host-parasite
The bitterling-mussel interaction as a test case for co-evolution;The European bitterling Rhodeus sericeus (Cyprinidae) spawns in the gills of freshwater mussels (Unionidae) and shows some obvious adaptations to this type of spawning, such as the development of an ovipositor. Furthermore, recent studies have shown that the fish avoid species of mussels that have a high likelihood of ejecting their eggs prematurely. This leads to the question of whether the interaction between bitterling and mussels could represent a case of co-evolution, involving evolutionary responses by both species to selection imposed by the other. The evidence for and against co-evolution is reviewed, incorporating new results from two sets of experiments designed to test for adaptive choices by bitterling according to the mussels' sex and reproductive state, as well as a preliminary study of potential benefits for mussels from exposure to bitterling. Host preferences by bitterling, both among and within mussel species, may indeed have evolved in response to differences in benefits for offspring survival. There is no evidence yet for any benefits to mussels from receiving eggs, whereas there are costs due to reduced ventilation rates when the gills contain bitterling eggs. While there are differences among mussel species and individuals in their tendency to reject bitterling embryos, these differences do not provide strong evidence for co-evolution. For example, they may reflect differences in host physiology such as ventilation rate and generalized responses to expelling objects from their gills. Therefore, while bitterling are well adapted for their obligate spawning relationship with mussels, it has been much more difficult to find evidence for adaptations by mussels for dealing with bitterling. This suggests that any co-evolutionary dynamics between bitterling and mussels may be asymmetric, with stronger responses to selection by the fish than by mussels.  2003 The Fisheries Society of the British Isles.;MA364;CM;exclude;;
Deciphering the Interdependence between Ecological and Evolutionary Networks;Biological systems consist of elements that interact within and across hierarchical levels. For example, interactions among genes determine traits of individuals, competitive and cooperative interactions among individuals influence population dynamics, and interactions among species affect the dynamics of communities and ecosystem processes. Such systems can be represented as hierarchical networks, but can have complex dynamics when interdependencies among levels of the hierarchy occur. We propose integrating ecological and evolutionary processes in hierarchical networks to explore interdependencies in biological systems. We connect gene networks underlying predator-prey trait distributions to food webs. Our approach addresses longstanding questions about how complex traits and intraspecific trait variation affect the interdependencies among biological levels and the stability of meta-ecosystems.;MA86;CM;exclude;;
