Does soil type drive social organization in southern hairy-nosed wombats?;"Spatiotemporal distributions of key resources are hypothesized to underpin sociobiological patterns. Burrow availability and quality is of paramount importance to fossorial animals. The southern hairy-nosed wombat (Lasiorhinus latifrons) burrows in both hard and friable soils. Theoretical and empirical studies suggest that the harder substrate should promote closer geographical clustering of burrows than in softer soils. Clustered burrows are expected to be associated with larger group sizes. If sociality is driven by constraint rather than advantage, patterns of spatial and temporal distribution of animals within and among groups may show indications of avoidance or even antagonism, and `making the best of a bad job' via positive kin associations to offset the disadvantages of high-density living. To test these ideas, we compared warren relatedness and social structure of L. latifrons on friable soils (Nullarbor Plain) and hard calcrete (Brookfield Conservation Park, BCP). Individuals were sampled by noninvasive collection of hairs for genotyping to identify individuals and to estimate their space-use and associative behaviour with respect to relatedness. Burrows in calcrete were indeed more clumped, and warren and group size larger. Differences in spatiotemporal organization and relatedness structure between sites were in the expected direction: (i) Nullarbor males associated and shared warrens less than at BCP; and (ii) Nullarbor spatial relatedness patterning data were not consistent with proposed female breeding dispersal, in contrast to those at BCP. Under Nullarbor (low density) conditions, cooperation or tolerance between males may be less advantageous, and accessing or digging burrows should be less of a constraint for juvenile females.";MA103;CM;include;intraspecific;cooperation-tolerance
Subgraphs of functional brain networks identify dynamical constraints of cognitive control;Brain anatomy and physiology support the human ability to navigate a complex space of perceptions and actions. To maneuver across an ever-changing landscape of mental states, the brain invokes cognitive controla set of dynamic processes that engage and disengage different groups of brain regions to modulate attention, switch between tasks, and inhibit prepotent responses. Current theory posits that correlated and anticorrelated brain activity may signify cooperative and competitive interactions between brain areas that subserve adaptive behavior. In this study, we use a quantitative approach to identify distinct topological motifs of functional interactions and examine how their expression relates to cognitive control processes and behavior. In particular, we acquire fMRI BOLD signal in twenty-eight healthy subjects as they perform two cognitive control tasksa Stroop interference task and a local-global perception switching task using Navon figureseach with low and high cognitive control demand conditions. Based on these data, we construct dynamic functional brain networks and use a parts-based, network decomposition technique called non-negative matrix factorization to identify putative cognitive control subgraphs whose temporal expression captures distributed network structures involved in different phases of cooperative and competitive control processes. Our results demonstrate that temporal expression of the subgraphs fluctuate alongside changes in cognitive demand and are associated with individual differences in task performance. These findings offer insight into how coordinated changes in the cooperative and competitive roles of cognitive systems map trajectories between cognitively demanding brain states.  2018 Khambhati et al. http://creativecommons.org/licenses/by/4.0/.;MA356;CM;exclude;;
Coalitions destabilize dyadic dominance relationships in male Barbary macaques (Macaca sylvanus);Dyadic agonistic dominance relationships are thought to result from asymmetries in both intrinsic and extrinsic power. One form of extrinsic power is the ability to solicit agonistic support from other individuals. In extreme cases extrinsic power differences may override intrinsic power differences so that physically inferior individuals attain rank positions above stronger competitors. In other cases superior extrinsic power in physically inferior individuals may destabilize the otherwise clear dominance relationships. We tested this prediction with observational data on adult males in one of three free-ranging groups of Barbary macaques at Affenberg Salem, Germany. All prime males that were subjects of this study were at least 5-8 years (average 10 years) younger than the old post-prime males that were all subordinate to them. Assuming large age differences to reflect large intrinsic/physical power differences, interactions between these prime and the old males allowed investigation of the separate effects of intrinsic and extrinsic power asymmetries on dominance relationships. We estimated relationship instability using four different estimates (counter aggression, conflicts initiated by aggression from the subordinate, spontaneous submissions by dominants, and decided conflicts won by the subordinate). Relationship instability did not decrease with increasing asymmetry in intrinsic power. Instead, all four measures of relationship instability were positively related to the number of times the dominant in a dyad was target of destabilizing coalitions. Destabilizing coalitions targeted dominant males in old male-prime male dyads more often than in old male-old male dyads. Consequently, old males had less stable relationships with the much stronger prime males than with each other. We conclude that extrinsic power asymmetries predicted the instability of dyadic dominance relationships and may systematically override intrinsic power asymmetries.;MA48;CM;include;intraspecific;dominance, group stability
Crossing scales, crossing disciplines: Collective motion and collective action in the Global Commons;Two conflicting tendencies can be seen throughout the biological world: individuality and collective behaviour. Natural selection operates on differences among individuals, rewarding those who perform better. Nonetheless, even within this milieu, cooperation arises, and the repeated emergence of multicellularity is the most striking example. The same tendencies are played out at higher levels, as individuals cooperate in groups, which compete with other such groups. Many of our environmental and other global problems can be traced to such conflicts, and to the unwillingness of individual agents to take account of the greater good. One of the great challenges in achieving sustainability will be in understanding the basis of cooperation, and in taking multicellularity to yet a higher level, finding the pathways to the level of cooperation that is the only hope for the preservation of the planet.  2010 The Royal Society.;MA83;CM;exclude;;
Social network theory: new insights and issues for behavioral ecologists;"Until recently, few studies have used social network theory (SNT) and metrics to examine how social network structure (SNS) might influence social behavior and social dynamics in non-human animals. Here, we present an overview of why and how the social network approach might be useful for behavioral ecology. We first note four important aspects of SNS that are commonly observed, but relatively rarely quantified: (1) that within a social group, differences among individuals in their social experiences and connections affect individual and group outcomes; (2) that indirect connections can be important (e.g., partners of your partners matter); (3) that individuals differ in their importance in the social network (some can be considered keystone individuals); and (4) that social network traits often carry over across contexts (e.g., SN position in male-male competition can influence later male mating success). We then discuss how these four points, and the social network approach in general, can yield new insights and questions for a broad range of issues in behavioral ecology including: mate choice, alternative mating tactics, male-male competition, cooperation, reciprocal altruism, eavesdropping, kin selection, dominance hierarchies, social learning, information flow, social foraging, and cooperative antipredator behavior. Finally, we suggest future directions including: (1) integrating behavioral syndromes and SNT; (2) comparing space use and SNS; (3) adaptive partner choice and SNS; (4) the dynamics and stability (or instability) of social networks, and (5) group selection shaping SNS.";MA337;CM;include;intraspecific;theoretical/modelling, social networks
Within host selection for faster replicating bacterial symbionts;Wolbachia is a widespread, intracellular symbiont of arthropods, able to induce reproductive distortions and antiviral protection in insects. Wolbachia can also be pathogenic, as is the case with wMelPop, a virulent variant of the endosymbiont of Drosophila melanogaster. An extensive genomic amplification of the 20kb region encompassing eight Wolbachia genes, called Octomom, is responsible for wMelPop virulence. The Octomom copy number in wMelPop can be highly variable between individual D. melanogaster flies, even when comparing siblings arising from a single female. Moreover, Octomom copy number can change rapidly between generations. These data suggest an intra-host variability in Octomom copy number between Wolbachia cells. Since wMelPop Wolbachia with different Octomom copy numbers grow at different rates, we hypothesized that selection could act on this intra-host variability. Here we tested if total Octomom copy number changes during the lifespan of individual Drosophila hosts, revealing selection for different Wolbachia populations. We performed a time course analysis of Octomom amplification in flies whose mothers were controlled for Octomom copy number. We show that despite the Octomom copy number being relatively stable it increases slightly throughout D. melanogaster adult life. This indicates that there is selection acting on the intra-host variation in the Octomom copy number over the lifespan of individual hosts. This within host selection for faster replicating bacterial symbionts may be in conflict with between host selection against highly pathogenic Wolbachia.  2018 Chrostek, Teixeira. This is an open access article distributed under the terms of the Creative Commons Attribution License, which permits unrestricted use, distribution, and reproduction in any medium, provided the original author and source are credited.;MA410;CM;exclude;;
Eukarya associated with the stony coral Oculina patagonica from the Mediterranean Sea;Oculina patagonica is a putative alien scleractinian coral from the Southwest Atlantic that inhabits across the Mediterranean Sea. Here, we have addressed the diversity of Eukarya associated with this coral and its changes related to the environmental conditions and coral status. A total of 46 colonies of O. patagonica were taken from Alicante coast (Spain) and Pietra Ligure coast (Italy) and analyzed using denaturing gradient gel electrophoresis (DGGE) of the small-subunit 18S rRNA and 16S plastid rRNA genes, internal transcribed spacer region 2 (ITS 2) analyses, and electron microscopy. Our results show that Eukarya and plastid community associated to O. patagonica change with environmental conditions and coral status. Cryptic species, which can be difficult to identify by optical methods, were distinguished by 18S rRNA gene DGGE: the barnacle Megatrema anglicum, which was detected at two locations, and two boring sponges related to Cliona sp. and Siphonodictyon coralliphagum detected in samples from Tabarca and Alicante Harbour, respectively. Eukaryotic phototrophic community from the skeletal matrix of healthy corals was dominated by Ochrosphaera sp. while bleached corals from the Harbour and Tabarca were associated to different uncultured phototrophic organism. Differences in ultrastructural morphologies of the zooxanthellae between healthy and bleached corals were observed. Nevertheless, no differences were found in Symbiodinium community among time, environments, coral status and location, showing that O. patagonica hosted only one genotype of Symbiodinium belonging to clade B2. The fact that this clade has not been previously detected in other Mediterranean corals and is more frequent in the tropical Western Atlantic, is a new evidence that O. patagonica is an alien species in the Mediterranean Sea.  2014 Elsevier B.V.;MA121;CM;exclude;;
State-dependent sentinels: an experimental study in the Arabian babbler;"Natural patterns of cooperative sentinel behaviour in Arabian babblers. Turdoides squamiceps have proven consistent with state-dependent models of individually selfish anti-predator strategies. Here we demonstrate experimentally that sentinel effort within groups is determined simply hy individual state. The two highest-ranking males in eight groups were separately fed a supplement of mealworms each for one day at a time. Control days before and after each treatment confirmed that Ilo carry-over effects occurred, and that most normal sentinel activity was carried our by alpha males, then beta males and then by. the rest of the group. When supplemented. both alpha and beta males exhibited similar marked increases in sentinel activity relative to control days. Unsupplemented males and the rest of the group incompletely compensated for these increases with reductions in sentinel effort. Differences in individual bod! mass within groups reflected natural and experimental variation in sentinel effort. Alpha and beta males weighed more than other group members, and gained mass only when supplementally fed. There was no evidence either for competitive sentinel behaviour, nor for an); increased interference between malts during the supplementation treatments. These results therefore provide strong evidence in support of the state-dependent approach to cooperative sentinel behaviour.";MA352;CM;exclude;;
Lethal male-male combat in the parasitoid Melittobia acasta: are size and competitive environment important?;Interactions between organisms can lie anywhere along the spectrum from fatal conflict to total cooperation. To understand this variation, knowledge of the strategies that individuals use to acquire their resources is required. We tested theoretical predictions relating to conflict behaviour in a species of parasitoid wasp, Melittobia acasta, in which males compete for mates in their closed, natal patches. They engage in lethal combat to gain access to the females developing in their host. Environmental factors and individual traits both influenced conflict behaviour and contest outcome: fighting behaviour increased with the density of competitors and larger contestants were more successful. Our results also indicate that opponent assessment did not influence conflict behaviour and contests were always resolved by fighting. Crown Copyright (C) 2007 Published by Elsevier Ltd on behalf of The Association for the Study of Animal Behaviour. All rights reserved.;MA231;CM;include;intraspecific;conflict behaviour
Rapid viral symbiogenesis via changes in parasitoid wasp genome architecture;Viral genome integration provides a complex route to biological innovation that has rarely but repeatedly occurred in one of the most diverse lineages of organisms on the planet, parasitoid wasps. We describe a novel endogenous virus in braconid wasps derived from pathogenic alphanudiviruses. Limited to a subset of the genus Fopius, this recent acquisition allows an unprecedented opportunity to examine early endogenization events. Massive amounts of virus-like particles (VLPs) are produced in wasp ovaries. Unlike most endogenous viruses of parasitoid wasps, the VLPs do not contain DNA, translating to major differences in parasitism-promoting strategies. Rapid changes include genomic rearrangement, loss of DNA processing proteins, and wasp control of viral gene expression. These events precede the full development of tissue-specific viral gene expression observed in older associations. These data indicate that viral endogenization can rapidly result in functional and evolutionary changes associated with genomic novelty and adaptation in parasitoids.  The Author(s) 2018. Published by Oxford University Press on behalf of the Society for Molecular Biology and Evolution.;MA298;CM;exclude;;
Evolution of culture-dependent discriminate sociality: A gene-culture coevolutionary model;"Animals behave cooperatively towards certain conspecifics while being indifferent or even hostile to others. The distinction is made primarily according to kinship as predicted by the kin selection theory. With regards to humans, however, this is not always the case; in particular, humans sometimes exhibit a discriminate sociality on the basis of culturally transmitted traits, such as personal ornaments, languages, rituals, etc. This paper explores the possibility that the human faculty of cultural transmission and resultant cultural variation among individuals may have facilitated the evolution of discriminate sociality in humans. To this end, a gene-culture coevolutionary model is developed focusing on competition over control of resource as a context in which discriminate sociality may have evolved. Specifically, two types of culture-dependent discriminate sociality are considered: ingroup favouritism, with ingroup and outgroup being distinguished by the presence or absence of a cultural trait; and prestige hierarchies, with the prestige being conferred on the bearer of a cultural trait. The model specifies the conditions under which emergence and evolutionary stability of the two types of discriminate sociality are promoted by the presence of cultural variation among individuals.  2011 The Royal Society.";MA124;CM;include;intraspecific;"theoretical/modelling; discriminate sociality"
Collaboration among sponge species increases sponge diversity and abundance in a seagrass meadow;Caribbean sponge species typical of coral reefs are generally inhibited from living in seagrass meadows by their vulnerability to predation by the large starfish Oreaster reticulatus (Linnaeus 1758). Although readily consumed by Oreaster, the conspicuous coral reef sponge species Lissodendoryx colombiensis Zea & van Soest, 1986 has expanded its habitat distribution to include a seagrass (Thalassia testudinum Banks ex Knig, 1805) meadow in Belize, where individuals grow to volumes of nearly 7l. By simple observation, L. colombiensis appears to be an inferior competitor in this system, because portions of many individuals are overgrown by seagrass sponge species. However, experimentally clustering seagrass sponges around L. colombiensis individuals deterred starfish from feeding on them, suggesting an advantage to being overgrown. Sizes of individual L. colombiensis can fluctuate widely over short time intervals, reflecting both a relatively fast growth rate and the high rate at which starfish consume this species. At the population level these fluctuations are not evident, as losses of L. colombiensis due to Oreaster are balanced by a combination of efficient recruitment, rapid regeneration and growth, and protection of portions of many individuals by the overgrowth of seagrass sponge species that are unpalatable to Oreaster . In turn, the seagrass sponges acquire stable perches on L. colombiensis individuals in this sediment-dominated habitat. Community ecology theory relating to diversity patterns in sessile organisms has focused on competition between space-requiring neighbors as the underlying process that inevitably decreases diversity unless curtailed. Sponges, with their propensity for engaging in beneficial interactions with neighbors, demand expansion of the theory to acknowledge how collaboration can increase abundance and species diversity within a community.  Journal compilation  2008 Blackwell Publishing.;MA51;CM;exclude;;
Nuclear and genome dynamics in multinucleate ascomycete fungi;Genetic variation between individuals is essential to evolution and adaptation. However, intra-organismic genetic variation also shapes the life histories of many organisms, including filamentous fungi. A single fungal syncytium can harbor thousands or millions of mobile and potentially genotypically different nuclei, each having the capacity to regenerate a new organism. Because the dispersal of asexual or sexual spores propagates individual nuclei in many of these species, selection acting at the level of nuclei creates the potential for competitive and cooperative genome dynamics. Recent work in Neurospora crassa and Sclerotinia sclerotiorum has illuminated how nuclear populations are coordinated for fungal growth and other behaviors and has revealed both molecular and physical mechanisms for preventing and policing inter-genomic conflict. Recent results from population-level genomic studies in a variety of filamentous fungi suggest that nuclear exchange between mycelia and recombination between heterospecific nuclei may be of more importance to fungal evolution, diversity and the emergence of newly virulent strains than has previously been recognized.  2011 Elsevier Ltd. All rights reserved.;MA260;CM;include;intraspecific;inter-genomic conflict, competition - cooperation
Geography has a greater effect than Wolbachia infection on population genetic structure in the spider mite, Tetranychus pueraricola;Wolbachia is an intracellular symbiotic bacterium that infects various spider mite species and is associated with alterations in host reproduction, which indicates the potential role in mite evolution. However, studies of Wolbachia infections in the spider mite Tetranychus pueraricola, a major agricultural pest, are limited. Here, we used multilocus sequence typing to determine Wolbachia infection status and examined the relationship between Wolbachia infection status and mitochondrial diversity in T. pueraricola from 12 populations in China. The prevalence of Wolbachia ranged from 2.8 to 50%, and three strains (wTpue1, wTpue2, and wTpue3) were identified. We also found double infections (wTpue1 + wTpue3) within the same individuals. Furthermore, the wTpue1 strain caused weak cytoplasmic incompatibility (CI) (egg hatchability ~55%), whereas another widespread strain, wTpue3, did not induce CI. There was no reduction in mitochondrial DNA (mtDNA) or nuclear DNA diversity among infected individuals, and mtDNA haplotypes did not correspond to specific Wolbachia strains. Phylogenetic analysis and analysis of molecular variance revealed that the distribution of mtDNA and nuclear DNA haplotypes were significantly associated with geography. These findings indicate that Wolbachia infection in T. pueraricola is complex, but T. pueraricola genetic differentiation likely resulted from substantial geographic isolation.  Cambridge University Press 2016.;MA167;CM;exclude;;
Plant biotic interactions in the Sonoran desert: Current knowledge and future research perspectives;Premise of research. Biotic interactions have long been considered to be of less importance in structuring desert systems than other ecosystem types, but biotic interactions often play a critical role in meeting the challenges posed by the extreme conditions of desert environments. The Sonoran Desert, in particular, is home to several textbook examples of mutualisms, such as the interactions between the iconic saguaro cactus and its bat pollinators. But what do we know about the diversity, ecology, and evolution of plant-animal, plant-plant, and plant-microbe interactions and their impacts on individual plants and plant species in the Sonoran Desert? Methodology. To address this question, we review the published research on seven common kinds of plant biotic interactions by revisiting the respective literature, identifying gaps in our knowledge, and outlining future research directions. Pivotal results. Numerous gaps in our knowledge of plant biotic interactions in the Sonoran Desert were identified. Studies of insect herbivory, bee pollination, and plant-microbe interactions are poorly represented in the Sonoran Desert literature. Across all categories of interaction, few have examined the impacts of interactions on plant fitness or context-dependent variation in the outcomes and strengths of interactions. For the most part, interactions have been studied at single locations and over short periods of time, resulting in an incomplete understanding of their diversity, ecology, and evolution. Conclusions. Plant biotic interactions shape the habitats in which they occur and play an important role in the maintenance of species diversity. Therefore, we call for increased efforts to fill the gaps in our understanding of plant biotic interactions in the Sonoran Desert, with an emphasis on studies linking interactions to plant fitness and the context-dependent nature of interactions. Without this knowledge we have limited capacity to predict the outcomes of global change on species interactions and to develop measures to conserve the biodiversity of the Sonoran Desert region.  2016 by The University of Chicago. All rights reserved.;MA281;CM;exclude;;
