abstract.id,title.y,abstract.y,screener.id,"include or exclude (note: exclude only if the abstract is unrelated to our topic, if you are unsure mark as include)",ecological scale (e.g. interspecific or intraspecific),"topic area (e.g. predator-prey, parasite-host, male-female, theoretical/modelling, review)"
MA58,Comparative Genomics of a Plant-Parasitic Nematode Endosymbiont Suggest a Role in Nutritional Symbiosis,"Bacterial mutualists can modulate the biochemical capacity of animals. Highly coevolved nutritional mutualists do this by synthesizing nutrients missing from the host's diet. Genomics tools have advanced the study of these partnerships. Here we examined the endosymbiont Xiphinematobacter (phylum Verrucomicrobia) from the dagger nematode Xiphinema americanum, a migratory ectoparasite of numerous crops that also vectors nepovirus. Previously, this endosymbiont was identified in the gut, ovaries, and eggs, but its role was unknown. We explored the potential role of this symbiont using fluorescence in situ hybridization, genome sequencing, and comparative functional genomics. We report the first genome of an intracellular Verrucomicrobium and the first exclusively intracellular non-Woibachia nematode symbiont. Results revealed that Xiphinematobacter had a small 0.916-Mb genome with only 817 predicted proteins, resembling genomes of other mutualist endosymbionts. Compared with free-living relatives, conserved proteins were shorter on average, and there was large-scale loss of regulatory pathways. Despite massive gene loss, more genes were retained for biosynthesis of amino acids predicted to be essential to the host. Gene ontology enrichment tests showed enrichment for biosynthesis of arginine, histidine, and aromatic amino acids, as well as thiamine and coenzyme A, diverging from the profiles of relatives Akkermansia muciniphilia (in the human colon), Methylacidiphilum infemorum, and the mutualist Wolbachia from filarial nematodes. Together, these features and the location in the gut suggest that Xiphinematobacter functions as a nutritional mutualist, supplementing essential nutrients that are depleted in the nematode diet. This pattern points to evolutionary convergence with endosymbionts found in sap-feeding insects.",NM,exclude (no trait variation),,
MA41,Caterpillar seed predators mediate shifts in selection on flowering phenology in their host plant,"Variation in selection among populations and years has important implications for evolutionary trajectories of populations. Yet, the agents of selection causing this variation have rarely been identified. Selection on the time of reproduction within a season in plants might differ both among populations and among years, and selection can be mediated by both mutualists and antagonists. We investigated if differences in the direction of phenotypic selection on flowering phenology among 20 populations of Gentiana pneumonanthe during 2 yr were related to the presence of the butterfly seed predator Phengaris alcon, and if butterfly incidence was associated with the abundance of the butterfly's second host, Myrmica ants. In plant populations without the butterfly, phenotypic selection favored earlier flowering. In populations where the butterfly was present, caterpillars preferentially attacked early-flowering individuals, shifting the direction of selection to favoring later flowering. Butterfly incidence in plant populations increased with ant abundance. Our results demonstrate that antagonistic interactions can shift the direction of selection on flowering phenology, and suggest that such shifts might be associated with differences in the community context.",NM,exclude (no variation on the mutualism/antagonism continuum),,
MA195,Independent effects of arbuscular mycorrhiza and earthworms on plant diversity and newcomer plant establishment,"Questions: How do arbuscular mycorrhiza and earthworms affect the structure and diversity of a ruderal plant community? Is the establishment success of newcomer plants enhanced by these soil organisms and their interactions? Methods: We grew a native ruderal plant community composed of different functional groups (grasses, legumes and forbs) in the presence and absence of arbuscular mycorrhizal fungi (AMF) and endogeic earthworms in mesocosms. We introduced seeds of five, mainly exotic, plant species from the same functional groups after a disturbance simulating mowing. The effects of the soil organisms on the native ruderal plant community and seedling establishment of the newcomer plants were assessed. Results: After disturbance, the total above-ground regrowth of the native plant community was not affected by the soil organisms. However, AMF increased plant diversity and shoot biomass of forbs, but decreased shoot biomass of grasses of the native plant community. Earthworms led to a reduction in total root biomass. Establishment of the introduced newcomer plants increased in the presence of AMF and earthworms. Especially, seedling establishment of the introduced non-native legume Lupinus polyphyllus and the native forb Plantago lanceolata was promoted in the presence of AMF and earthworms, respectively. The endogeic earthworms gained more weight in the presence of AMF and led to increased extraradical AMF hyphal length in soil. However, earthworms did not seem to modify the effect of AMF on the plant community. Conclusion: The present study shows the importance of mutualistic soil organisms in mediating the establishment success of newcomer plants in a native plant community. Mutualistic soil organisms lead to changes in the structure and diversity of the native plant community and might promote newcomer plants, including exotic species.",NM,exclude (no trait variation),,
MA243,Microbiology is the basis of sustainable agriculture: An opinion,"Agricultural microbiology is presented as a synthetic research field responsible for knowledge transfer from general microbiology and microbial ecology to the agricultural biotechnologies. The major goal of agricultural microbiology is a comprehensive analysis of symbiotic micro-organisms (bacteria, fungi) interacting with agriculturally important plants and animals: here we have focussed on plants. In plants, interactions with micro-organisms are diverse, ranging from two-partite symbioses (e.g. legume-rhizobia N 2-fixing nodular symbioses or arbuscular mycorrhiza) to multipartite endophytic and epiphytic (root-associated, phyllosphere) communities. Two-partite symbioses provide the clearest models for addressing genetic cooperation between partners, resulting in the formation of super-organism genetic systems, which are responsible for host productivity. Analysis of these systems has now been extended considerably by using the approaches of metagenomics, which allow the dissection of taxonomic/population structures and the metabolic/ecological functions of microbial communities, which have resulted from the adaptation of free-living, soil microflora in the endosymbiotic niches. Both beneficial (nutritional, defensive, regulatory) and antagonistic (biocontrol) functions expressed by symbiotic microbes towards their hosts are the potential subjects of effective agronomic use. A fundamental knowledge of the genetics, molecular biology, ecology and evolution of symbiotic interactions could enable the development of microbe-based sustainable agriculture. This could achieve: (a) an improvement of major adaptive functions and productivity in crop plants by manipulating their microbial cohabitants; (b) partial or even full substitution of ecologically hazardous agrochemicals (mineral fertilizers, pesticides) by microbial preparations; (c) a decrease in the cost and an improvement of the quality of agricultural products.  2011 Association of Applied Biologists.",NM,exclude (no intraspecific variation),,
MA406,Viral quasispecies profiles as the result of the interplay of competition and cooperation,"Background. Viral quasispecies can be regarded as a swarm of genetically related mutants. A common approach employed to describe viral quasispecies is by means of the quasispecies equation (QE). However, a main criticism of QE is its lack of frequency-dependent selection. This can be overcome by an alternative formulation for the evolutionary dynamics: the replicator-mutator equation (RME). In turn, a problem with the RME is how to quantify the interaction coefficients between viral variants. Here, this is addressed by adopting an ecological perspective and resorting to the niche theory of competing communities, which assumes that the utilization of resources primarily determines ecological segregation between competing individuals (the different viral variants that constitute the quasispecies). This provides a theoretical framework to estimate quantitatively the fitness landscape. Results. Using this novel combination of RME plus the ecological concept of niche overlapping for describing a quasispecies we explore the population distributions of viral variants that emerge, as well as the corresponding dynamics. We observe that the population distribution requires very long transients both to A) reach equilibrium and B) to show a clear dominating master sequence. Based on different independent and recent experimental evidence, we find that when some cooperation or facilitation between variants is included in appropriate doses we can solve both A) and B). We show that a useful quantity to calibrate the degree of cooperation is the Shannon entropy. Conclusions. In order to get a typical quasispecies profile, at least within the considered mathematical approach, it seems that pure competition is not enough. Some dose of cooperation among viral variants is needed. This has several biological implications that might contribute to shed light on the mechanisms operating in quasispecies dynamics and to understand the quasispecies as a whole entity.  2010 Arbiza et al; licensee BioMed Central Ltd.",NM,include,NA,"theory, cooperation-competition (in relation to virus quasispecies interactions)"
MA74,Contrasting effects of Wolbachia on cytoplasmic incompatibility and fecundity in the haplodiploid mite Tetranychus urticae,"Recent studies on Wolbachia-induced incompatibility in haplodiploid insects and mites have revealed a diversity of cytoplasmic incompatibility (CI) patterns among host species. Here, we report intraspecific diversity in CI expression among four strains of the arrhenotokous mite Tetranychus urticae and in T. turkestani. Variability of CI expression within T. urticae ranged from no CI to complete CI, and included either female embryonic mortality or male conversion types of CI. A fecundity cost attributed to the infection with the high-CI Wolbachia strain was the highest ever recorded for Wolbachia (-80 to -100% decrease). Sequence polymorphism at a 550-bp-portion of Wolbachia wsp gene revealed two clusters distant by 21%, one of which included three Wolbachia strains infecting mite populations sampled from the same host-plant species, but showing distinct CI patterns. These data are discussed in the light of theoretical predictions on the evolutionary pathways followed in this symbiotic interaction.",NM,include,interspecific,"host-symbiont, genetic variation"
MA327,Small-scale spatial variability in the distribution of ectomycorrhizal fungi affects plant performance and fungal diversity,"The effects of spatial heterogeneity in negative biological interactions on individual performance and species diversity have been studied extensively. However, little is known about the respective effects involving positive biological interactions, including the symbiosis between plants and ectomycorrhizal (EM) fungi. Using a greenhouse bioassay, we explored how spatial heterogeneity of natural soil inoculum influences the performance of pine seedlings and composition of their root-associated EM fungi. When the inoculum was homogenously distributed, a single EM fungal taxon dominated the roots of most pine seedlings, reducing the diversity of EM fungi at the treatment level, while substantially improving pine seedling performance. In contrast, clumped inoculum allowed the proliferation of several different EM fungi, increasing the overall EM fungal diversity. The most dominant EM fungal taxon detected in the homogeneous treatment was also a highly beneficial mutualist, implying that the trade-off between competitive ability and mutualistic capacity does not always exist.  2017 John Wiley & Sons Ltd/CNRS",NM,exclude (no intraspecific variation),,
MA179,"History and present scope of field studies on Macaca fuscata yakui at Yakushima Island, Japan","Field studies on Japanese macaques on Yakushima Island started in the mid-1970s, >25 yr after the emergence of Japanese primatology, in response to criticism of methods using provisioning and the desire to find the socioecological factors influencing the social life of macaques in natural habitats. We habituated macaques without provisioning mainly in the coastal warm-temperate forest and found that they lived in small troops with a high socionomic sex ratio. Observations of several troop fissions and troop takeovers by nontroop males suggest that Yakushima macaques have a different social organization from that of Japanese macaques in other habitats. For example, youngest ascendancy as the dominance relationhip among sisters, which usually occurs in provisioned troops, was absent in Yakushima macaques. We compared their ecological and social features with those of Japanese macaques at Kinkazan (cool-temperate forests) and found that abundance of high-quality foods may cause stronger intra- and intertroop competition at Yakushima. Female Yakushima macaques may more positively solicit nontroop males to associate with them during the mating season. Such a tendency may promote frequent male movement between troops and frequent troop fissions. Though ecological factors form social features of Japanese macaques, some features such as male association and movements between troops are not accounted for via socioecology. Recent field studies have focused on macaques living at higher altitudes in Yakushima and on individual survival strategies by taking diverse viewpoints and using new technologies. DNA analysis of fecal samples shows low genetic diversity and suggests the macaques' recent expansion from lowland to highland forests in Yakushima. The population censuses conducted annually indicate that the higher-altitude macaques have a larger home range but a similar group size versus their counterparts at low elevations. The unsolved issues in socioecology will pose a challenge to the younger generation of primatologists. Conservation of macaques and their habitat is one of our major activities at Yakushima. The level of protection has gradually increased in the National Park at Yakushima and, via our various conservation efforts, its most important area was designated a World Heritage Site by UNESCO in 1993. However, large-scale logging in the 1960s and 1970s caused the loss of macaque habitats and led to increased crop damage by them in the 1980s. We have proposed effective methods to protect cultivated fields from macaques as well as several plans for sustainable use of forests, such as ecotourism and a fieldwork course for university students. Local residents and researchers have created several nongovernment organizations (NGOs) to promote conservation and nature study at Yakushima. The role of local NGOs is particularly important to mitigate conflicts between people and wildlife. Though hundreds of macaques are still captured as pests annually in Yakushima, we continue the conservation measures and spread awareness of conservation in cooperation with the local NGOs.  2008 Springer Science+Business Media, LLC.",NM,exclude (no trait variation),,
MA340,"Solitary obsession or mnage  trois, but cooperative breeding is never a two-party game",NA,NM,include,intraspecific,"comment/review/theory, cooperation"
MA281,Plant biotic interactions in the Sonoran desert: Current knowledge and future research perspectives,"Premise of research. Biotic interactions have long been considered to be of less importance in structuring desert systems than other ecosystem types, but biotic interactions often play a critical role in meeting the challenges posed by the extreme conditions of desert environments. The Sonoran Desert, in particular, is home to several textbook examples of mutualisms, such as the interactions between the iconic saguaro cactus and its bat pollinators. But what do we know about the diversity, ecology, and evolution of plant-animal, plant-plant, and plant-microbe interactions and their impacts on individual plants and plant species in the Sonoran Desert? Methodology. To address this question, we review the published research on seven common kinds of plant biotic interactions by revisiting the respective literature, identifying gaps in our knowledge, and outlining future research directions. Pivotal results. Numerous gaps in our knowledge of plant biotic interactions in the Sonoran Desert were identified. Studies of insect herbivory, bee pollination, and plant-microbe interactions are poorly represented in the Sonoran Desert literature. Across all categories of interaction, few have examined the impacts of interactions on plant fitness or context-dependent variation in the outcomes and strengths of interactions. For the most part, interactions have been studied at single locations and over short periods of time, resulting in an incomplete understanding of their diversity, ecology, and evolution. Conclusions. Plant biotic interactions shape the habitats in which they occur and play an important role in the maintenance of species diversity. Therefore, we call for increased efforts to fill the gaps in our understanding of plant biotic interactions in the Sonoran Desert, with an emphasis on studies linking interactions to plant fitness and the context-dependent nature of interactions. Without this knowledge we have limited capacity to predict the outcomes of global change on species interactions and to develop measures to conserve the biodiversity of the Sonoran Desert region.  2016 by The University of Chicago. All rights reserved.",NM,include,interspecific,"plant-animal, factors effecting the quality and strength of those interactions in a desert biome"
MA292,Presence of Chlamydiales DNA in ticks and fleas suggests that ticks are carriers of Chlamydiae,"The Chlamydiales order includes the Chlamydiaceae, Parachlamydiaceae, Waddliaceae, Simkaniaceae, Criblamydiaceae, Rhabdochlamydiaceae, Clavichlamydiaceae, and Piscichlamydiaceae families. Members of the Chlamydiales order are obligate intracellular bacteria that replicate within eukaryotic cells of different origins including humans, animals, and amoebae. Many of these bacteria are pathogens or emerging pathogens of both humans and animals, but their true diversity is largely underestimated, and their ecology remains to be investigated. Considering their potential threat on human health, it is important to expand our knowledge on the diversity of Chlamydiae, but also to define the host range colonized by these bacteria. Thus, using a new pan-Chlamydiales PCR, we analyzed the prevalence of Chlamydiales DNA in ticks and fleas, which are important vectors of several viral and bacterial infectious diseases. To conduct this study, 1340 Ixodes ricinus ticks prepared in 192 pools were collected in Switzerland and 55 other ticks belonging to different tick species and 97 fleas belonging to different flea species were harvested in Algeria. In Switzerland, the prevalence of Chlamydiales DNA in the 192 pools was equal to 28.1% (54/192) which represents an estimated prevalence in the 1340 individual ticks of between 4.0% and 28.4%. The pan-Chlamydiales qPCR was positive for 45% (25/55) of tick samples collected in Algeria. The sequencing of the positive qPCR amplicons revealed a high diversity of Chlamydiales species. Most of them belonged to the Rhabdochlamydiaceae and Parachlamydiaceae families. Thus, ticks may carry Chlamydiales and should thus be considered as possible vectors for Chlamydiales propagation to both humans and animals.  2014 Elsevier GmbH.",NM,exclude (no trait variation),,
MA140,"Facultative control of offspring sex in the cooperatively breeding bell miner, Manorina melanophrys","The ability to alter primary sex ratios has the potential to increase a breeding individual's fitness. This is certainly true in those cooperative breeders where one sex is both philopatric and helps raise future offspring of its parents. We examined the primary sex ratio variation in the cooperatively breeding bell miner (Manorina melanophrys) in southeastern Australia over six breeding seasons. Male offspring are the philopatric and helping sex in this system and can increase the reproductive output of their parents. Bell miners aggressively defend their territory from all interspecific competitors and by doing so allow food resources to dramatically increase. The increase in phytophagous Psyllidae insects (which secrete a carbohydrate-rich coating that constitutes the major component of bell miner diet) leads to a decrease in tree health, often culminating in death of the tree. Bell miners then move as groups to new areas with low psyllid abundance, and the cycle repeats. Using this predictable temporal variation in food availability, we aimed to determine whether female breeders adjusted the sex ratio of broods to produce more of the philopatric sex when food resources were high and more of the dispersing sex when food resources were low. Our results provide clear evidence for such facultative control of sex ratio by female bell miners. Newly founded colonies are characterized by low food availability and a female-biased primary sex ratio, whereas colonies more than 1 year old have an increased food availability and a male-biased primary sex ratio. We suggest treating forces associated with resource enhancement and competition as opposing sides of a single general principle and suggest that it is necessary to view both the costs and benefits of philopatric individuals within a variable environment.",NM,include,intraspecific,"competition, sex-ratio within populations"
MA313,Selfish Mitonuclear Conflict,"Mitochondria, a nearly ubiquitous feature of eukaryotes, are derived from an ancient symbiosis. Despite billions of years of cooperative coevolution  in what is arguably the most important mutualism in the history of life  the persistence of mitochondrial genomes also creates conditions for genetic conflict with the nucleus. Because mitochondrial genomes are present in numerous copies per cell, they are subject to both within- and among-organism levels of selection. Accordingly, selfish genotypes that increase their own proliferation can rise to high frequencies even if they decrease organismal fitness. It has been argued that uniparental (often maternal) inheritance of cytoplasmic genomes evolved to curtail such selfish replication by minimizing within-individual variation and, hence, within-individual selection. However, uniparental inheritance creates conditions for cytonuclear conflict over sex determination and sex ratio, as well as conditions for sexual antagonism when mitochondrial variants increase transmission by enhancing maternal fitness but have the side-effect of being harmful to males (i.e., mother's curse). Here, we review recent advances in understanding selfish replication and sexual antagonism in the evolution of mitochondrial genomes and the mechanisms that suppress selfish interactions, drawing parallels and contrasts with other organelles (plastids) and bacterial endosymbionts that arose more recently. Although cytonuclear conflict is widespread across eukaryotes, it can be cryptic due to nuclear suppression, highly variable, and lineage-specific, reflecting the diverse biology of eukaryotes and the varying architectures of their cytoplasmic genomes. Havird et al. explain how mitochondrial and nuclear genomes can come into conflict with one another and how this fits into specific features of organelle/host biology, such as the commonly observed uniparental inheritance of mitochondria.  2019 Elsevier Ltd",NM,exclude (no interspecific or intraspecific interaction),,
