"X.ISI.000189023900007","Are bryophyte communities different from higher-plant communities? Abundance relations","Steel, JB and Wilson, JB and Anderson, BJ and Lodge, RHE and Tangney, RS","OIKOS",104,"3","479-486",2004,"10.1111/j.0030-1299.2004.12840.x","The considerable differences in biology between bryophytes and higher plants have led to speculation that their community structure might be different. Ten bryophyte communities were sampled for species biomass composition, and for comparison ten higher-plant communities that were similar in physiognomy and in total community biomass. The rather insecure theory in the bryophyte literature was distilled into eight quantifiable predictions, which were tested. For seven, there was no sign of the predicted differences: i.e. no indication of the predicted low within-community heterogeneity, higher species richness, more variable species richness, lower rank consistency, a poor fit for the geometric model of RAD (relative abundance distribution), better fit for the broken-stick and general-lognormal RAD models with general-lognormal parameter gamma deviating further from 1.0, or of a good fit for the Zipf-Mandelbrot RAD model. However, evenness was, on average, significantly (p=0.005) less in the bryophyte communities, using any of four evenness indices. Two possible features of bryophytes are suggested that might cause this: (a) a smaller module (i.e. shoot, leaf) size, allowing species to be present with a lower threshold biomass, and (b) less efficient competitive exclusion among bryophytes because of weaker competition and a predominance of mutualism, as suggested in the literature. However, the striking conclusion from the results is that in spite of all the biological differences between the two groups of organisms, their community organisation is remarkably similar.",1,"MA23","","","",""
"Schuppe2016673","The social context of a territorial dispute differentially influences the way individuals in breeding pairs coordinate their aggressive tactics","Schuppe, E.R. and Sanin, G.D. and Fuxjager, M.J.","Behavioral Ecology and Sociobiology",70,"5","673-682",2016,"10.1007/s00265-016-2088-0","Abstract: In diverse species, individuals coordinate behavior to accomplish shared goals or tasks. Such coordination, however, often occurs selectively, and the contextual information animals use to determine when they coordinate and when they do not is unclear. We investigate this issue in the highly territorial downy woodpecker (Picoides pubescens) by exploring how individuals within a social breeding pair differentially modulate coordinated aggressive responses during graded simulated territorial intrusions (STIs). Analyses show that resident pairs mount a more robust aggressive response to STIs that represent a greater threat. Moreover, in this social context, pair members produce contact vocalizations in a way that predicts their partners aggressive behavior. We also show that, when presented with a low threat, individuals that first respond to intrusions decrease their aggressive output once their partner attends to the stimulus; the partner, in turn, increases their levels of aggressive behavior. This does not occur in high-threat STIs, where both partners maintain high levels of aggression throughout the entire encounter. Together, these results show that individuals within a pair flexibly adjust their aggressive tactics in response to different social competitive contexts, and this includes adjusting the way in which individuals coordinate certain aspects of their agonistic repertoire. We speculate that this ability reflects an adaptive mechanism that allows individuals to fine-tune territorial tactics to reduce overall costs of aggression. Significance statement: Although research has demonstrated that individuals often coordinate their behavior to accomplish common tasks, little is known about the factors that determine when such coordination occurs and when it does not. We address this issue for the first time in the highly territorial downy woodpecker by testing how the level of threat associated with a territorial interaction influences the coordination of defensive behavior. We find that, when facing intruders that pose a greater threat, residents adjust levels of aggressive output in response to the number of vocalizations produced by their breeding partner. By contrast, this relationship is not observed when pairs face intruders that pose a relatively lower threat. Our data therefore provide striking evidence that coordination in defensive tactics depends on the residents appraisal of the social context, such that fiercer competition is associated with greater behavioral coordination.  2016, Springer-Verlag Berlin Heidelberg.",2,"MA386","","","",""
"X.ISI.000460668800007","Evolutionary maintenance of genomic diversity within arbuscular mycorrhizal fungi","Scott, Thomas W. and Kiers, E. Toby and Cooper, Guy A. and dos Santos, Miguel and West, Stuart A.","ECOLOGY AND EVOLUTION",9,"5","2425-2435",2019,"10.1002/ece3.4834","Most organisms are built from a single genome. In striking contrast, arbuscular mycorrhizal fungi appear to maintain genomic variation within an individual fungal network. Arbuscular mycorrhizal fungi dwell in the soil, form mutualistic networks with plants, and bear multiple, potentially genetically diverse nuclei within a network. We explore, from a theoretical perspective, why such genetic diversity might be maintained within individuals. We consider selection acting within and between individual fungal networks. We show that genetic diversity could provide a benefit at the level of the individual, by improving growth in variable environments, and that this can stabilize genetic diversity even in the presence of nuclear conflict. Arbuscular mycorrhizal fungi complicate our understanding of organismality, but our findings offer a way of understanding such biological anomalies.",1,"MA133","","","",""
"Wright2010941","Variance-sensitive green woodhoopoes: A new explanation for sex differences in foraging?","Wright, J. and Radford, A.N.","Ethology",116,"10","941-950",2010,"10.1111/j.1439-0310.2010.01811.x","Studies of cooperatively breeding birds rarely benefit from the extensive research on adaptive foraging behaviour, despite the potential for concepts such as state-dependent foraging to explain many aspects of behaviour in social groups. For example, sex differences in preferred foraging techniques used by green woodhoopoes, Phoeniculus purpureus, have previously been explained by sexual dimorphism in bill length and the benefits afforded by foraging specialization and niche differentiation within cooperative groups. Contrary to this argument, there were no sex differences in mean foraging success and/or prey size captured when males and females used the same foraging techniques. Subordinates of both sexes did experience lower and more varied foraging success compared with dominants, but probably only as a consequence of competition or inexperience. However, dominant males experienced greater variance in individual foraging success compared with dominant females, and dominant males also experienced greater variances in prey size when using their preferred foraging techniques. Dominant males therefore appeared to specialize in foraging techniques that provided more variable rewards, whilst dominant females consistently chose to minimize variation in reward. Dominant females also experienced less variance in foraging returns when using the same techniques as males, suggesting a possible link with sexual dimorphism in bill length. Partitioning of foraging niches in dominant green woodhoopoes therefore appears to be better explained by sex differences in variance (risk) sensitivity to foraging rewards. We suggest that this kind of detailed analysis of state-dependent foraging has the potential to explain many of the crucial age and sex differences in behaviour within cooperative groups.  2010 Blackwell Verlag GmbH.",2,"MA402","","","",""
"Levin201013","Crossing scales, crossing disciplines: Collective motion and collective action in the Global Commons","Levin, S.","Philosophical Transactions of the Royal Society B: Biological Sciences",365,"1537","13-18",2010,"10.1098/rstb.2009.0197","Two conflicting tendencies can be seen throughout the biological world: individuality and collective behaviour. Natural selection operates on differences among individuals, rewarding those who perform better. Nonetheless, even within this milieu, cooperation arises, and the repeated emergence of multicellularity is the most striking example. The same tendencies are played out at higher levels, as individuals cooperate in groups, which compete with other such groups. Many of our environmental and other global problems can be traced to such conflicts, and to the unwillingness of individual agents to take account of the greater good. One of the great challenges in achieving sustainability will be in understanding the basis of cooperation, and in taking multicellularity to yet a higher level, finding the pathways to the level of cooperation that is the only hope for the preservation of the planet.  2010 The Royal Society.",1,"MA83","","","",""
"Goodacre2012246","Modification of insect and arachnid behaviours by vertically transmitted endosymbionts: Infections as drivers of behavioural change and evolutionary novelty","Goodacre, S.L. and Martin, O.Y.","Insects",3,"1","246-261",2012,"10.3390/insects3010246","Vertically acquired, endosymbiotic bacteria such as those belonging to the Rickettsiales and the Mollicutes are known to influence the biology of their arthropod hosts in order to favour their own transmission. In this study we investigate the influence of such reproductive parasites on the behavior of their insects and arachnid hosts. We find that changes in host behavior that are associated with endosymbiont infections are not restricted to characteristics that are directly associated with reproduction. Other behavioural traits, such as those involved in intraspecific competition or in dispersal may also be affected. Such behavioural shifts are expected to influence the level of intraspecific variation and the rate at which adaptation can occur through their effects on effective population size and gene flow amongst populations. Symbionts may thus influence both levels of polymorphism within species and the rate at which diversification can occur.  2012 by the authors; licensee MDPI, Basel, Switzerland.",1,"MA247","","","",""
"X.ISI.000356611200022","Coloration reflects behavioural types in the convict cichlid, Amatitlania siquia","Schweitzer, Cecile and Motreuil, Sebastien and Dechaume-Moncharmont, Francis-Xavier","ANIMAL BEHAVIOUR",105,NA,"201-209",2015,"10.1016/j.anbehav.2015.04.024","Interindividual behavioural differences, consistent over time and across situations, are frequently related to differences in reproductive success, susceptibility to disease and competitive ability. The behavioural phenotype of a conspecific is likely to affect the outcome of a social interaction, so an individual must be able to accurately assess behavioural phenotypes in order to optimize behavioural responses during mate choice, cooperative relationships and agonistic interactions. However, behavioural assessment based on dyadic interactions in different contexts can be costly because it may require significant time, increase the risk of predation and often necessitates special cognitive abilities. Different colour cues are associated with different life history strategies in many species, so coloration might also correlate with behavioural phenotype. Thus, conspecifics could use coloration as a single cue for the mediation of social interactions. We investigated the relationship between personality and coloration in the monogamous, biparental convict cichlid. This species has black melanin-based stripes with interindividual variation in the intensity of these stripes. In addition, females have bright orange spots on their abdomens. Using repeatable measures of boldness, exploration and aggressiveness, we were able to define a behavioural syndrome and quantified the behavioural type of each individual. Behavioural types were predicted by colour traits. In particular, proactive individuals (more aggressive, bolder and quicker to resume behaviour after being startled) were more likely to be dark and, among females, have smaller orange areas. Our results support the hypothesis that coloration in the convict cichlid is related to personality. Thus, coloration could play an important role in mediating social interactions, allowing a quick and reliable assessment of conspecifics' behavioural types. (C) 2015 The Association for the Study of Animal Behaviour. Published by Elsevier Ltd. All rights reserved.",2,"MA53","","","",""
"X.ISI.000242897000014","Ant stoichiometry: elemental homeostasis in stage-structured colonies","Kay, A. D. and Rostampour, S. and Sterner, R. W.","FUNCTIONAL ECOLOGY",20,"6","1037-1044",2006,"10.1111/j.1365-2435.2006.01187.x","1. Organisms facing variation in food quality maintain elemental composition within limited bounds. Such stoichiometric homeostasis has often been considered a species-specific parameter, but stoichiometry can also vary intraspecifically across life stages, sexes and sizes. In colonial organisms with overlapping generations, stoichiometric variation among stages could lead to flexibility in colony-level elemental composition due to changes in internal demography 2. We examine how the balance of energy (sucrose) and nutrients (prey) affects growth rate and carbon : nitrogen : phosphorus (C : N : P) homeostasis in a eusocial insect, the pavement ant Tetramorium caespitum. 3. Colony growth depended heavily on prey availability. However, sucrose scarcity led to higher worker mortality and production of smaller workers, suggesting sucrose availability will affect colony-level performance in a competitive environment. 4. In contrast, C : N : P stoichiometry of larvae, pupae, and workers varied mostly with sucrose availability. Biomass P content within life stages was lower in colonies receiving less access to sucrose. We suggest this difference arose primarily from shifts in individual ant mass coupled with negative P-body mass relationships. 5. Life stages differed considerably in elemental composition, and resource conditions affected colony stage structure. Nevertheless, variation in colony-level stoichiometry primarily reflected compositional differences within stages rather than shifts in internal demography.",1,"MA17","","","",""
"X.ISI.000306418200003","Sperm storage reflects within- and extra-pair mating opportunities in a cooperatively breeding bird","Kingma, Sjouke A. and Hall, Michelle L. and Peters, Anne","BEHAVIORAL ECOLOGY AND SOCIOBIOLOGY",66,"8","1115-1123",2012,"10.1007/s00265-012-1363-y","In passerine birds, storage and maturation of sperm takes place in the cloacal protuberance (CP), an external swelling of the reproductive organ. The considerable variation in CP size among species is presumed to be a consequence of varying levels of sperm-competition, but whether individual variation in CP size within a species also reflects sperm competition is not well established. Here, we study temporal variation in male CP size in relation to within-pair and extra-pair mating opportunities and cuckoldry risk in purple-crowned fairy-wrens Malurus coronatus. This is a socially monogamous cooperatively breeding passerine that can breed year-round and has low levels of extra-pair paternity (in 6 \% of broods). We show that male CP size sharply increased a few weeks before, and rapidly regressed after his partner laid eggs, consistent with a cost of its maintenance and/or sperm production. Surprisingly, despite low levels of extra-pair paternity, CP size of non-breeding and pre-breeding males was positively correlated with the number of breeding females in the population, suggesting that CP size is sensitive to extra-pair mating opportunities. However, CP sizes do not seem to reflect cuckoldry risk: CP size of dominant males was unaffected by the presence of a subordinate that was unrelated to the dominant female, although those subordinates occasionally sire offspring, and had a larger CP than subordinates living with their mother. Our results suggest that, even in a species with low levels of extra-pair paternity, individual investment in sperm storage reflects both within-pair and, albeit to lesser extent, extra-pair mating opportunities.",2,"MA348","","","",""
"McCauley2018901","Species traits dictate seasonal-dependent responses of octocoralalgal symbioses to elevated temperature and ultraviolet radiation","McCauley, M. and Banaszak, A.T. and Goulet, T.L.","Coral Reefs",37,"3","901-917",2018,"10.1007/s00338-018-1716-8","Ultraviolet radiation (UVR) can exacerbate the effects of elevated seawater temperatures concomitant with climate change. Such stressors can collapse the mutualism of scleractinian corals with their endosymbiotic unicellular algae, Symbiodinium spp. Conversely, we found that the Caribbean octocorals Pseudoplexaura crucis and Eunicea tourneforti coped with thermal and UVR stress. But, the responses differed and depended on the species biochemical properties. Furthermore, the effects of the stressors varied seasonally. For 7d, during summer and winter, we exposed the octocorals to either 3C above ambient temperature, UVR, or both. In either season, the stressors did not affect protein or carbohydrate content nor the Symbiodinium genotype. At the elevated temperature in the summer, the lipid content in P. crucis fell alongside a 35% decline in Symbiodinium. Conversely, in E. tourneforti, algal density dropped 26% with no lipid loss. In both species, the remaining Symbiodinium retained their chlorophyll and carotenoid content. In the winter, + 3C and UVR led to increased algal density, mitotic index, and chlorophyll and carotenoid contents. Temperature affected more parameters than UVR, but additive, synergistic and antagonistic interactions occurred. These findings show the resilience of Caribbean gorgonian corals against stressful environmental conditions and highlight the importance of including organismal biochemical differences and seasonal responses into interpreting the effects of multiple stressors associated with global climate change.  2018, Springer-Verlag GmbH Germany, part of Springer Nature.",1,"MA347","","","",""
"X.ISI.000180007000008","The causes and consequences of ant invasions","Holway, DA and Lach, L and Suarez, AV and Tsutsui, ND and Case, TJ","ANNUAL REVIEW OF ECOLOGY AND SYSTEMATICS",33,NA,"181-233",2002,"10.1146/annurev.ecolysis.33.010802.150444","Invasions by non-native ants are an ecologically destructive phenomenon affecting both continental and island ecosystems throughout the world. Invasive ants often become highly abundant in their introduced range and can outnumber native ants. These numerical disparities underlie the competitive asymmetry between invasive ants and native ants and result from a complex interplay of behavioral, ecological, and genetic factors. Reductions in the diversity and abundance of native ants resulting from ant invasions give rise to a variety of direct and indirect effects on non-ant taxa. Invasive ants compete with and prey upon a diversity of other organisms, including some vertebrates, and may enter into or disrupt mutualistic interactions with numerous plants and other insects. Experimental studies and research focused on the native range ecology of invasive ants will be especially valuable contributions to this field of study.",1,"MA365","","","",""
"Peters1997218","Encapsulation of the Entomopathogenic NematodeSteinernema feltiaeinTipula oleracea","Peters, A. and Ehlers, R.-U.","Journal of Invertebrate Pathology",69,"3","218-222",1997,"10.1006/jipa.1996.4648","The encapsulation response ofTipula oleraceato the entomopathogenic nematodeSteinernema feltiaewas investigated by exposing the insects to nematode dauer juveniles (DJs) and by injecting DJs with and without the symbiotic bacteriaXenorhabdus bovienii.The encapsulation response varied considerably between individual insect larvae. The variation could not be attributed to a more or less scattered nematode invasion over time since it was also recorded after simultaneous injection of a fixed DJ dose. The proportion of encapsulated nematodes declined with increasing dose (injected DJs/larva) from approx 80% for 1 DJ/larva to 33-34% for 20 DJ/larva.Tipula oleracealarvae were capable of encapsulating nematodes with and without symbionts inside the hemocoel; however, at doses of 10 and 20 DJ/larva, axenic nematodes were encapsulated less frequently than monoxenic nematodes. Injected axenic nematodes that were not encapsulated did not develop inT. oleracealarvae but disappeared from the insect's hemocoel. Coinjection of symbiotic bacteria increased encapsulation of axenic nematodes, showing thatX. bovieniiis triggering the encapsulation response ofT. oleraceaagainstS. feltiae.  1997 Academic Press.",1,"MA119","","","",""
"X.ISI.000358315700007","Developmental plasticity and social specialization in cooperative societies","English, Sinead and Browning, Lucy E. and Raihani, Nichola J.","ANIMAL BEHAVIOUR",106,NA,"37-42",2015,"10.1016/j.anbehav.2015.05.006","Cooperative breeding systems showcase the diversity of social trajectories within and among species, ranging from the extremes of eusocial insects where individuals become irreversibly specialized as fecund queens or sterile workers, to vertebrate systems where individuals maintain the flexibility to breed throughout life. Between these extremes lies a continuum with individuals exhibiting varying degrees of specialization in their behaviour. Most research on cooperative breeders, particularly on vertebrate systems, has focused on why helping has evolved, rather than addressing this diversity. Here, we present a framework to explain variation in the timing, extent and flexibility of phenotypic divergence across vertebrate and invertebrate cooperative systems. We base our framework on recent theory about how individuals integrate information about the environment from different sources (genes, parents and direct experiences) when establishing their developmental trajectory. We discuss how the timing and degree of divergence and specialization are influenced by the availability and reliability of information about later fitness options and by the extent to which individuals have control over their development. Throughout, we use this developmental perspective to draw broad comparisons across vertebrate and invertebrate systems, which are often considered separately. (C) 2015 The Association for the Study of Animal Behaviour. Published by Elsevier Ltd. All rights reserved.",1,"MA90","","","",""
"Nicolis20072387","Kinetics of aggregate formation in social insects","Nicolis, S.C.","Bulletin of Mathematical Biology",69,"7","2387-2403",2007,"10.1007/s11538-007-9224-y","A model for the kinetics of aggregation in social insects which accounts for stochastic effects arising from individual variability and covers both the early and the mature stages of the process is developed. Different aggregation scenarios are studied, depending on the degree of cooperativity and the mean population density. It is shown that under certain conditions, the system evolves slowly to a single cluster incorporating all individuals, or to two coexisting clusters of similar sizes.  2007 Society for Mathematical Biology.",2,"MA227","","","",""
"X.ISI.000358454500016","Hotspots of damage by antagonists shape the spatial structure of plant-pollinator interactions","Rodriguez-Rodriguez, Maria C. and Jordano, Pedro and Valido, Alfredo","ECOLOGY",96,"8","2181-2191",2015,"10.1890/14-2467.1","The balance between mutualistic and antagonistic plant-animal interactions and their spatial variation results in a highly dynamic mosaic of reproductive success within plant populations. Yet, the ecological drivers of this small-scale heterogeneity of interaction patterns and their outcomes remain virtually unexplored. We analyzed spatial structure in the frequency and intensity of interactions that vertebrate pollinators (birds and lizards) and invertebrate antagonists (florivores, nectar larcenists, and seed predators) had when interacting with the insular plant Isoplexis canariensis, and their effect on plant fitness. Spatially autocorrelated variation in plant reproductive success (fruit and viable seed set) emerged from the combined action of mutualists and antagonists, rather than reflecting the spatial pattern of any specific animal group. However, the influence of antagonists on plant fitness was stronger primarily due to the florivores' action on earlier reproductive stages, consuming and damaging floral structures before the arrival of pollinators. Our results indicate that the early action of antagonists creates hotspots of increased plant damage, where the effects of later acting mutualists are not translated into increased reproductive benefits. We foresee the potential for antagonists to shape the intra-population mosaics of plant fitness in situations where antagonists outnumber mutualists, when their interactions occur before those of mutualists, and when mutualists can detect and avoid damaged plants while foraging. Severely damaged plants in antagonistic hotspots might be excluded from the mating network and render a limited production of viable seeds, reducing both the growth rate of the plant population and the effective population size.",1,"MA187","","","",""
