"Diversity and evolutionary patterns of bacterial gut associates of corbiculate bees","The animal gut is a habitat for diverse communities of microorganisms (microbiota). Honeybees and bumblebees have recently been shown to harbour a distinct and species poor microbiota, which may confer protection against parasites. Here, we investigate diversity, host specificity and transmission mode of two of the most common, yet poorly known, gut bacteria of honeybees and bumblebees: Snodgrassella alvi (Betaproteobacteria) and Gilliamella apicola (Gammaproteobacteria). We analysed 16S rRNA gene sequences of these bacteria from diverse bee host species across most of the honeybee and bumblebee phylogenetic diversity from North America, Europe and Asia. These focal bacteria were present in 92% of bumblebee species and all honeybee species but were found to be absent in the two related corbiculate bee tribes, the stingless bees (Meliponini) and orchid bees (Euglossini). Both Snodgrassella alvi and Gilliamella apicola phylogenies show significant topological congruence with the phylogeny of their bee hosts, albeit with a considerable degree of putative host switches. Furthermore, we found that phylogenetic distances between Gilliamella apicola samples correlated with the geographical distance between sampling locations. This tentatively suggests that the environmental transmission rate, as set by geographical distance, affects the distribution of G. apicola infections. We show experimentally that both bacterial taxa can be vertically transmitted from the mother colony to daughter queens, and social contact with nest mates after emergence from the pupa greatly facilitates this transmission. Therefore, sociality may play an important role in vertical transmission and opens up the potential for co-evolution or at least a close association of gut bacteria with their hosts.  2013 Blackwell Publishing Ltd.","MA95","UE","","",""
"Adaptive divergence in a defense symbiosis driven from the top down","Most studies of adaptive radiation in animals focus on resource competition as the primary driver of trait divergence. The roles of other ecological interactions in shaping divergent phenotypes during such radiations have received less attention. We evaluate natural enemies as primary agents of diversifying selection on the phenotypes of an actively diverging lineage of gall midges on tall goldenrod. In this system, the gall of the midge consists of a biotrophic fungal symbiont that develops on host-plant leaves and forms distinctly variable protective carapaces over midge larvae. Through field studies, we show that fungal gall morphology, which is induced by midges (i.e., it is an extended phenotype), is under directional and diversifying selection by parasitoid enemies. Overall, natural enemies disruptively select for either small or large galls, mainly along the axis of gall thickness. These results imply that predators are driving the evolution of phenotypic diversity in symbiotic defense traits in this system and that divergence in defensive morphology may provide ecological opportunities that help to fuel the adaptive radiation of this genus of midges on goldenrods. This enemy-driven phenotypic divergence in a diversifying lineage illustrates the potential importance of consumerresource and symbiotic species interactions in adaptive radiation.  2018 by The University of Chicago. All rights reserved.","MA10","UE","","",""
"Can cleanerfish overcome temptation? A selective role for dopamine influence on cooperative-based decision making","Evidence suggests that animals are selected to make accurate choices and prioritize goals within the constraints of a given social environment to maximize fitness. These decisions are mostly based on complex processes in which value is linked to reward and cues may carry variable incentive salience. However, the level in which the incentive elicited by a cue is able to shift individual choices should differ between individuals and neurophysiological states. Here we used a notorious cooperative cleanerfish species Labroides dimidiatus to probe for differences in the incentive motivational valences given to food cues and then tested for the role of the dopaminergic system in the appraisal of such cues. We found that cleaners differed in Pavlovian conditioned approach behavioural responses to reward-associated stimuli: while the majority were fast to engage physically with the cue plate that indicated future reward delivery (sign trackers), only a few took significantly more time to respond (goal trackers). But amongst those that were considering the sole cue attractive, we discovered that the dopaminergic blockage decreased their initial propensity to approach and touch the cue plate. Our results show that dopamine disruption contributes to shifting the attribution of motivational incentive from the predictive cue towards the actual reward and provides key insight into the physiological framework of cooperative-based decision making. (C) 2016 Elsevier Inc. All rights reserved.","MA38","UE","","",""
"Playing styles and possible causative factors in dogs' behaviour when playing with humans","Individual differences and causative factors could modify the behaviour of dogs in object related games played with a human partner. In a two-by-two within-subject design we observed 68 family dogs' behaviour when playing two different types of games (ball game and tugging) with two different play partners (owner or unfamiliar experimenter) ill order to categorize each dog's playing style. In all four conditions we have measured the following behavioural variables: tendency for possession, willingness to retrieve, behaviours related to fear/avoidance and aggression, and occurrence of play bows. We also calculated the relative duration of time when the dogs oriented ``outwards{''} from the play situation to the other non-interacting person (owner or ex peri me titer) during a session. Than we examined the effect of six factors on dog-human play behaviour: the familiarity of the play partner, the type of the game, the dogs' gender, age and breed, and the duration of daily active interaction between dog and owner. We used factor analysis to unfold the relationship among the recorded variables and revealed three factors that accounted for 63\% of the total variance. On Factor I variables measured in tugging with both the experimenter and owner had high loadings (labelled ``Motivation for tugging{''}). Factor 2 contained all variables measuring fear and avoidance (Fear/Avoidance), and Factor 3 consisted of variables measured ill ball game (Motivation for ball game). The cluster analysis of the dogs' individual factor scores classified them into 5 significantly different groups on the basis of their tendency to be involved in playing with a ball, a rag and to show fear/avoidance during the tests. Moreover, the gender (but not the age or breed) of the dogs and the duration of the daily active interaction with the owner had significant effects oil the distribution of dogs between the cluster groups. These results suggest that in play situations the behaviour of well socialized family dogs is influenced more by their motivation to play and to a certain extent by the level of fear than by the familiarity of the play partner or their possible general tendencies for cooperative or competitive behaviours. (C) 2008 Elsevier B.V. All rights reserved.","MA285","UE","","",""
"Quorum Sensing Signal Synthesis May Represent a Selective Advantage Independent of Its Role in Regulation of Bioluminescence in Vibrio fischeri","The evolution of biological signalling systems and apparently altruistic or cooperative traits in diverse organisms has required selection against the subversive tendencies of self-interested biological entities. The bacterial signalling and response system known as quorum sensing or Acylated Homoserine Lactone (AHL) mediated gene expression is thought to have evolved through kin selection. In this in vitro study on the model quorum sensing bioluminescent marine symbiont Vibrio fischeri, competition and long-term sub culturing experiments suggest that selection for AHL synthesis (encoded by the AHL synthase gene luxI) is independent of the quorum sensing regulated phenotype (bioluminescence encoded by luxCDABE). Whilst results support the hypothesis that signal response (AHL binding and transcriptional activation encoded by the luxR gene) is maintained through indirect fitness benefits (kin selection), signal synthesis is maintained in the V. fischeri genome over evolutionary time through direct fitness benefits at the individual level from an unknown function.  2013 Chong et al.","MA295","UE","","",""
"Evolutionary maintenance of genomic diversity within arbuscular mycorrhizal fungi","Most organisms are built from a single genome. In striking contrast, arbuscular mycorrhizal fungi appear to maintain genomic variation within an individual fungal network. Arbuscular mycorrhizal fungi dwell in the soil, form mutualistic networks with plants, and bear multiple, potentially genetically diverse nuclei within a network. We explore, from a theoretical perspective, why such genetic diversity might be maintained within individuals. We consider selection acting within and between individual fungal networks. We show that genetic diversity could provide a benefit at the level of the individual, by improving growth in variable environments, and that this can stabilize genetic diversity even in the presence of nuclear conflict. Arbuscular mycorrhizal fungi complicate our understanding of organismality, but our findings offer a way of understanding such biological anomalies.","MA133","UE","","",""
"Birth order affects behaviour in the investment game: firstborns are less trustful and reciprocate less","Explaining the behavioural variations observed between individuals is an important step for understanding the evolution of human cooperation and personality traits. Birth order is a potentially important variable that implies physical and cognitive differences between siblings and differential access to parental resources during childhood. These differences have been shown to influence several personality characteristics in adulthood. We tested the hypothesis that birth order can shape adult cooperative behaviours towards nonkin. An anonymous investment game was played by 510 unrelated students. The results of the game show that firstborns were less trustful and reciprocated less than others. No significant differences in trust or reciprocity were found among laterborn and only children based on birth order. Firstborn status was a better predictor of cooperativeness than age, sex, income or religion. These results constitute some of the first experimental evidence that birth order differences established within the family can persist in adult behaviour among nonkin. We discuss the implications of this finding for the evolution of human cooperation. (C) 2009 The Association for the Study of Animal Behaviour. Published by Elsevier Ltd. All rights reserved.","MA36","UE","","",""
"Sex differences in intrasexual aggression among sex-role-reversed, cooperatively breeding cichlid fish Julidochromis regani","In sex-role-reversed species, females compete for resources (e.g., mates) more intensively than do males. However, it remains unclear whether these species exhibit sex differences in the intensity of aggressive behavior in the context of within-sex contests. Cichlid fish in the genus Julidochromis exhibit intraspecific variation in mating systems, ranging from monogamy to cooperative polyandry with sex-role reversal. In the study reported here, we observed aggressive interactions among three same-sex individuals in Julidochromis regani in the laboratory and tested whether inter-female aggression was more intense than inter-male aggression. Although difference in body size strongly determined the direction of aggression in fish, aggression by a smaller-sized individuals toward larger ones was occasionally observed. This type of aggression was common between individuals of a similar body size (<= 5 mm) and occurred more frequently among females than males. In contrast, differences in body size and sex did not affect the frequency of aggression by larger-sized individuals against smaller ones. Bidirectional aggression (i.e., mouth fighting) occurred frequently when two individuals had similar body size, and there was no difference in its frequency between sexes. However, temporal analysis showed that females performed bidirectional aggression more persistently than males. These sex differences in the intensity of intrasexual aggression could be the behavioral mechanisms underpinning cooperative polyandry.","MA315","UE","","",""
"Intraspecific differences in plant chemotype determine the structure of arthropod food webs","It is becoming increasingly appreciated that the structure and functioning of ecological food webs are controlled by the nature and level of plant chemicals. It is hypothesized that intraspecific variation in plant chemical resistance, in which individuals of a host-plant population exhibit genetic differences in their chemical contents (called plant chemotypes), may be an important determinant of variation in food web structure and functioning. We evaluated this hypothesis using field assessments and plant chemical assays in the tansy plant Tanacetum vulgare L. (Asteraceae). We examined food webs in which chemotypes of tansy plants are the resource for two specialized aphids, their predators and mutualistic ants. The density of the ant-tended aphid Metopeurum fuscoviride was significantly higher on particular chemotypes (borneol) than others. Clear chemotype preferences between predators were also detected. Aphid specialist seven-spotted ladybird beetles (Coccinella septempunctata) were more often found on camphor plants, while significantly higher numbers of the polyphagous nursery web spider (Pisaura mirabilis) were observed on borneol plants. The analysis of plant chemotype effects on the arthropod community clearly demonstrates a range of possible outcomes between plant-aphid-predator networks. The findings help to offer a deeper insight into how one important factorplant chemical contentinfluences which species coexist within a food web on a particular host plant and the nature of their trophic linkages.  2015, Springer-Verlag Berlin Heidelberg.","MA220","UE","","",""
"Individual variation and the resolution of conflict over parental care in penduline tits","Eurasian penduline tits (Remiz pendulinus) have an unusually diverse breeding system consisting of frequent male and female polygamy, and uniparental care by the male or the female. Intriguingly, 30 to 40 per cent of all nests are deserted by both parents. To understand the evolution of this diverse breeding system and frequent clutch desertion, we use 6 years of field data to derive fitness expectations for males and females depending on whether or not they care for their offspring. The resulting payoff matrix corresponds to an asymmetric Snowdrift Game with two alternative evolutionarily stable strategies (ESSs): female-only and male-only care. This, however, does not explain the polymorphism in care strategies and frequent biparental desertion, because theory predicts that one of the two ESSs should have spread to fixation. Using a bootstrapping approach, we demonstrate that taking account of individual variation in payoffs explains the patterns of care better than a model based on the average population payoff matrix. In particular, a model incorporating differences in male attractiveness closely predicts the observed frequencies of male and female desertion. Our work highlights the need for a new generation of individual-based evolutionary game-theoretic models.  2011 The Royal Society.","MA200","UE","","",""
"Sperm storage reflects within- and extra-pair mating opportunities in a cooperatively breeding bird","In passerine birds, storage and maturation of sperm takes place in the cloacal protuberance (CP), an external swelling of the reproductive organ. The considerable variation in CP size among species is presumed to be a consequence of varying levels of sperm-competition, but whether individual variation in CP size within a species also reflects sperm competition is not well established. Here, we study temporal variation in male CP size in relation to within-pair and extra-pair mating opportunities and cuckoldry risk in purple-crowned fairy-wrens Malurus coronatus. This is a socially monogamous cooperatively breeding passerine that can breed year-round and has low levels of extra-pair paternity (in 6 \% of broods). We show that male CP size sharply increased a few weeks before, and rapidly regressed after his partner laid eggs, consistent with a cost of its maintenance and/or sperm production. Surprisingly, despite low levels of extra-pair paternity, CP size of non-breeding and pre-breeding males was positively correlated with the number of breeding females in the population, suggesting that CP size is sensitive to extra-pair mating opportunities. However, CP sizes do not seem to reflect cuckoldry risk: CP size of dominant males was unaffected by the presence of a subordinate that was unrelated to the dominant female, although those subordinates occasionally sire offspring, and had a larger CP than subordinates living with their mother. Our results suggest that, even in a species with low levels of extra-pair paternity, individual investment in sperm storage reflects both within-pair and, albeit to lesser extent, extra-pair mating opportunities.","MA348","UE","","",""
"Reproductive control via eviction (but not the threat of eviction) in banded mongooses","Considerable research has focused on understanding variation in reproductive skew in cooperative animal societies, but the pace of theoretical development has far outstripped empirical testing of the models. One major class of model suggests that dominant individuals can use the threat of eviction to deter subordinate reproduction (the `restraint' model), but this idea remains untested. Here, we use long-term behavioural and genetic data to test the assumptions of the restraint model in banded mongooses (Mungos mungo), a species in which subordinates breed regularly and evictions are common. We found that dominant females suffer reproductive costs when subordinates breed, and respond to these costs by evicting breeding subordinates from the group en masse, in agreement with the assumptions of the model. We found no evidence, however, that subordinate females exercise reproductive restraint to avoid being evicted in the first place. This means that the pattern of reproduction is not the result of a reproductive `transaction' to avert the threat of eviction. We present a simple game theoretical analysis that suggests that eviction threats may often be ineffective to induce pre-emptive restraint among multiple subordinates and predicts that threats of eviction (or departure) will be much more effective in dyadic relationships and linear hierarchies. Transactional models may be more applicable to these systems. Greater focus on testing the assumptions rather than predictions of skew models can lead to a better understanding of how animals control each other's reproduction, and the extent to which behaviour is shaped by overt acts versus hidden threats.","MA305","UE","","",""
"The Ecological Perspective of Microbial Communities in Two Pairs of Competitive Hawaiian Native and Invasive Macroalgae","Marine macroalgae are known to harbor large populations of microbial symbionts, and yet, microbe symbiosis in invasive macroalgae remains largely unknown. In this study, we applied molecular methods to study microbial communities associated with two invasive algae Acanthophora spicifera and Gracilaria salicornia and the two native algae Gracilaria coronopifolia and Laurencia nidifica at spatial and temporal scales in Hawaiian coral reef ecosystems. Bacterial communities of both the invasive and native macroalgae displayed little spatial and temporal variations, suggesting consistent and stable bacterial associations with these macroalgae. Results of this study identified three types of bacterial populations: nonspecific (present in both algal and water samples); algae-specific (found in all algal species); and species-specific (only found in individual species). The bacterial diversity of invasive algae was lower than that of their native counterparts at phylum and species levels. Notably, the vast majority (71 %) of bacterial communities associated with the invasive algae G. salicornia were representatives of Cyanobacteria, suggesting a potential ecological significance of symbiotic Cyanobacteria.  2012 Springer Science+Business Media New York.","MA368","UE","","",""
"Cheats as first propagules: A new hypothesis for the evolution of individuality during the transition from single cells to multicellularity","The emergence of individuality during the evolutionary transition from single cells to multicellularity poses a range of problems. A key issue is how variation in lower-level individuals generates a corporate (collective) entity with Darwinian characteristics. Of central importance to this process is the evolution of a means of collective reproduction, however, the evolution of a means of collective reproduction is not a trivial issue, requiring careful consideration of mechanistic details. Calling upon observations from experiments, we draw attention to proto-life cycles that emerge via unconventional routes and that transition, in single steps, individuality to higher levels. One such life cycle arises from conflicts among levels of selection and invokes cheats as a primitive germ line: it lays the foundation for collective reproduction, the basis of a self-policing system, the selective environment for the emergence of development, and hints at a plausible origin for a soma/germ line distinction.","MA43","UE","","",""
