"X.ISI.A1997XF65000002","Evolution of the individual","Michod, RE","AMERICAN NATURALIST",150,"S","S5-S21",1997,"10.1086/286047","This article studies the transition in evolution from single cells to multicellular organisms as a case study in the origin of individuality. The issues considered are applicable to all major transitions in the units of selection that involve the emergence of cooperation and the regulation of conflict. Explicit genetic models of mutation and selection both within and between organisms are studied. Cooperation among cells increases when the fitness covariance at the level of the organism overcomes within-organism change toward defection. Selection and mutation during development generate significant levels of within-organism variation and lead to variation in organism fitness at equilibrium. This variation selects for germ-line modifiers and other mediators of within-organism conflict, increasing the heritability of fitness at the organism level. The evolution of these modifiers is the first new function at the emerging organism level and a necessary component of the evolution of individuality.",1,"MA129","","","",""
"Queller2013","Experimental evolution of multicellularity using microbial pseudo-organisms","Queller, D.C. and Strassmann, J.E.","Biology Letters",9,"1",NA,2013,"10.1098/rsbl.2012.0636","In a major evolutionary transition to a new level of organization, internal conflicts must be controlled before the transition can truly be successful. One such transition is that from single cells to multicellularity. Conflicts among cells in multicellular organisms can be greatly reduced if they consist of genetically identical clones. However, mutations to cheaters that experience one round of within-individual selection could still be a problem, particularly for certain life cycles. We propose an experimental evolution method to investigate this issue, using micro-organisms to construct multicellular pseudo-organisms, which can be evolved under different artificial life cycles. These experiments can be used to test the importance of various life cycle features in maintaining cooperation. They include structured reproduction, in which small propagule size reduces within-individual genetic variation. They also include structured growth, which increases local relatedness within individual bodies. Our method provides a novel way to test how different life cycles favour cooperation, even for life cycles that do not exist.  2012 The Author(s) Published by the Royal Society. All rights reserved.",2,"MA135","","","",""
"Correia20191054","First evidence for the joint dispersal of mycorrhizal fungi and plant diaspores by birds","Correia, M. and Heleno, R. and da Silva, L.P. and Costa, J.M. and Rodrguez-Echeverra, S.","New Phytologist",222,"2","1054-1060",2019,"10.1111/nph.15571","Seed dispersal allows plants to colonise new sites and escape from pathogens and intraspecific competition, maintaining plant genetic diversity and regulating plant distribution. Conversely, most plant species form mutualistic associations with arbuscular mycorrhizal (AM) fungi in a symbiosis established immediately after seed germination. Because AM fungi are obligate symbionts, using the same dispersal vector as their host should be highly advantageous for their survival, but the co-dispersal of seeds and AM fungal spores has never been confirmed. We aim to clarify the potential role of European birds, essential dispersers for many plant species, as co-dispersers of seeds and AM fungal spores. In total, 63 bird droppings with intact seeds were placed in sterilised soil and maintained for 4months in a protected environment to avoid contamination. Additionally, 173 bird droppings and 729 gauze swabs used to clean birds feet were inspected for AM fungal spores. Although no spores were detected by direct observation of these samples, seven Rubus ulmifolius seedlings obtained from four independent droppings of Erithacus rubecula and Sylvia melanocephala were colonised by AM fungi. Our results show that birds can effectively co-disperse viable seeds and AM fungal spores, potentially over long distances, providing a pivotal mechanism to understand the cosmopolitan distribution of AM fungi.  2018 The Authors. New Phytologist  2018 New Phytologist Trust",1,"MA147","","","",""
"Ihara2011889","Evolution of culture-dependent discriminate sociality: A gene-culture coevolutionary model","Ihara, Y.","Philosophical Transactions of the Royal Society B: Biological Sciences",366,"1566","889-900",2011,"10.1098/rstb.2010.0247","Animals behave cooperatively towards certain conspecifics while being indifferent or even hostile to others. The distinction is made primarily according to kinship as predicted by the kin selection theory. With regards to humans, however, this is not always the case; in particular, humans sometimes exhibit a discriminate sociality on the basis of culturally transmitted traits, such as personal ornaments, languages, rituals, etc. This paper explores the possibility that the human faculty of cultural transmission and resultant cultural variation among individuals may have facilitated the evolution of discriminate sociality in humans. To this end, a gene-culture coevolutionary model is developed focusing on competition over control of resource as a context in which discriminate sociality may have evolved. Specifically, two types of culture-dependent discriminate sociality are considered: ingroup favouritism, with ingroup and outgroup being distinguished by the presence or absence of a cultural trait; and prestige hierarchies, with the prestige being conferred on the bearer of a cultural trait. The model specifies the conditions under which emergence and evolutionary stability of the two types of discriminate sociality are promoted by the presence of cultural variation among individuals.  2011 The Royal Society.",2,"MA124","","","",""
"Kappeler2019","Social complexity: patterns, processes, and evolution","Kappeler, P.M. and Clutton-Brock, T. and Shultz, S. and Lukas, D.","Behavioral Ecology and Sociobiology",73,"1",NA,2019,"10.1007/s00265-018-2613-4","Abstract: Animal and human societies exhibit extreme diversity in the size, composition and cohesion of their social units, in the patterning of sex-specific reproductive skew, in the nature of parental care, in the form and frequency of cooperation and in their competitive regime, creating a diversity of socially complex societies. However, there is an ongoing debate about whether social complexity is a real, emergent property of a society or whether it only provides a conceptual framework for studying the diversity and evolution of societies. In this introduction to our topical collection, we identify three areas of current research addressing relevant challenges in the study of social complexity. First, previous studies have suffered from a lack of a common conceptual framework, including shared definitions, and existing measures of social complexity do not acknowledge its multiple components and dimensions. Second, most previous studies have ignored intraspecific variation, and the proximate and ultimate determinants of variation in social complexity, as well as their interactions, remain poorly known. Third, comparative studies of social complexity offer opportunities to explore its biological causes and correlates and but it is frequently difficult to identify the causal relationships involved and the development of general insights has been hampered by conceptual and methodological difficulties. In this paper, we briefly characterize these three challenges and offer guidance to the other contributions to this topical collection on social complexity by placing their key results in the context of these three topics. Significance statement: In this paper, we address the main current challenges in the study of social complexity and combine our brief overview with a synopsis of the other contributions to this topical collection on various aspects of social complexity.  2019, Springer-Verlag GmbH Germany, part of Springer Nature.",2,"MA333","","","",""
"Rynkiewicz20152566","Concordance of bacterial communities of two tick species and blood of their shared rodent host","Rynkiewicz, E.C. and Hemmerich, C. and Rusch, D.B. and Fuqua, C. and Clay, K.","Molecular Ecology",24,"10","2566-2579",2015,"10.1111/mec.13187","High-throughput sequencing is revealing that most macro-organisms house diverse microbial communities. Of particular interest are disease vectors whose microbiome could potentially affect pathogen transmission and vector competence. We investigated bacterial community composition and diversity of the ticks Dermacentor variabilis (n = 68) and Ixodes scapularis (n = 15) and blood of their shared rodent host, Peromyscus leucopus (n = 45) to quantify bacterial diversity and concordance. The 16S rRNA gene was amplified from genomic DNA from field-collected tick and rodent blood samples, and 454 pyrosequencing was used to elucidate their bacterial communities. After quality control, over 300 000 sequences were obtained and classified into 118 operational taxonomic units (OTUs, clustered at 97% similarity). Analysis of rarefied communities revealed that the most abundant OTUs were tick species-specific endosymbionts, Francisella and Rickettsia, and the commonly flea-associated bacterium Bartonella in rodent blood. An Arsenophonus and additional Francisella endosymbiont were also present in D. variabilis samples. Rickettsia was found in both tick species but not in rodent blood, suggesting that it is not transmitted during feeding. Bartonella was present in larvae and nymphs of both tick species, even those scored as unengorged. Relatively, few OTUs (e.g. Bartonella, Lactobacillus) were found in all sample types. Overall, bacterial communities from each sample type were significantly different and highly structured, independent of their dominant OTUs. Our results point to complex microbial assemblages inhabiting ticks and host blood including infectious agents, tick-specific endosymbionts and environmental bacteria that could potentially affect arthropod-vectored disease dynamics.  2015 John Wiley & Sons Ltd.",1,"MA69","","","",""
"X.ISI.000251520500003","Selfish punishment: Altruism can be maintained by competition among cheaters","Eldakar, Omar Tonsi and Farrell, Dene Leo and Wilson, David Sloan","JOURNAL OF THEORETICAL BIOLOGY",249,"2","198-205",2007,"10.1016/j.jtbi.2007.07.024","Altruistic punishment refers to a class of behaviors that deters cheating at a cost to the punisher, making it a form of second-order altruism. Usually, it is assumed that the punishers are themselves ``solid citizens{''} who refrain from cheating. We show in a simulation model that altruism and punishment paradoxically become negatively correlated, leading to a form of selfish punishment. Examples of selfish punishment can be found in organisms as diverse as wasps, birds, and humans. (C) 2007 Elsevier Ltd. All rights reserved.",2,"MA314","","","",""
"Prez.Barbera2015","State-space modelling of the drivers of movement behaviour in sympatric species","Prez-Barbera, F.J. and Small, M. and Hooper, R.J. and Aldezabal, A. and Soriguer-Escofet, R. and Bakken, G.S. and Gordon, I.J.","PLoS ONE",10,"11",NA,2015,"10.1371/journal.pone.0142707","Understanding animal movement behaviour is key to furthering our knowledge on intra- and inter-specific competition, group cohesion, energy expenditure, habitat use, the spread of zoonotic diseases or species management. We used a radial basis function surface approximation subject to minimum description length constraint to uncover the state-space dynamical systems from time series data. This approximation allowed us to infer structure from a mathematical model of the movement behaviour of sheep and red deer, and the effect of density, thermal stress and vegetation type. Animal movement was recorded using GPS collars deployed in sheep and deer grazing a large experimental plot in winter and summer. Information on the thermal stress to which animals were exposed was estimated using the power consumption of mechanical heated models and meteorological records of a network of stations in the plot. Thermal stress was higher in deer than in sheep, with less differences between species in summer. Deer travelled more distance than sheep, and both species travelled more in summer than in winter; deer travel distance showed less seasonal differences than sheep. Animal movement was better predicted in deer than in sheep and in winter than in summer; both species showed a swarming behaviour in group cohesion, stronger in deer. At shorter separation distances swarming repulsion was stronger between species than within species. At longer separation distances inter-specific attraction was weaker than intra-specific; there was a positive density-dependent effect on swarming, and stronger in deer than in sheep. There was not clear evidence which species attracted or repelled the other; attraction between deer at long separation distances was stronger when the model accounted for thermal stress, but in general the dynamic movement behaviour was hardly affected by the thermal stress. Vegetation type affected intra-species interactions but had little effect on inter-species interactions. Our modelling approach is useful in interpreting animal interactions, in order to unravel complex cooperative or competitive behaviours, and to the best of our knowledge is the first modelling attempt to make predictions of multi-species animal movement under different habitat mosaics and abiotic environmental conditions.  2015 Prez-Barbera et al. This is an open access article distributed under the terms of the Creative Commons Attribution License, which permits unrestricted use, distribution, and reproduction in any medium, provided the original author and source are credited.",1,"MA353","","","",""
"Seymour2018343","The microbiology of seagrasses","Seymour, J.R. and Laverock, B. and Nielsen, D.A. and Trevathan-Tackett, S.M. and Macreadie, P.I.","Seagrasses of Australia: Structure, Ecology and Conservation",NA,NA,"343-392",2018,"10.1007/978-3-319-71354-0_12","Like both terrestrial plants and other benthic marine organisms, seagrasses host abundant and diverse communities of microorganisms. These microbes fundamentally influence seagrass physiology and health, while also regulating the biogeochemical dynamics of entire seagrass meadows. Discrete populations of bacteria, fungi, microalgae, archaea and viruses inhabit seagrass leaves, roots and rhizomes and the surrounding sediments. The plethora of ecological interactions taking place between seagrasses and this microbiome span the continuum of symbiotic relationships from mutualism to parasitism. Indeed, the metabolic activities of some seagrass associated microbes, such as diazotrophic and sulphur oxidizing bacteria, govern the local chemical environment in ways that facilitate seagrass survival. On the other hand, pathogens, such as the protozoan parasite Labyrinthula cause disease outbreaks that can lead to mass seagrass die offs. While the role of the seagrass microbiome in defining the success of seagrass habitats is becoming increasingly apparent, there is still much to be learnt. For instance, the development of an understanding of how seagrass associated microbes may buffer or augment the negative impacts of growing environmental pressures will be valuable for informing decisions regarding the management and conservation of threatened seagrass habitats. In this chapter we will synthesise the current state of knowledge on the microbiology of seagrasses, with a goal of conveying the often overlooked importance of the seagrass microbiome in governing seagrass health and the biogeochemical stability of seagrass ecosystems.  Springer International Publishing AG, part of Springer Nature 2018.",1,"MA380","","","",""
"X.ISI.000295426600002","The social network structure of a wild meerkat population: 3. Position of individuals within networks","Madden, J. R. and Drewe, J. A. and Pearce, G. P. and Clutton-Brock, T. H.","BEHAVIORAL ECOLOGY AND SOCIOBIOLOGY",65,"10","1857-1871",2011,"10.1007/s00265-011-1194-2","Individuals in social groups interact with numerous other group members in a polyadic network. Interactions can depend on the individual's own attributes (age, sex, status etc.), on their partner's attributes, and the group's network of social interactions. Previous studies tend to look at a subset of dyadic interactions, focusing on particular classes of individuals. We used social network analysis to explore how an individual wild meerkat's (Suricata suricatta) attributes related to their positions in three different interaction networks (grooming, dominance interactions, and foraging competitions) across eight groups. We asked whether individuals within groups associated assortatively and whether individuals with similar attributes occupied similar network positions. Differences in an individual's attributes did not consistently influence association patterns across different interaction network types. However, within network types, some attributes were especially influential across all groups. Grooming networks revealed negative assortativity by age and mass. Dominance networks revealed dominant subordinate associations and high assortativity between males. Dominant individuals exhibited higher levels of dominance interactions and were aggressive to more different individuals than subordinates. Heavier individuals received higher levels of dominance interactions. Foraging competition networks revealed that younger and lighter individuals received higher overall levels of competitions and from more group members. Our observations were similar to focused studies on dyadic interactions but also revealed subtle differences. Future descriptions of social interactions should account for networks of social interactions occurring within a group and should be cautious about treating individuals with similar attributes as functionally similar with respect to their position within a social network.",1,"MA387","","","",""
"Witek2014307","Myrmica ants host highly diverse parasitic communities: from social parasites to microbes","Witek, M. and Barbero, F. and Mark, B.","Insectes Sociaux",61,"4","307-323",2014,"10.1007/s00040-014-0362-6","Myrmica ants have been model species for studies in a variety of disciplines, including insect physiology, chemical communication, ant social dynamics, ant population, community ecology, and ant interactions with other organisms. Species belonging to the genus Myrmica can be found in virtually every habitat within the temperate regions of the northern hemisphere and their biology and systematics have been thoroughly studied. These ants serve as hosts to highly diverse parasitic organisms from socially parasitic butterfly caterpillars to microbes, and many Myrmica species even evolved into parasitizing species of their own genus. These parasites have various impacts both on the individuals and on the social structure of their hosts, ranging from morphological malformations to reduction in colony fitness. A comprehensive review of the parasitic organisms supported by Myrmica and the effects of these organisms on individuals and on whole ant colonies has not yet been compiled. Here, we provide a review of the interactions of these organisms with Myrmica ants by discussing host and parasite functional, behavioral or physiological adaptations. In addition, for all symbiont groups of Myrmica ants described in this paper, we examine the present limitations of the knowledge at present of their impact on individuals and host colony fitness. In conclusion, we argue that Myrmica ants serve as remarkable resource for the evolution of a wide variety of associated organisms.  2014, International Union for the Study of Social Insects (IUSSI).",1,"MA254","","","",""
"X.ISI.000366731500010","Male monkeys fight in between-group conflicts as protective parents and reluctant recruits","Arseneau, T. Jean M. and Taucher, Anouk-Lisa and van Schaik, Carel P. and Willems, Erik P.","ANIMAL BEHAVIOUR",110,NA,"39-50",2015,"10.1016/j.anbehav.2015.09.006","In many social species, group members cooperate to defend a communal home range. Fighting in between-group conflicts carries an opportunity cost, a risk of injury or death, and the possibility of exploitation by free-riding group members. As a result, it is rare that all group members fight in a given between-group conflict, and individual participation in range defence is often highly variable. Thus, to understand the patterns of behaviour observed at the group level, we must first understand the causes of within- and between-individual variability. Although sex differences have been well studied, our understanding of the relative importance of the various mechanisms promoting between-group aggression within a sex is limited. We observed the participation of 22 male vervet monkeys, Chlorocebus aethiops pygerythrus, in 126 between-group conflicts, and then partitioned aggressive acts according to the context in which they occurred. Using this approach, we found evidence that two mechanisms drive male between-group aggression and, therefore, that individual variability is in part driven by the multiple selective benefits of participation. First, males that were likely to have sired offspring tended to exhibit defensive aggression and were more active when infants were present in the group, suggesting they fight to defend probable offspring. Second, males were more likely to support females in initiating between-group aggression just prior to, and during, the mating season. Female vervet monkeys are able to exert female choice, and males that frequently supported female instigators tended to enjoy the highest mating success. These results indicate that males probably use between-group aggression to improve their reputation with choosy females and subsequently maximize their mating success. Our findings indicate that a greater understanding of the evolutionary mechanisms promoting cooperative home range defence can be gained if we consider the context in which acts of between-group aggression occur. (C) 2015 The Association for the Study of Animal Behaviour. Published by Elsevier Ltd. All rights reserved.",2,"MA235","","","",""
"Nicolis20072387","Kinetics of aggregate formation in social insects","Nicolis, S.C.","Bulletin of Mathematical Biology",69,"7","2387-2403",2007,"10.1007/s11538-007-9224-y","A model for the kinetics of aggregation in social insects which accounts for stochastic effects arising from individual variability and covers both the early and the mature stages of the process is developed. Different aggregation scenarios are studied, depending on the degree of cooperativity and the mean population density. It is shown that under certain conditions, the system evolves slowly to a single cluster incorporating all individuals, or to two coexisting clusters of similar sizes.  2007 Society for Mathematical Biology.",2,"MA227","","","",""
"Ernst201795","Individual and genetic task specialization in policing behaviour in the European honeybee","Ernst, U.R. and Cardoen, D. and Cornette, V. and Ratnieks, F.L.W. and de Graaf, D.C. and Schoofs, L. and Verleyen, P. and Wenseleers, T.","Animal Behaviour",128,NA,"95-102",2017,"10.1016/j.anbehav.2017.04.005","Cooperation in biological systems is frequently maintained by social enforcement mechanisms, where individually egoistic and group-costly behaviour is mutually suppressed by other group members. One of the best examples in nature is worker policing in the honeybee, Apis mellifera, where workers selectively remove or police eggs laid by workers that egoistically try to produce their own offspring instead of working for the good of the colony. It has long been suggested that worker policing behaviour should be genetically determined, as theory has shown that queen polyandry in the honeybee would be expected to give rise to clear indirect genetic or inclusive fitness benefits of worker policing, thereby causing genes for policing to spread in the population. In the present study, we tested the theory that worker policing should have a genetic component by determining whether workers belonging to different patrilines, derived from different fathers, differ in their tendency to police eggs. This analysis showed that variation in policing behaviour indeed has a genetic basis, with the trait having an estimated broad-sense heritability of 0.25 ([0.0130.46] 95% confidence limits). In addition, there was clear individual specialization in policing, as just a few individuals within each patriline were observed to police. Remarkably though, there was no evidence for age specialization, as workers of all ages, except those younger than 10 days and older than ca. 40 days, engaged in policing. This contrasts with most other behaviours in the honeybee, which usually follow a strict age-linked pattern of division of labour. Overall, we conclude that worker policing behaviour in the honeybee is genetically heritable and that workers of all ages engage in policing to help maintain the social order in the colony.  2017 The Association for the Study of Animal Behaviour",1,"MA197","","","",""
