"X.ISI.000295521600026","POLYANDRY REDUCES SPERM LENGTH VARIATION IN SOCIAL INSECTS","Fitzpatrick, John L. and Baer, Boris","EVOLUTION",65,"10","3006-3012",2011,"10.1111/j.1558-5646.2011.01343.x","Postcopulatory sexual selection, either in the form of sperm competition or cryptic female choice, is an important selective force that is thought to have generated the enormous variation in sperm morphology observed interspecifically. However, the evolutionary significance of intraspecific variation in sperm morphology, and the role that postcopulatory sexual selection plays in influencing this variation, remains poorly investigated in invertebrates. Here, we tested the hypothesis that postcopulatory sexual selection reduces variation in sperm morphology, both between and within males, in 27 species of eusocial ants and bees. These eusocial species offer an unusual opportunity to assess how selection acts on variance in sperm morphology, as haploid males produce clonal, haploid sperm that does not experience haploid-diploid conflict. We provide solid evidence that males of polyandrous ant and bee species indeed produce less-variable sperm, indicating that sperm competition selected for sperm of superior quality. Our results offer a mechanistic explanation for the evolution of high-quality sperm and provide comprehensive evidence that sperm morphology of social insects is influenced by sexual selection.",1,"MA288","","","",""
"Schuppe2016673","The social context of a territorial dispute differentially influences the way individuals in breeding pairs coordinate their aggressive tactics","Schuppe, E.R. and Sanin, G.D. and Fuxjager, M.J.","Behavioral Ecology and Sociobiology",70,"5","673-682",2016,"10.1007/s00265-016-2088-0","Abstract: In diverse species, individuals coordinate behavior to accomplish shared goals or tasks. Such coordination, however, often occurs selectively, and the contextual information animals use to determine when they coordinate and when they do not is unclear. We investigate this issue in the highly territorial downy woodpecker (Picoides pubescens) by exploring how individuals within a social breeding pair differentially modulate coordinated aggressive responses during graded simulated territorial intrusions (STIs). Analyses show that resident pairs mount a more robust aggressive response to STIs that represent a greater threat. Moreover, in this social context, pair members produce contact vocalizations in a way that predicts their partners aggressive behavior. We also show that, when presented with a low threat, individuals that first respond to intrusions decrease their aggressive output once their partner attends to the stimulus; the partner, in turn, increases their levels of aggressive behavior. This does not occur in high-threat STIs, where both partners maintain high levels of aggression throughout the entire encounter. Together, these results show that individuals within a pair flexibly adjust their aggressive tactics in response to different social competitive contexts, and this includes adjusting the way in which individuals coordinate certain aspects of their agonistic repertoire. We speculate that this ability reflects an adaptive mechanism that allows individuals to fine-tune territorial tactics to reduce overall costs of aggression. Significance statement: Although research has demonstrated that individuals often coordinate their behavior to accomplish common tasks, little is known about the factors that determine when such coordination occurs and when it does not. We address this issue for the first time in the highly territorial downy woodpecker by testing how the level of threat associated with a territorial interaction influences the coordination of defensive behavior. We find that, when facing intruders that pose a greater threat, residents adjust levels of aggressive output in response to the number of vocalizations produced by their breeding partner. By contrast, this relationship is not observed when pairs face intruders that pose a relatively lower threat. Our data therefore provide striking evidence that coordination in defensive tactics depends on the residents appraisal of the social context, such that fiercer competition is associated with greater behavioral coordination.  2016, Springer-Verlag Berlin Heidelberg.",2,"MA386","","","",""
"Heath2018E21","Adaptive divergence in a defense symbiosis driven from the top down","Heath, J.J. and Abbot, P. and Stireman, J.O., III","American Naturalist",192,"1","E21-E36",2018,"10.1086/697446","Most studies of adaptive radiation in animals focus on resource competition as the primary driver of trait divergence. The roles of other ecological interactions in shaping divergent phenotypes during such radiations have received less attention. We evaluate natural enemies as primary agents of diversifying selection on the phenotypes of an actively diverging lineage of gall midges on tall goldenrod. In this system, the gall of the midge consists of a biotrophic fungal symbiont that develops on host-plant leaves and forms distinctly variable protective carapaces over midge larvae. Through field studies, we show that fungal gall morphology, which is induced by midges (i.e., it is an extended phenotype), is under directional and diversifying selection by parasitoid enemies. Overall, natural enemies disruptively select for either small or large galls, mainly along the axis of gall thickness. These results imply that predators are driving the evolution of phenotypic diversity in symbiotic defense traits in this system and that divergence in defensive morphology may provide ecological opportunities that help to fuel the adaptive radiation of this genus of midges on goldenrods. This enemy-driven phenotypic divergence in a diversifying lineage illustrates the potential importance of consumerresource and symbiotic species interactions in adaptive radiation.  2018 by The University of Chicago. All rights reserved.",2,"MA10","","","",""
"X.ISI.000249981500002","Models of density-dependent genic selection and a new rock-paper-scissors social system","Sinervo, Barry and Heulin, Benoit and Surget-Groba, Yann and Clobert, Jean and Miles, Donald B. and Corl, Ammon and Chaine, Alexis and Davis, Alison","AMERICAN NATURALIST",170,"5","663-680",2007,"10.1086/522092","We describe new ESS models of density regulation driven by genic selection to explain the cyclical dynamics of a social system that exhibits a rock-paper-scissors (RPS) set of three alternative strategies. We tracked changes in morph frequency and fitness of Lacerta vivipara and found conspicuous RPS cycles. Morphs of Uta and Lacerta exhibited parallel survival-performance trade-offs. Frequency cycles in both species of lizards are driven by genic selection. In Lacerta, frequency of each allele in adult cohorts had significant impacts on juvenile recruitment, similar to mutualistic, altruistic, and antagonistic relations of RPS alleles in Uta. We constructed evolutionarily stable strategy (ESS) models in which adults impact juvenile recruitment as a function of self versus nonself color recognition. ESS models suggest that the rapid 4-year RPS cycles exhibited by Lacerta are not possible unless three factors are present: behaviors evolve that discriminate self versus nonself morphs at higher rates than random, self- versus non-self-recognition contributes to density regulation, and context-dependent mate choice evolves in females, which choose sire genotypes to enhance progeny survival. We suggest genic selection coupled to density regulation is widespread and thus fundamental to theories of social system evolution as well as theories of population regulation in diverse animal taxa.",1,"MA246","","","",""
"Fernndez.Gonzlez20181","High diversity and low genetic structure of feather mites associated with a phenotypically variable bird host","Fernndez-Gonzlez, S. and Prez-Rodrguez, A. and Proctor, H.C. and De la Hera, I. and Prez-Tris, J.","Parasitology",NA,NA,"01-Aug",2018,"10.1017/S0031182017002360","Obligate symbionts may be genetically structured among host individuals and among phenotypically distinct host populations. Such processes may in turn determine within-host genetic diversity of symbionts, which is relevant for understanding symbiont population dynamics. We analysed the population genetic structure of two species of feather mites (Proctophyllodes sylviae and Trouessartia bifurcata) in migratory and resident blackcaps Sylvia atricapilla that winter sympatrically. Resident and migratory hosts may provide mites with habitats of different qualities, what might promote specialization of mite populations. We found high genetic diversity of within-host populations for both mite species, but no sign of genetic structure of mites between migratory and resident hosts. Our results suggest that, although dispersal mechanisms between hosts during the non-breeding season are unclear, mite populations are not limited by transmission bottlenecks that would reduce genetic diversity among individuals that share a host. Additionally, there is no evidence that host phenotypic divergence (associated with the evolution of migration and residency) has promoted the evolution of host-specialist mite populations. Unrestricted dispersal among host types may allow symbiotic organisms to avoid inbreeding and to persist in the face of habitat heterogeneity in phenotypically diverse host populations. Copyright  Cambridge University Press 2018",1,"MA178","","","",""
"X.ISI.000428366200003","Interindividual patterns of resource use in three subtropical Atlantic Forest frogs","Carvalho-Rocha, Vitor and Lopes, Benedito Cortes and Neckel-Oliveira, Selvino","AUSTRAL ECOLOGY",43,"2","150-158",2018,"10.1111/aec.12552","Studies with disparate taxa suggest that generalist populations are composed of relatively specialist individuals that use a narrow part of a population's resource pool. Models based on optimum diet theory (ODT) can be used to predict different patterns of variation in resource use among individuals. In this work, we investigated the diet and measured the degree of individual specialization of three anuran species, Hypsiboas leptolineatus, Pseudis cardosoi and Scinax granulatus, from the Atlantic Forest of southern Brazil. The study is based on gut content obtained using a stomach-flushing technique. Additionally, we tested for a correlation between the individuals' diet and morphological variation. Furthermore, we applied methods based on network theory to investigate patterns of resource use among individuals of each species. All three study species showed generalized diets and significant values of individual specialization. However, we did not find any correlation between diet and morphology, indicating that diet variation is not a consequence of morphological trade-offs. The individual-resource networks of H.leptolineatus and S.granulatus showed a nested pattern. This result indicates the presence of individuals with more diverse diets than others, and the diets of the more specialist individuals are a predictable subset of the diets of the more generalist ones. The individual-resource network of P.cardosoi did not show a distinct pattern, diverging from what was predicted by optimal diet theory-based models. Although nested or modular patterns are commonly found in individual-resource networks, our results indicate that they are not ubiquitous and that random patterns can also be found.",1,"MA213","","","",""
"X.ISI.000223916200013","Complex social behaviour can select for variability in visual features: a case study in Polistes wasps","Tibbetts, EA","PROCEEDINGS OF THE ROYAL SOCIETY B-BIOLOGICAL SCIENCES",271,"1551","1955-1960",2004,"10.1098/rspb.2004.2784","The ability to recognize individuals is common in animals; however, we know little about why the phenotypic variability necessary for individual recognition has evolved in some animals but not others. One possibility is that natural selection favours variability in some social contexts but not in others. Polistes fuscatus wasps have variable facial and abdominal markings used for individual recognition within their complex societies. Here, I explore whether social behaviour can select for variability by examining the relationship between social behaviour and variability in visual features (marking variability) across social wasp taxa. Analysis using a concentrated changes test demonstrates that marking variability is significantly associated with nesting strategy. Species with flexible nest-founding strategies have highly variable markings, whereas species without flexible nest-founding strategies have low marking variability. These results suggest that: (i) individual recognition may be widespread in the social wasps, and (ii) natural selection may play a role in the origin and maintenance of the variable distinctive markings. Theoretical and empirical evidence suggests that species with flexible nesting strategies have reproductive transactions, a type of complex social behaviour predicted to require individual recognition. Therefore, the reproductive transactions of flexible species may select for highly variable individuals who are easy to identify as individuals. Further, selection for distinctiveness may provide an alternative explanation for the evolution of phenotypic diversity.",1,"MA68","","","",""
"Kitchen20071551","Factors affecting individual participation in group-level aggression among non-human primates","Kitchen, D.M. and Beehner, J.C.","Behaviour",144,"12","1551-1581",2007,"10.1163/156853907782512074","Group members do not always act cohesively when facing extra-group rivals. When benefits such as group-defence are not monopolizable, it poses an economics problem: who should contribute to public goods and who should freeload? A collective action framework compliments existing theoretical explanations for cooperation, and provides testable hypotheses about group-level behaviour based on individual costs and benefits. Using this approach, we review research on intergroup encounters in non-human primates published over the last 20 years, focusing on participation by different classes of individuals. While food- and mate-defence explain much between-sex variation in participation, rank and reproductive access frequently explain within-sex variation. In some species, individuals may use intergroup interactions to survey potential transfer locations and mating options, which might coincidently intimidate rivals. Experimental evidence suggests that when intergroup dominance is based on relative number of fighters, individual participation still varies with sex, rank, companion behaviour and dependent offspring presence. Relatively few studies have examined how factors such as relationships within and between groups or individual temperament mediate aggression. Long-term studies of multiple habituated groups and methodological advances (e.g., playback experiments) will continue to improve our understanding of how complex group-level patterns are predictable when viewed from an individual perspective.  2007 Brill Academic Publishers.",2,"MA138","","","",""
"Rubio.Portillo201417","Eukarya associated with the stony coral Oculina patagonica from the Mediterranean Sea","Rubio-Portillo, E. and Souza-Egipsy, V. and Ascaso, C. and de los Rios Murillo, A. and Ramos-Espl, A.A. and Antn, J.","Marine Genomics",17,NA,"17-23",2014,"10.1016/j.margen.2014.06.002","Oculina patagonica is a putative alien scleractinian coral from the Southwest Atlantic that inhabits across the Mediterranean Sea. Here, we have addressed the diversity of Eukarya associated with this coral and its changes related to the environmental conditions and coral status. A total of 46 colonies of O. patagonica were taken from Alicante coast (Spain) and Pietra Ligure coast (Italy) and analyzed using denaturing gradient gel electrophoresis (DGGE) of the small-subunit 18S rRNA and 16S plastid rRNA genes, internal transcribed spacer region 2 (ITS 2) analyses, and electron microscopy. Our results show that Eukarya and plastid community associated to O. patagonica change with environmental conditions and coral status. Cryptic species, which can be difficult to identify by optical methods, were distinguished by 18S rRNA gene DGGE: the barnacle Megatrema anglicum, which was detected at two locations, and two boring sponges related to Cliona sp. and Siphonodictyon coralliphagum detected in samples from Tabarca and Alicante Harbour, respectively. Eukaryotic phototrophic community from the skeletal matrix of healthy corals was dominated by Ochrosphaera sp. while bleached corals from the Harbour and Tabarca were associated to different uncultured phototrophic organism. Differences in ultrastructural morphologies of the zooxanthellae between healthy and bleached corals were observed. Nevertheless, no differences were found in Symbiodinium community among time, environments, coral status and location, showing that O. patagonica hosted only one genotype of Symbiodinium belonging to clade B2. The fact that this clade has not been previously detected in other Mediterranean corals and is more frequent in the tropical Western Atlantic, is a new evidence that O. patagonica is an alien species in the Mediterranean Sea.  2014 Elsevier B.V.",1,"MA121","","","",""
"Okabe2012959","Regional collapse of symbiotic specificity between lucanid beetles and canestriniid mites","Okabe, K. and Masuya, H. and Kanzaki, N. and Taki, H.","Naturwissenschaften",99,"11","959-965",2012,"10.1007/s00114-012-0979-0","The intensity of interspecific interactions between hosts and symbionts varies among populations of each organism because of differences in the biotic and abiotic environment. We found geographic mosaics in associations between lucanid beetles (Dorcus rectus and Dorcus striatipennis) and symbiotic mites (Haitlingeria sp. and Sandrophela sp., respectively) that were caused by the collapse of host specificity in the northern part of Japan. Haitlingeria sp. was only collected from the surface of the exoskeleton ofD. rectus in south and central Japan. Sandrophela sp. showed host specificity in southern to central Japan but was found on both beetle species in areas where Haitlingeria sp. was not found. Because Haitlingeria sp. was able to reproduce on D. rectus collected from Haitlingeria-free regions and no significant differences were observed in average temperature between the hostspecific and nonspecific regions bordering on each other, we suggest that the expansion of Haitlingeria sp. in the north has been limited for unknown reasons. When both mites were placed together on D. rectus, only Haitlingeria sp. reproduced, probably because it killed Sandrophela sp., especially juveniles. Thus, we conclude that Sandrophela sp. has expanded its host use to include D. rectus in areas where Haitlingeria sp. is absent. We hypothesise that false host specificity in the canestriniids has been maintained by habitat isolation and/or aggressive behaviour toward competitors.We suggest that host-specific canestriniids provide benefits to hosts that do not develop countermeasures to exclude microor macroparasites from their surfaces.  Springer-Verlag Berlin Heidelberg 2012.",1,"MA303","","","",""
"Freeman2014","Metabolic diversity and niche structure in sponges from the Miskito Cays, Honduras","Freeman, C.J. and Easson, C.G. and Baker, D.M.","PeerJ",2014,"12",NA,2014,"10.7717/peerj.695","Hosting symbionts provides many eukaryotes with access to the products of microbial metabolism that are crucial for host performance. On tropical coral reefs, many (High Microbial Abundance [HMA]) but not all (Low Microbial Abundance [LMA]) marine sponges host abundant symbiont communities. Although recent research has revealed substantial variation in these sponge-microbe associations (termed holobionts), little is known about the ecological implications of this diversity. We investigated the expansion of diverse sponge species across isotopic niche space by calculating niche size (as standard ellipse area [SEA<inf>c</inf>]) and assessing the relative placement of common sponge species in bivariate (13C and 15N) plots. Sponges for this study were collected from the relatively isolated reefs within the Miskito Cays of Honduras. These reefs support diverse communities of HMA and LMA species that together span a gradient of photosymbiont abundance, as revealed by chlorophyll a analysis. HMA sponges occupied unique niche space compared to LMA species, but the placement of some HMA sponges was driven by photosymbiont abundance. In addition, photosymbiont abundance explained a significant portion of the variation in isotope values, suggesting that access to autotrophic metabolism provided by photosymbionts is an important predictor in the location of species within isotopic space. Host identity accounted for over 70% of the variation in isotope values within the Miskito Cays and there was substantial variation in the placement of individual species within isotopic niche space, suggesting that holobiont metabolic diversity may allow taxonomically diverse sponge species to utilize unique sources of nutrients within a reef system. This study provides initial evidence that microbial symbionts allow sponges to expand into novel physiochemical niche space. This expansion may reduce competitive interactions within coral reefs and promote diversification of these communities.  2014 Freeman et al.",1,"MA242","","","",""
"Evans2006","Antagonistic interactions between honey bee bacterial symbionts and implications for disease","Evans, J.D. and Armstrong, T.-N.","BMC Ecology",6,NA,NA,2006,"10.1186/1472-6785-6-4","Background: Honey bees, Apis mellifera, face many parasites and pathogens and consequently rely on a diverse set of individual and group-level defenses to prevent disease. One route by which honey bees and other insects might combat disease is through the shielding effects of their microbial symbionts. Bees carry a diverse assemblage of bacteria, very few of which appear to be pathogenic. Here we explore the inhibitory effects of these resident bacteria against the primary bacterial pathogen of honey bees, Paenibacillus larvae. Results: Here we isolate, culture, and describe by 16S rRNA and protein-coding gene sequences 61 bacterial isolates from honey bee larvae, reflecting a total of 43 distinct bacterial taxa. We culture these bacteria alongside the primary larval pathogen of honey bees, Paenibacillus larvae, and show that many of these isolates severely inhibit the growth of this pathogen. Accordingly, symbiotic bacteria including those described here are plausible natural antagonists toward this widespread pathogen. Conclusion: The results suggest a tradeoff in social insect colonies between the maintenance of potentially beneficial bacterial symbionts and deterrence at the individual and colony level of pathogenic species. They also provide a novel mechanism for recently described social components behind disease resistance in insect colonies, and point toward a potential control strategy for an important bee disease.  2006 Evans and Armstrong; licensee BioMed Central Ltd.",1,"MA20","","","",""
"Estrela20161415","Private benefits and metabolic conflicts shape the emergence of microbial interdependencies","Estrela, S. and Morris, J.J. and Kerr, B.","Environmental Microbiology",18,"5","1415-1427",2016,"10.1111/1462-2920.13028","Microbes perform many costly biological functions that benefit themselves, and may also benefit neighbouring cells. Losing the ability to perform such functions can be advantageous due to cost savings, but when they are essential for growth, organisms become dependent on ecological partners to compensate for those losses. When multiple functions may be lost, the ecological outcomes are potentially diverse, including independent organisms only; one-way dependency, where one partner performs all functions and others none; or mutual interdependency where partners perform complementary essential functions. What drives these different outcomes? We develop a model where organisms perform 'leaky' functions that provide both private and public benefits to explore the consequences of privatization level, costs and essentiality on influencing these outcomes. We show that mutual interdependency is favoured at intermediate levels of privatization for a broad range of conditions. One-way dependency, in contrast, is only favoured when privatization is low and loss-of-function benefits are accelerating. Our results suggest an interplay between privatization level and shape of benefits from loss in driving microbial dependencies. Given the ubiquity of microbial functions that are inevitably leaked and the ease of mutational inactivation, our findings may help to explain why microbial interdependencies are common in nature.  2016 Society for Applied Microbiology and John Wiley & Sons Ltd.",1,"MA294","","","",""
