"Koch20121202","Ecological effects on gut bacterial communities in wild bumblebee colonies","Koch, H. and Cisarovsky, G. and Schmid-Hempel, P.","Journal of Animal Ecology",81,"6","1202-1210",2012,"10.1111/j.1365-2656.2012.02004.x","1.Animal hosts harbour diverse and often specific bacterial communities (microbiota) in their gut. These microbiota can provide crucial services to the host such as aiding in digestion of food and immune defence. However, the ecological factors correlating with and eventually shaping these microbiota under natural conditions are poorly understood. 2.Bumblebees have recently been shown to possess simple and highly specific microbiota. We here examine the dynamics of these microbiota in field colonies of the bumblebee Bombus terrestris over one season. The gut bacteria were assessed with culture-independent methods, that is, with terminal restriction fragment length profiles of the 16S rRNA gene. 3.To further understand the factors that affect the microbiota, we experimentally manipulated field-placed colonies in a fully factorial experiment by providing additional food or by priming the workers' immune system by injecting heat-killed bacteria. We furthermore looked at possible correlates of diversity and composition of the microbiota for (i) natural infections with the microbial parasites Crithidia bombi and Nosema bombi, (ii) bumblebee worker size, (iii) colony identity, and (iv) colony age. 4.We found an increase in diversity of the microbiota in individuals naturally infected with either C. bombi or N. bombi. Crithidia bombi infections, however, appear to be only indirectly linked with higher microbial diversity when comparing colonies. The treatments of priming the immune system with heat-killed bacteria and additional food supply, as well as host body size, had no effect on the diversity or composition of the microbiota. Host colony identity had only a weak effect on the composition of the microbiota at the level of resolution of our method. We found both significant increases and decreases in the relative abundance of selected bacterial taxa over the season. 5.We present the first study on the ecological dynamics of gut microbiota in bumblebees and identify parasite infections, colony identity and colony age as important factors influencing the diversity and composition of the bacterial communities. The absence of an effect of our otherwise effective experimental treatments suggests a remarkable ability of the host to maintain a homoeostasis in this community under widely different environments.  2012 British Ecological Society.",2,"MA111","","","",""
"Eriksson2019283","Intraspecific variation in colony founding behavior and social organization in the honey ant Myrmecocystus mendax","Eriksson, T.H. and Hlldobler, B. and Taylor, J.E. and Gadau, J.","Insectes Sociaux",66,"2","283-297",2019,"10.1007/s00040-019-00687-y","Persistent cooperation between unrelated reproductives occurs rarely in mature eusocial insect societies, and when present, is frequently geographically constrained. Here we present genetic and behavioral evidence showing that primary polygyny occurs in some, but not all populations of the honey ant Myrmecocystus mendax. Specifically, we found that all mature colonies sampled in a population in the Sierra Ancha Mountains of central Arizona (USA) were polygynous with a relatively high number of queens (average = 6.27), while the majority of mature colonies sampled in the Chiricahua Mountains of southeastern Arizona were monogynous. Field and laboratory observations showed that Chiricahua foundresses are primarily haplometrotic, whereas Sierra Ancha foundresses can be either haplometrotic or facultatively pleometrotic. Nestmate relatedness of mature Sierra Ancha field colonies suggests that the reproductive individuals within these colonies are unrelated, consistent with primary polygyny. In the laboratory, Sierra Ancha foundresses cooperatively established incipient colonies without queen reduction, and colonies with multiple queens produced more minims andworkers that may serve the role ofrepletes (honeypots) than haplometrotic colonies. This was in stark contrast to foundresses from the Chiricahua population, which showed strong aggression when forced to found colonies together in the laboratory. When brood raiding was experimentally induced between laboratory Sierra Ancha colonies, queens from colonies with more workers had a higher survival probability, although in some cases the competing colonies fused and queens from both colonies continued to reproduce. Fusion between incipient ant colonies is a rare phenomenon, but could contribute to the high frequency of polygyny and high queen number in mature colonies in the Sierra Ancha population.  2019, International Union for the Study of Social Insects (IUSSI).",1,"MA223","","","",""
"Ros2007239","Spider mite (Acari: Tetranychidae) mitochondrial COI phylogeny reviewed: Host plant relationships, phylogeography, reproductive parasites and barcoding","Ros, V.I.D. and Breeuwer, J.A.J.","Experimental and Applied Acarology",42,"4","239-262",2007,"10.1007/s10493-007-9092-z","The past 15 years have witnessed a number of molecular studies that aimed to resolve issues of species delineation and phylogeny of mites in the family Tetranychidae. The central part of the mitochondrial COI region has frequently been used for investigating intra- and interspecific variation. All these studies combined yield an extensive database of sequence information of the family Tetranychidae. We assembled this information in a single alignment and performed an overall phylogenetic analysis. The resulting phylogeny shows that important patterns have been overlooked in previous studies, whereas others disappear. It also reveals that mistakes were made in submitting the data to GenBank, which further disturbed interpretation of the data. Our total analysis clearly shows three clades that most likely correspond to the species T. urticae, T. kanzawai and T. truncatus. Intraspecific variation is very high, possibly due to selective sweeps caused by reproductive parasites. We found no evidence for host plant associations and phylogeographic patterns in T. urticae are absent. Finally we evaluate the application of DNA barcoding.  2007 Springer Science+Business Media B.V.",1,"MA349","","","",""
"X.ISI.000404318100016","Hormonal underpinnings of status conflict: Testosterone and cortisol are related to decisions and satisfaction in the hawk-dove game","Mehta, Pranjal H. and DesJardins, Nicole M. Lawless and van Vugt, Mark and Josephs, Robert A.","HORMONES AND BEHAVIOR",92,"SI","141-154",2017,"10.1016/j.yhbeh.2017.03.009","A contribution to a special issue on Hormones and Human Competition. Testosterone is theorized to influence status-seeking behaviors such as social dominance and competitive behavior, but supporting evidence is mixed. The present study tested the roles of testosterone and cortisol in the hawk dove game, a dyadic economic decision-making paradigm in which earnings depend on one's own and the other player's choices. If one person selects the hawk strategy and the other person selects the dove strategy, the player who selected hawk attains a greater financial pay-off (status differentiation). The worst financial outcome occurs when both players choose the hawk strategy (status confrontation). Ninety-eight undergraduate students (42 men) provided saliva samples and played ten rounds of the hawk-dove game with another same-sex participant. In support of the hypothesis that testosterone is related to status concern, individuals higher in basal testosterone made more hawk decisions decisions that harmed the other player. Acute decreases in cortisol were also associated with more hawk decisions. There was some empirical support for the dual-hormone hypothesis as well: basal testosterone was positively related to satisfaction in the game among low basal-cortisol individuals but not among high basal-cortisol individuals. There were no significant sex differences in these hormonal effects. The present findings align with theories of hormones and status-seeking behavior at the individual level, but they also open up new avenues for research on hormone profiles at the collective level. Our results suggest that the presence of two or more high-testosterone members increases the likelihood of status confrontations over a limited resource that can undermine collective outcomes. (C) 2017 Elsevier Inc. All rights reserved.",1,"MA180","","","",""
"Seddon200372","Communal singing in the cooperatively breeding subdesert mesite Monias benschi: Evidence of numerical assessment?","Seddon, N. and Tobias, J.A.","Journal of Avian Biology",34,"1","72-80",2003,"10.1034/j.1600-048X.2003.03067.x","It has long been suggested that competing groups of social animals assess one another on the basis of communal vocalisations, but so far this has only been demonstrated in mammals. We investigated this idea in the subdesert mesite, a group-living bird that produces communal songs during aggressive territorial interactions with other groups. Where groups compete as units, differences in group size might outweigh inter-individual differences in determining the outcome of contests. Given this species' variable social system, we predicted that the composition of groups would also influence their resource holding potential. Playback experiments showed that the number of simulated intruders significantly influenced the strength of response by defending groups hearing the stimulus: groups were less likely to approach but gave more protracted and more communal vocal responses as the number of vocalising intruders increased. We found that the likelihood of a group approaching playback increased as the ratio between the number of males in the defending group and the number of males in the intruding group increased. Furthermore, the ratio of adult males to females in the defending group significantly affected the probability of approach, with the probability increasing as groups became more male-biased. This finding supports the idea that the social structure of groups may be important in determining the outcome of contests between groups. Overall this study provides some indication in birds of relative numerical assessment based on vocal cues.",1,"MA55","","","",""
"X.ISI.000261034400009","The oldest fossil evidence of animal parasitism by fungi supports a Cretaceous diversification of fungal-arthropod symbioses","Sung, Gi-Ho and Poinar, Jr., George O. and Spatafora, Joseph W.","MOLECULAR PHYLOGENETICS AND EVOLUTION",49,"2","495-502",2008,"10.1016/j.ympev.2008.08.028","Paleoophiocordyceps coccophagus, a fungal parasite of a scale insect from the Early Cretaceous (Upper Albian), is reported and described here. This fossil not only provides the oldest fossil evidence of animal parasitism by fungi but also contains morphological features similar to asexual states of Hirsutella and Hymenostilbe of the extant genus Ophiocordyceps (Ophiocordycipitaceae, Hypocreales, Sordariomycetes, Pezizomycotina, Ascomycota). Because species of Hypocreales collectively exhibit a broad range of nutritional modes and symbioses involving plants, animals and other fungi, we conducted ancestral host reconstruction coupled with phylogenetic dating analyses calibrated with P. coccophagus. These results support a plant-based ancestral nutritional mode for Hypocreales, which then diversified ecologically through a dynamic process of intra- and interkingdom host shifts involving fungal, higher plant and animal hosts. This is especially evident in the families Cordycipitaceae, Clavicipitaceae and Ophiocordycipitaceae, which are characterized by a high occurrence of insect pathogens. The ancestral ecologies of Clavicipitaceae and Ophiocordycipitaceae are inferred to be animal pathogens, a trait inherited from a common ancestor, whereas the ancestral host affiliation of Cordycipitaceae was not resolved. Phylogenetic dating supports both a Jurassic origin of fungal-animal symbioses within Hypocreales and parallel diversification of all three insect pathogenic families during the Cretaceous, concurrent with the diversification of insects and angiosperms. Published by Elsevier Inc.",2,"MA383","","","",""
"X.ISI.000324508700003","Plant-animal mutualism in biological markets: Evolutionary and ecological dynamics driven by non-heritable phenotypic variance","Song, Zhiyuan and Feldman, Marcus W.","THEORETICAL POPULATION BIOLOGY",88,NA,"20-30",2013,"10.1016/j.tpb.2013.06.002","Mutualism between plants and animals, such as in pollination and seed dispersal, is a fundamental mechanism facilitating the productivity and biodiversity of ecosystems, and it is often considered as an analog of a free-market economy. The coevolution of plant reward and animal choosiness, however, involves an apparent paradox due to incomplete information and limited mutation rates: plant rewards evolve only when animals are choosy, but choosy animals purge the heritable variations of plants, which then favors less choosy animals. Here we use a two-species mathematical model to illustrate how non-heritable phenotypic variances of plants may facilitate the coevolution of rewards and choosiness and solve the paradox with low mutation rates. We simultaneously track the ecological and evolutionary dynamics and show that the population ratio links the two processes and tunes the stable ecoevolutionary equilibrium. Numerical simulations confirm the analytic prediction with varying mutation rates (heritable variance). The efficiency of a biological market is generally suboptimal due to the information constraint and individual competition. (C) 2013 Elsevier Inc. All rights reserved.",1,"MA284","","","",""
"Vuong2017540","Host species and environmental variation can influence rhizobial community composition","Vuong, H.B. and Thrall, P.H. and Barrett, L.G.","Journal of Ecology",105,"2","540-548",2017,"10.1111/1365-2745.12687","Nitrogen-fixing rhizobial mutualists display high levels of genetic and phenotypic diversity at multiple spatial scales. Identifying the ecological and environmental drivers of variation in the genetic composition and function of rhizobial communities is critical to understanding rhizobial impacts on community and ecosystem productivity. In this study, we examined how environmental factors and host species jointly affect rhizobial phenotypic diversity and community structure. Individual host plants of two native Australian legumes, Acacia salicina and A.stenophylla, were inoculated with a community of six rhizobial strains (belonging to three genera) previously characterized for symbiotic effectiveness. The plants were grown in a fully factorial experiment under high and low phosphorus and water, and high or no nitrogen. Half the plants were harvested after 19weeks and the other half after 30weeks. The relative abundance of the six rhizobial strains was characterized using amplicon sequencing of the rhizobial 16S rRNA gene from DNA extracted from the root nodules of plants after each harvest. Variation in the relative abundance of the six rhizobial strains was best explained by host species, although interactions between environment and host species also emerged as significant predictors of variation in rhizobial community composition. We detected strong host-specific interactions for two strains, while two other strains were clearly generalists, being relatively abundant in both host species. For both host species, the two generalist strains were as abundant as the best specialist strain within the rhizobial community. Synthesis. Our study show host species identity as the key determinant of rhizobial community structure within the root nodules of Acacia plants. Strains that were efficient at promoting the growth of their host plant had high relative abundance in experimental communities. Furthermore, interaction among host species, rhizobial host-range, and environmental variation determine the structure of rhizobial communities, although not in clearly predictable ways. Such interactions contributed to the maintenance (albeit at relatively low frequencies) of ineffective strains in nodule communities. These interacting effects could help to explain why rhizobial communities are functionally diverse, such that specialists, generalists and seemingly ineffective rhizobia, can be simultaneously maintained in rhizosphere communities.  2016 The Authors. Journal of Ecology  2016 British Ecological Society",1,"MA182","","","",""
"Singh2015971","Policing and punishment across the domains of social evolution","Singh, M. and Boomsma, J.J.","Oikos",124,"8","971-982",2015,"10.1111/oik.02064","Several decades of research in humans, other vertebrates, and social insects have offered fascinating insights into the dynamics of punishment (and its subset, policing), but authors have only rarely addressed whether there are fundamental joint principles underlying the maintenance of these behaviors. Here we present a punisher/bystander approach rooted in inclusive fitness logic to predict which individuals should take on punishing roles in animal societies. We apply our scheme to societies of eusocial Hymenoptera and nonhuman vertebrate social breeders, and we outline potential extensions for understanding conflict regulation among cells in metazoan bodies and unrelated individuals in human societies. We highlight that: 1) no social unit is expected to express punishment behavior unless it collects positive inclusive fitness benefits that surpass alternative benefits of bystanding; 2) punishment with public good benefits can be maintained through either direct fitness benefits (coercion) or indirect fitness benefits (correction) or both; 3) differences across social systems in the distributions of power, relatedness, and reproductive options drive variation in the extent to which individuals actively punish; and 4) inclusive fitness logic captures many punishment-relevant evolutionary and ecological variables in a single framework that appears to apply across very different types of social arrangements. Synthesis Researchers have long observed that individuals in animal societies punish (and by extension, police) each other, but they have rarely investigated whether general principles underlie this behavior across social arrangements. In this paper, we present a punisher/bystander approach rooted in inclusive fitness logic to predict which individuals should take on punisher roles in animal societies. We apply the approach to eusocial insects and cooperatively breeding vertebrates and outline extensions towards the control of cancer cell lineages and punishment in human groups. We highlight how variation in specific social variables may drive differences in punishing/policing across the social domains.  2015 The Authors.",2,"MA287","","","",""
"X.ISI.000330149600011","Cooperation promotes the evolution of separate sexes from hermaphrodites with unitary growth","Xu, Ying and Yang, Jiang-Nan","JOURNAL OF THEORETICAL BIOLOGY",341,NA,"102-110",2014,"10.1016/j.jtbi.2013.09.033","Most animals have specialized into separate sexes but most plants remain hermaphroditic. The underlining cause for this is still unclear. Here we address this question by evolutionary stable strategy analysis and exact calculation of frequency-dependent selection and genetic drift in geographically structured populations. Reproductive investments of hermaphrodites are divided into male and female functions, and each sex requires linear investments that increase linearly with successful gamete number and reusable investments (RIs) that increase less than linearly. Individuals specializing into one sex require RIs of only this sex and thus can produce more gametes. However, these gametes suffer strong kin competition as they are of the same sex and gamete number of the other sex decreases. The success of individuals specializing into one sex requires individuals specializing into the other sex to cooperate with them, providing them with more opposite-sex gametes and relaxing them of the same-sex competition. The evolution of this cooperation does not require two rare mutations to happen simultaneously at the same place, because single-sex mutants can sparsely spread in a hermaphroditic population with RIs despite genetic drift and wait for mutants of the other sex to arise. RI resembles fixed cost in previous theories. However, previous theories considered all costs except for costs for gametes as fixed costs and this does not capture an important plant-animal difference; modular growth of sexual organs in most plants and some animals promotes reproductive investments to increase linearly with offspring number, so their investments in sexual organs are linear investments rather than fixed costs. This study shows the evolution of separate sexes from hermaphrodites as an example of the evolution of cooperation and mutualism as in harmony games, and highlights modular growth as an important factor that prevents most plants and some animals from evolving into separate sexes. (C) 2013 Elsevier Ltd. All rights reserved.",2,"MA80","","","",""
"Koide2010297","Mycorrhizal symbiosis and plant reproduction","Koide, R.T.","Arbuscular Mycorrhizas: Physiology and Function",NA,NA,"297-320",2010,"10.1007/978-90-481-9489-6_14","Reproduction is an essential function of all organisms and, for many crop species, reproductive structures are the principle edible parts. Still, relatively little is known about the effects of the mycorrhizal symbiosis on host plant reproduction. Common limitations to reproduction include nutrient deficiency, herbivory and disease, and mycorrhizal fungi can influence each of these. Several aspects of sexual reproduction may be influenced by colonization of mycorrhizal fungi including the timing of reproductive events, the number of inflorescences per plant, the number of flowers per inflorescence, the amount of pollen per flower, the proportion of flowers producing fruits, and the number of seeds per fruit. Seed quality can also be strongly influenced by colonization of mycorrhizal fungi, resulting in variation in seedling vigor and resultant competitive ability. Because infection by mycorrhizal fungi can influence interactions among plants, it may lead to variation among individuals in their contributions to the next generation and, therefore, may control the genetic structures of populations and communities.  Springer Science+Business Media B.V. 2010.",1,"MA253","","","",""
"X.ISI.000392031600016","Sex differences in intrasexual aggression among sex-role-reversed, cooperatively breeding cichlid fish Julidochromis regani","Ito, Munehiko H. and Yamaguchi, Motoomi and Kutsukake, Nobuyuki","JOURNAL OF ETHOLOGY",35,"1","137-144",2017,"10.1007/s10164-016-0501-9","In sex-role-reversed species, females compete for resources (e.g., mates) more intensively than do males. However, it remains unclear whether these species exhibit sex differences in the intensity of aggressive behavior in the context of within-sex contests. Cichlid fish in the genus Julidochromis exhibit intraspecific variation in mating systems, ranging from monogamy to cooperative polyandry with sex-role reversal. In the study reported here, we observed aggressive interactions among three same-sex individuals in Julidochromis regani in the laboratory and tested whether inter-female aggression was more intense than inter-male aggression. Although difference in body size strongly determined the direction of aggression in fish, aggression by a smaller-sized individuals toward larger ones was occasionally observed. This type of aggression was common between individuals of a similar body size (<= 5 mm) and occurred more frequently among females than males. In contrast, differences in body size and sex did not affect the frequency of aggression by larger-sized individuals against smaller ones. Bidirectional aggression (i.e., mouth fighting) occurred frequently when two individuals had similar body size, and there was no difference in its frequency between sexes. However, temporal analysis showed that females performed bidirectional aggression more persistently than males. These sex differences in the intensity of intrasexual aggression could be the behavioral mechanisms underpinning cooperative polyandry.",1,"MA315","","","",""
"X.ISI.000458341800009","Spatial evolutionary dynamics produce a negative cooperation-population size relationship","Tekwa, Edward W. and Gonzalez, Andrew and Loreau, Michel","THEORETICAL POPULATION BIOLOGY",125,NA,"94-101",2019,"10.1016/j.tpb.2018.12.003","Natural selection can favour cooperation, but it is unclear when cooperative populations should be larger than less cooperative ones. While experiments have shown that cooperation can increase population size, cooperation and population size can become negatively correlated if spatial processes affect both variables in opposite directions. We use a simple mathematical model of spatial common-pool resource production to investigate how space affects the cooperation-population size relationship. We find that only cooperation that is sufficiently beneficial to neighbours increases population size. However, spatial clustering variations can create a negative cooperation-population relationship between populations even when cooperation is highly beneficial, because clustering selects for cooperation but decreases population size. Individual-based simulations with variable individual movement rates produced variation in spatial clustering and the hypothesized negative cooperation-population relationships. These results suggest that variation in spatial clustering can limit the size of evolutionarily stable cooperating populations - an ecological dilemma of cooperation. (C) 2018 Elsevier Inc. All rights reserved.",2,"MA345","","","",""
