"Blint2016797","Intraspecific differences in plant chemotype determine the structure of arthropod food webs","Blint, J. and Zytynska, S.E. and Salamon, R.V. and Mehrparvar, M. and Weisser, W.W. and Schmitz, O.J. and Benedek, K. and Balog, A.","Oecologia",180,"3","797-807",2016,"10.1007/s00442-015-3508-y","It is becoming increasingly appreciated that the structure and functioning of ecological food webs are controlled by the nature and level of plant chemicals. It is hypothesized that intraspecific variation in plant chemical resistance, in which individuals of a host-plant population exhibit genetic differences in their chemical contents (called plant chemotypes), may be an important determinant of variation in food web structure and functioning. We evaluated this hypothesis using field assessments and plant chemical assays in the tansy plant Tanacetum vulgare L. (Asteraceae). We examined food webs in which chemotypes of tansy plants are the resource for two specialized aphids, their predators and mutualistic ants. The density of the ant-tended aphid Metopeurum fuscoviride was significantly higher on particular chemotypes (borneol) than others. Clear chemotype preferences between predators were also detected. Aphid specialist seven-spotted ladybird beetles (Coccinella septempunctata) were more often found on camphor plants, while significantly higher numbers of the polyphagous nursery web spider (Pisaura mirabilis) were observed on borneol plants. The analysis of plant chemotype effects on the arthropod community clearly demonstrates a range of possible outcomes between plant-aphid-predator networks. The findings help to offer a deeper insight into how one important factorplant chemical contentinfluences which species coexist within a food web on a particular host plant and the nature of their trophic linkages.  2015, Springer-Verlag Berlin Heidelberg.",1,"MA220","","","",""
"X.ISI.000283103900007","Cheats as first propagules: A new hypothesis for the evolution of individuality during the transition from single cells to multicellularity","Rainey, Paul B. and Kerr, Benjamin","BIOESSAYS",32,"10","872-880",2010,"10.1002/bies.201000039","The emergence of individuality during the evolutionary transition from single cells to multicellularity poses a range of problems. A key issue is how variation in lower-level individuals generates a corporate (collective) entity with Darwinian characteristics. Of central importance to this process is the evolution of a means of collective reproduction, however, the evolution of a means of collective reproduction is not a trivial issue, requiring careful consideration of mechanistic details. Calling upon observations from experiments, we draw attention to proto-life cycles that emerge via unconventional routes and that transition, in single steps, individuality to higher levels. One such life cycle arises from conflicts among levels of selection and invokes cheats as a primitive germ line: it lays the foundation for collective reproduction, the basis of a self-policing system, the selective environment for the emergence of development, and hints at a plausible origin for a soma/germ line distinction.",1,"MA43","","","",""
"Hajek201977","Context-dependent interactions of insects and defensive symbionts: insights from a novel system in siricid woodwasps","Hajek, A.E. and Morris, E.E. and Hendry, T.A.","Current Opinion in Insect Science",33,NA,"77-83",2019,"10.1016/j.cois.2019.03.006","Many insect species derive fitness benefits from associations with defensive microbial symbionts that confer protection against pathogens and parasites. These relationships are varied and diverse, but a number of studies highlight important trends. The effects of defensive symbionts can be context-dependent and influenced by variable selection imposed by the organism against which the symbiont protects. Additionally, genetic variation in both hosts and symbionts can greatly influence the outcome of these interactions. Here, we describe interactions between siricid woodwasps, their fungal symbionts and parasitic nematodes and show how defense by symbionts in this system is also context-dependent. The species or strain of the white rot fungus used as a symbiont by Sirex can influence parasitism of these hosts by Deladenus nematodes.  2019",1,"MA73","","","",""
"X.ISI.000186738000019","Slow algae, fast fungi: exceptionally high nucleotide substitution rate differences between lichenized fungi Omphalina and their symbiotic green algae Coccomyxa","Zoller, S and Lutzoni, F","MOLECULAR PHYLOGENETICS AND EVOLUTION",29,"3","629-640",2003,"10.1016/S1055-7903(03)00215-X","Omphalina basidiolichens are obligate mutualistic associations of a fungus of the genus Omphalina (the exhabitant) and a unicellular green alga of the genus Coccomyxa (the inhabitant). It has been suggested that symbiotic inhabitants have a lower rate of genetic change compared to exhabitants because the latter are more exposed to abiotic environmental variation and competition from other organisms. In order to test this hypothesis we compared substitution rates in the nuclear ribosomal internal transcribed spacer region (ITS1, 5.8S, ITS2) among fungal species with rates among their respective algal symbionts. To ensure valid comparisons, only taxon pairs (12) with a common evolutionary history were used. On average, substitution rates in the ITS1 portion of Omphalina pairs were 27.5 times higher than rates in the corresponding pairs of Coccomyxa since divergence from their respective ancestor at the base of the Omphalina/Coccomyxa lineage. Substitution rates in the 5.8S and the ITS2 portions were 2.4 and 18.0 times higher, respectively. The highest rate difference (43.0) was found in the ITS1 region. These are, to our knowledge, the highest differences of substitution rates reported for symbiotic organisms. We conclude that the Omphalina model system conforms to the proposed hypothesis of lower substitution rates in the inhabitant, but that the mode of transmission of the inhabitant (vertical versus horizontal) could be a prevailing factor in the regulation of unequal rates of nucleotide substitution between co-evolving symbionts. Our phylogenetic study of Coccomyxa revealed three main lineages within this genus, corresponding to free-living :Coccomyxa, individuals isolated from basidiolichens Omphalina and Coccomyxa isolated from ascolichens belonging to the Peltigerales. (C) 2003 Elsevier Science (USA). All rights reserved.",2,"MA324","","","",""
"Husnik20181294","Host-symbiont-pathogen interactions in blood-feeding parasites: Nutrition, immune cross-talk and gene exchange","Husnik, F.","Parasitology",145,"10","1294-1303",2018,"10.1017/S0031182018000574","Animals are common hosts of mutualistic, commensal and pathogenic microorganisms. Blood-feeding parasites feed on a diet that is nutritionally unbalanced and thus often rely on symbionts to supplement essential nutrients. However, they are also of medical importance as they can be infected by pathogens such as bacteria, protists or viruses that take advantage of the blood-feeding nutritional strategy for own transmission. Since blood-feeding evolved multiple times independently in diverse animals, it showcases a gradient of host-microbe interactions. While some parasitic lineages are possibly asymbiotic and manage to supplement their diet from other food sources, other lineages are either loosely associated with extracellular gut symbionts or harbour intracellular obligate symbionts that are essential for the host development and reproduction. What is perhaps even more diverse are the pathogenic lineages that infect blood-feeding parasites. This microbial diversity not only puts the host into a complicated situation -distinguishing between microorganisms that can greatly decrease or increase its fitness -but also increases opportunity for horizontal gene transfer to occur in this environment. In this review, I first introduce this diversity of mutualistic and pathogenic microorganisms associated with blood-feeding animals and then focus on patterns in their interactions, particularly nutrition, immune cross-talk and gene exchange.  2018 Cambridge University Press.",1,"MA185","","","",""
"X.ISI.000187962200002","Direct and indirect effects of pollinators and seed predators to selection on plant and floral traits","Cariveau, D and Irwin, RE and Brody, AK and Garcia-Mayeya, LS and von der Ohe, A","OIKOS",104,"1","15-26",2004,"10.1111/j.0030-1299.2004.12641.x","Although flowering traits are often assumed to be under strong selection by pollinators, significant variation in such traits remains the norm for most plant species. Thus, it is likely that the interactions among plants, mutualists, and other selective agents, such as antagonists, ultimately shape the evolution of floral and flowering traits. We examined the importance of pollination vs pre-dispersal seed predation to selection on plant and floral characters via female plant-reproductive success in Castilleja linariaefolia (Scrophulariaceae). C. linariaefolia is pollinated by hummingbirds and experiences high levels of pre-dispersal seed predation by plume moth and fly larvae in the Rocky Mountains of Colorado, USA, where this work was conducted. We first examined whether female reproduction in C. linariaefolia was limited by pollination. Supplemental pollination only marginally increased components of female reproduction, likely because seed predation masked, in part, the beneficial effects of pollen addition. In unmanipulated populations, we measured calyx length, flower production, and plant height and used path analysis combined with structural equation modeling to quantify their importance to relative seed set through pathways involving pollination vs seed predation. We found that the strength of selection on calyx length, flower production, and plant height was greater for seed predation pathways than for pollination pathways, and one character, calyx length, experienced opposing selection via pollination vs seed predation. These results suggest that the remarkable intraspecific variation in plant and floral characters exhibited by some flowering plants is likely the result of selection driven, at least in part, by pollinators in concert with antagonists, such as pre-dispersal seed predators. This work highlights the subtle but complex interactions that shape floral and vegetative design in natural ecosystems.",1,"MA92","","","",""
"X.ISI.000338712900031","All signals are not equal: acoustic signalling of individuality, sex and breeding status in a cooperative breeder","Warrington, Miyako H. and McDonald, Paul G. and Rollins, Lee Ann and Griffith, Simon C.","ANIMAL BEHAVIOUR",93,NA,"249-260",2014,"10.1016/j.anbehav.2014.05.007","Repeated interactions between individuals in socially living animals select for the evolution of signals that convey information identifying individuals or categories of individuals, which may enable the discrimination of familiar versus unfamiliar individuals. Such information may help animals maximize their inclusive fitness by adjusting their own behaviour, allowing them to avoid conflict, preferentially direct help and/or ignore unreliable individuals. Acoustic signals in birds provide the potential to encode individual-specific information. We examined the degree to which individual identity, sex, breeding status, group membership and genetic relatedness were related to variability in six different call types, which occurred across a variety of different behavioural contexts in the apostlebird, Struthidea cinerea, a socially living and cooperatively breeding Australian passerine. We demonstrated that not all calls reflected the same extent of information. Of the six call types, call variation was related to individual identity in three call types, breeding status in two call types and sex and group relatedness in one call type. Finally, variation in two call types was not related to any of the measured variables. Our results suggest that some, but not all, acoustic signals in apostlebirds may be selected for individual distinctiveness between individuals and categories of individuals (male versus female, breeder versus nonbreeder), and these signals may be important in determining levels of cooperation and interaction between individuals in this cooperatively breeding society. (C) 2014 The Association for the Study of Animal Behaviour. Published by Elsevier Ltd. All rights reserved.",2,"MA14","","","",""
"McAuliffe2015","When cooperation begets cooperation: The role of key individuals in galvanizing support","McAuliffe, K. and Wrangham, R. and Glowacki, L. and Russell, A.F.","Philosophical Transactions of the Royal Society B: Biological Sciences",370,"1683",NA,2015,"10.1098/rstb.2015.0012","Life abounds with examples of conspecifics actively cooperating to a common end, despite conflicts of interest being expected concerning how much each individual should contribute. Mathematical models typically find that such conflict can be resolved by partial-response strategies, leading investors to contribute relatively equitably. Using a case study approach, we show that such model expectations can be contradicted in at least four disparate contexts: (i) bi-parental care; (ii) cooperative breeding; (iii) cooperative hunting; and (iv) human cooperation. We highlight that: (a) marked variation in contributions is commonplace; and (b) individuals can often respond positively rather than negatively to the contributions of others. Existing models have surprisingly limited power in explaining these phenomena. Here, we propose that, although among-individual variation in cooperative contributions will be influenced by differential costs and benefits, there is likely to be a strong genetic or epigenetic component. We then suggest that selection can maintain high investors (key individuals) when their contributions promote support by increasing the benefits and/or reducing the costs for others. Our intentions are to raise awareness inand provide testable hypotheses oftwo of the most poorly understood, yet integral, questions regarding cooperative ventures: why do individuas vary in their contributions and when does cooperation beget cooperation?.  2015 The Author(s) Published by the Royal Society. All rights reserved.",2,"MA408","","","",""
"vanDijk20121927","Individual variation and the resolution of conflict over parental care in penduline tits","van Dijk, R.E. and Szkely, T. and Komdeur, J. and Pogny, A. and Fawcett, T.W. and Weissing, F.J.","Proceedings of the Royal Society B: Biological Sciences",279,"1735","1927-1936",2012,"10.1098/rspb.2011.2297","Eurasian penduline tits (Remiz pendulinus) have an unusually diverse breeding system consisting of frequent male and female polygamy, and uniparental care by the male or the female. Intriguingly, 30 to 40 per cent of all nests are deserted by both parents. To understand the evolution of this diverse breeding system and frequent clutch desertion, we use 6 years of field data to derive fitness expectations for males and females depending on whether or not they care for their offspring. The resulting payoff matrix corresponds to an asymmetric Snowdrift Game with two alternative evolutionarily stable strategies (ESSs): female-only and male-only care. This, however, does not explain the polymorphism in care strategies and frequent biparental desertion, because theory predicts that one of the two ESSs should have spread to fixation. Using a bootstrapping approach, we demonstrate that taking account of individual variation in payoffs explains the patterns of care better than a model based on the average population payoff matrix. In particular, a model incorporating differences in male attractiveness closely predicts the observed frequencies of male and female desertion. Our work highlights the need for a new generation of individual-based evolutionary game-theoretic models.  2011 The Royal Society.",2,"MA200","","","",""
"X.ISI.000390195000003","A common framework for identifying linkage rules across different types of interactions","Bartomeus, Ignasi and Gravel, Dominique and Tylianakis, Jason M. and Aizen, Marcelo A. and Dickie, Ian A. and Bernard-Verdier, Maud","FUNCTIONAL ECOLOGY",30,"12","1894-1903",2016,"10.1111/1365-2435.12666","1. Species interactions, ranging from antagonisms to mutualisms, form the architecture of bio-diversity and determine ecosystem functioning. Understanding the rules responsible for who interacts with whom, as well as the functional consequences of these interspecific interactions, is central to predict community dynamics and stability. 2. Species traits sensu lato may affect different ecological processes by determining species interactions through a two-step process. First, ecological and life-history traits govern species distributions and abundance, and hence determine species co-occurrence and the potential for species to interact. Secondly, morphological or physiological traits between co-occurring potential interaction partners should match for the realization of an interaction. Here, we review recent advances on predicting interactions from species co-occurrence and develop a probabilistic model for inferring trait matching. 3. The models proposed here integrate both neutral and trait-matching constraints, while using only information about known interactions, thereby overcoming problems originating from undersampling of rare interactions (i.e. missing links). They can easily accommodate qualitative or quantitative data and can incorporate trait variation within species, such as values that vary along developmental stages or environmental gradients. 4. We use three case studies to show that the proposed models can detect strong trait matching (e.g. predator-prey system), relaxed trait matching (e.g. herbivore-plant system) and barrier trait matching (e.g. plant-pollinator systems). 5. Only by elucidating which species traits are important in each process (i.e. in determining interaction establishment and frequency), we can advance in explaining how species interact and the consequences of these interactions for ecosystem functioning.",1,"MA2","","","",""
"VanOppen20052403","Diversity of algal endosymbionts (zooxanthellae) in octocorals: The roles of geography and host relationships","Van Oppen, M.J.H. and Mieog, J.C. and Snchez, C.A. and Fabricius, K.E.","Molecular Ecology",14,"8","2403-2417",2005,"10.1111/j.1365-294X.2005.02545.x","The presence, genetic identity and diversity of algal endosymbionts (Symbiodinium) in 114 species from 69 genera (20 families) of octocorals from the Great Barrier Reef (GBR), the far eastern Pacific (EP) and the Caribbean was examined, and patterns of the octocoral-algal symbiosis were compared with patterns in the host phylogeny. Genetic analyses of the zooxanthellae were based on ribosomal DNA internal transcribed spacer 1 (ITS1) region. In the GBR samples, Symbiodinium clades A and G were encountered with A and G being rare. Clade B zooxanthellae have been previously reported from a GBR octocoral, but are also rare in octocorals from this region. Symbiodinium G has so far only been found in Foraminifera, but is rare in these organisms. In the Caribbean samples, only Symbiodinium clades B and C are present. Hence, Symbiodinium diversity at the level of phylogenetic clades is lower in octocorals from the Caribbean compared to those from the GBR. However, an unprecedented level of ITS1 diversity was observed within individual colonies of some Caribbean gorgonians, implying either that these simultaneously harbour multiple strains of clade B zooxanthellae, or that ITS1 heterogeneity exists within the genomes of some zooxanthellae. Intracladal diversity based on ITS should therefore be interpreted with caution, especially in cases where no independent evidence exists to support distinctiveness, such as ecological distribution or physiological characteristics. All samples from EP are azooxanthellate. Three unrelated GBR taxa that are described in the literature as azooxanthellate (Junceella fragilis, Euplexaura nuttingi and Stereonephthya sp. 1) contain clade G zooxanthellae, and their symbiotic association with zooxanthellae was confirmed by histology. These corals are pale in colour, whereas related azooxanthellate species are brightly coloured. The evolutionary loss or gain of zooxanthellae may have altered the light sensitivity of the host tissues, requiring the animals to adopt or reduce pigmentation. Finally, we superimposed patterns of the octocoral-algal symbiosis onto a molecular phylogeny of the host. The data show that many losses/gains of endosymbiosis have occurred during the evolution of octocorals. The ancestral state (azooxanthellate or zooxanthellate) in octocorals remains unclear, but the data suggest that on an evolutionary timescale octocorals can switch more easily between mixotrophy and heterotrophy compared to scleractinian corals, which coincides with a low reliance on photosynthetic carbon gain in the former group of organisms.  2005 Blackwell Publishing Ltd.",1,"MA96","","","",""
"Tikhonovich2009341","From plant-microbe interactions to symbiogenetics: A universal paradigm for the interspecies genetic integration","Tikhonovich, I.A. and Provorov, N.A.","Annals of Applied Biology",154,"3","341-350",2009,"10.1111/j.1744-7348.2008.00306.x","Beneficial plant-microbe symbioses are based on the integration of genetic material from diverse organisms resulting in formation of superorganism genetic systems. Analysis of their functions and evolution requires the establishment of a new biological discipline, proposed to be called symbiogenetics, which provides a basis for fundamental and applied research of the genetic control over different (symbiotic and biocenotic) biotic interactions. In ecology and agrobiology, the approaches of symbiogenetics are indispensable for optimising the interactions between the plants and the beneficial microbes to be used in ecosystem management and in sustainable crop production in which hazardous fertilisers and pesticides should be replaced by environmentally friendly microbial inoculants.  2009 Association of Applied Biologists.",1,"MA158","","","",""
"Stackebrandt2013307","Bacterial Biodiversity","Stackebrandt, E.","Encyclopedia of Biodiversity: Second Edition",NA,NA,"307-316",2013,"10.1016/B978-0-12-384719-5.00432-9","Bacterial diversity comprises the total variability of prokaryotic life on Earth, covering all genomic, phenetic, phylogenetic, and ecological variations from the level of an individual strain to the community that evolved over a time span of probably more than 3.5 billion years. Determination of the extent of diversity is mainly restricted to cultured prokaryotes because the vast majority of strains are not yet accessible for subsequent research. Strains involved in obligate symbiotic and parasitic relationships with their eukaryotic hosts and free-living strains for which appropriate culture conditions have not been developed can at best be detected by molecular techniques. This article summarizes results of recent approaches that have broadened the bacteriologist's view about the immense richness of prokaryotic diversity.  2001 Elsevier Inc. All rights reserved.",1,"MA26","","","",""
