"Functional consequences of plant-animal interactions along the mutualism-antagonism gradient","Plant-animal interactions are pivotal for ecosystem functioning, and usually form complex networks involving multiple species of mutualists as well as antagonists. The costs and benefits of these interactions show a strong context-dependency directly related to individual variation in partner identity and differential strength. Yet understanding the context-dependency and functional consequences of mutualistic and antagonistic interactions on individuals remains a lasting challenge. We use a network approach to characterize the individual, plant-based pollination interaction networks of the Canarian Isoplexis canariensis (Plantaginaceae) with a mixed assemblage of vertebrate mutualists (birds and lizards) and invertebrate antagonists (florivores, nectar larcenists, and predispersal seed predators). We identify and quantify interaction typologies based on the sign (mutualistic vs. antagonistic) and strength (weak vs. strong) of animal-mediated pollination and test the relationship with individual female reproductive success (FRS). In addition, we document pollinator movement patterns among individual plants to infer events of pollen transfer/receipt that define the plant mating networks and test the relationship with FRS. We identify six interaction typologies along a mutualism-antagonism gradient, with two typologies being over-represented involving both mutualists and antagonists and influencing FRS. Plants showing strong mutualistic interactions, but also (weak or strong) interactions with antagonists are relatively better connected in the mating network (i.e., with higher potential to transfer or receive pollen). Thus, mixed flower visitor assemblages with mutualists and antagonists give plants increased their importance in the mating networks, promote outcrossing and increasing both female and male fitness. Our approach helps characterize plant-animal interaction typologies, the context-specificity of diversified mutualisms, and a better forecasting of their functional consequences.  2017 by the Ecological Society of America","MA160","UE","","",""
"GENOPT 2016: Design of a GENeralization-based challenge in global OPTimization","While comparing results on benchmark functions is a widely used practice to demonstrate the competitiveness of global optimization algorithms, fixed benchmarks can lead to a negative data mining process. To avoid this negative effect, the GENOPT contest benchmarks can be used which are based on randomized function generators, designed for scientific experiments, with fixed statistical characteristics but individual variation of the generated instances. The generators are available to participants for off-line tests and online tuning schemes, but the final competition is based on random seeds communicated in the last phase through a cooperative process. A brief presentation and discussion of the methods and results obtained in the framework of the GENOPT contest are given in this contribution.Grant: This work was supported by the project No. 15-11-30022 ""Global optimization, supercomputing computations, and applications"" of the Russian Science Foundation. The authors thank Janos Pintr for sending comments and useful suggestions.","MA166","UE","","",""
"Volatile-mediated location of mutualist host and toxic non-host microfungi by Drosophila larvae","In analogy to herbivores, fungivorous animals may find suitable host fungi using fungal volatiles as infochemicals and to distinguish between fungi of varying suitability. This study tests the influence of volatiles emitted by micro-fungi, yeast and mould, on the foraging behaviour of facultative fungivorous Drosophila melanogaster larvae. We hypothesised that establishing or avoiding contact with edible yeast (host fungus) and inedible, toxic mould (non-host fungus) is regulated by fungus-specific variation in volatile production. In particular, we expected the non-host fungus to produce specific volatiles that repel fly larvae and thus contribute to signal inedibility. By quantifying innate variation in arrival of individual D. melanogaster larvae at colonies of the mutualist yeast Candida californica or of the antagonistic mould Penicillium expansum, we found the yeast to attract more rapidly a larger number of larvae than the mould did. The developmental stage (young, vegetative vs. old, sporulating) of P. expansum did not affect arrival of larvae at fungal colonies. We used gas chromatography coupled with mass spectrometry (GC-MS) to identify the composition of fungal volatiles. Four compounds appeared to be yeast-specific, twenty to be mould-specific volatiles. Eight volatiles were consistently produced by both young and old P. expansum. Two compounds, 3-methyl-1-butanol and 2-methyl-1-propanol, were released by P. expansum (young and old) as well as C. californica. Time-dependent behavioural response profiles of similar to 750 D. melanogaster larvae revealed innate attraction to three alcohols produced by yeast and/or moulds and to two yeast-specific organic acids. We found no indication of a repellent effect of mould-specific compounds, including terpenoids like geosmin known to elicit strong avoidance behaviour of adult D. melanogaster in response to harmful microbes. Also, synthetic mould and yeast-specific blends of attractive compounds were equally attractive to the larvae. With respect to the species combinations investigated in this study, we hypothesize that qualitative differences in fungal volatile profiles are of minor relevance in how Drosophila larvae locate and probably discriminate between fungi of varying suitability.","MA407","UE","","",""
"Capuchin monkeys (Sapajus {[}Cebus] apella) play Nash equilibria in dynamic games, but their decisions are likely not influenced by oxytocin","Comparative approaches to experimental economics have shed light on the evolution of social decision-making across a range of primate species, including humans. Here we replicate our previous work looking at six pairs of capuchin monkeys' (Sapajus {[}Cebus] apella) responses to scenarios requiring both coordination (Assurance Game) and anti-coordination (Hawk-Dove Game). This then provides a foundation for assessing their responses to two additional games, one with a scenario of beneficial cooperation with a temptation to defect (Prisoner's Dilemma) and one with an environment requiring changing strategies within short temporal proximity (Alternating Economic Game). We additionally explored the effects of exogenous oxytocin on decision-making. Oxytocin did not affect decisions in any of our games. Results from the first two games largely replicated our previous findings. Responses to the Prisoner's Dilemma were more varied than was seen in previous games, with pairs respectively cooperating, defecting, and failing to establish stable strategies. Such variability indicates that this game may be a good assay for individual differences in social decision-making. Finally, capuchins were able to flexibly switch between their previously established strategies within each of the different games, even when the games were presented within the same session, requiring strategy adjustments within short temporal proximity. These results build on earlier findings showing that capuchins can alter decision-making strategies as the context demands, which is likely essential for decision-making in naturally occurring contexts.","MA39","UE","","",""
"INTRACELLULAR SYMBIONTS AND THE EVOLUTION OF UNIPARENTAL CYTOPLASMIC INHERITANCE","Uniparental inheritance of cytoplasmic elements is widespread among eukaryotic organisms and is achieved by a diverse range of mechanisms. This paper shows that the cytoplasmic genetic system would be expected to evolve towards uniparental inheritance, given the existence of deleterious symbionts capable of invading the host cytoplasm together with nuclear genes that lead to the elimination of cytoplasmic elements from one of the gamete types. The reason for this is that, under biparental inheritance, foreign symbionts with strong deleterious effects are able to spread through host populations. A nuclear modifier gene which leads to the loss of cytoplasmic elements from one gamete type gains a net advantage as a symbiont spreads, because the modifier sometimes gives rise to a symbiont-free zygote. In so far as small gametes reduce the rate of symbiont transmission to the zygote, modifier genes causing small gamete size would tend to accumulate, so that cytoplasmic inheritance would become associated with maternal rather than paternal gametes. Once uniparental inheritance predominates in the host population, the population is protected from invasions by a large class of harmful symbionts, but at the same time those symbionts that benefit their hosts are still able to increase in frequency.","MA216","UE","","",""
"Turn-taking ceremonies in a colonial seabird: Does behavioral variation signal individual condition?","In species with biparental care, pairs share a cooperative interest in offspring survival but may be in conflict over their relative investments, as reported in recent turn-taking studies of chick-provisioning birds. Turn-taking in Common Murres (Uria aalge) involves the foraging bird returning to the colony to provision the chick and the brooding parent departing. We examined whether Common Murres in poor condition had slower or more irregular turn-taking behavior, as has been documented in Common Murres equipped with geologgers. Irregularities include the brooding bird not trading parental roles with its returning mate or a bird returning to the colony without a fish. Irregular turn-taking sequences generally took longer than normal turn-taking sequences and differed in the rate and synchrony of allopreening, the main interactive behavior between mates. There was a delayed onset of allopreening when nest reliefs were protracted, whereas returners that did not bring a fish started allopreening sooner than either their brooding partners or other returners that brought a fish. Common Murres in better condition (higher body mass and lower lipid metabolite levels) left the colony sooner after their returning mates fed the chick compared to Common Murres in worse condition. Birds with higher chick-feeding rates brought fish back in more visits, which suggests that these were higher-quality birds. When birds vary in their turn-taking ceremonial behaviors, they may be negotiating by providing their partners with cues about their condition. Since Common Murres have long-term pair bonds and both parents are necessary to raise offspring, mates should respond to information from their partners if they can do so without compromising their own condition beyond a critical threshold.  2017 American Ornithological Society.","MA398","UE","","",""
"Social cognition","The social intelligence hypothesis argues that competition and cooperation among individuals have shaped the evolution of cognition in animals. What do we mean by social cognition? Here we suggest that the building blocks of social cognition are a suite of skills, ordered roughly according to the cognitive demands they place upon individuals. These skills allow an animal to recognize others by various means; to recognize and remember other animals' relationships; and, perhaps, to attribute mental states to them. Some skills are elementary and virtually ubiquitous in the animal kingdom; others are more limited in their taxonomic distribution. We treat these skills as the targets of selection, and assume that more complex levels of social cognition evolve only when simpler methods are inadequate. As a result, more complex levels of social cognition indicate greater selective pressures in the past. The presence of each skill can be tested directly through field observations and experiments. In addition, the same methods that have been used to compare social cognition across species can also be used to measure individual differences within species and to test the hypothesis that individual differences in social cognition are linked to differences in reproductive success. (C) 2015 The Association for the Study of Animal Behaviour. Published by Elsevier Ltd. All rights reserved.","MA330","UE","","",""
"Sexual and Social Behavior of Crustacea","The Crustacea represents one of the major branches in the tree of animal life, displaying diversity in form and lifestyle that rival those of the vertebrates and insects. But perhaps because of the primarily aquatic habits of crustaceans, they have received much less attention in evolutionary ecology than mostly terrestrial taxa. The chapters in this book make clear the richness of adaptations of crustaceans to social and sexual life, and their still largely untapped potential to test fundamental theory in behavioral ecology and evolution. Kinship, cooperation, and conflict play an important role in social evolution, modulated by extrinsic factors (resource competition, predation or parasitism), some of which have only recently begun to be studied. There are rich opportunities awaiting the student willing to pursue them, both in clarifying the social and sexual biology of individual crustacean species and in exploiting the Crustacea in broad comparative approaches to testing evolutionary theory.  Oxford University Press, 2013.","MA318","UE","","",""
"Strategic adjustment of begging effort by banded mongoose pups","Variation in the intensity of conspicuous displays raises three basic questions: (i) the relationship between internal state and display intensity, (ii) the relationship between display intensity and receiver response, and (iii) the effect of variation in receiver responsiveness on signaller behaviour. Here, I investigate the interaction between pups and helpers in the communally breeding banded mongoose (Mungos mungo), where each pup forms an exclusive relationship with a single adult helper (termed its 'escort'). By experimentally manipulating pup need, I demonstrate that changes in begging rate correspond to changes in short-term need. The data then suggest that escorts in good condition may be more responsive to increased begging and that pups associating with them increase their begging more than do pups paired with escorts in poor condition. Escorts also appear more responsive to increased begging by female pups, and female pups increase their begging more than do male pups. These results suggest that banded mongoose pups may strategically adjust their investment in begging in relation to variation in the expected pay-off. I argue that such adjustment is likely to be a general phenomenon: wherever there is variation in responsiveness to signals, signallers will be selected to identify different categories of receiver and adjust their signals in order to maximize the pay-offs. Therefore, differences in signal intensity may be as much a product of context as an indication of variation in individual phenotypic or genotypic state.  2008 The Royal Society.","MA354","UE","","",""
"Selfish punishment: Altruism can be maintained by competition among cheaters","Altruistic punishment refers to a class of behaviors that deters cheating at a cost to the punisher, making it a form of second-order altruism. Usually, it is assumed that the punishers are themselves ``solid citizens{''} who refrain from cheating. We show in a simulation model that altruism and punishment paradoxically become negatively correlated, leading to a form of selfish punishment. Examples of selfish punishment can be found in organisms as diverse as wasps, birds, and humans. (C) 2007 Elsevier Ltd. All rights reserved.","MA314","UE","","",""
"Morphological identification and DNA barcoding of a new species of Parabrachiella (Siphonostomatoida: Lernaeopodidae) with aspects of their intraspecific variation","We present a detailed morphological description and a DNA barcoding of Parabrachiella platensis n. sp. collected from Mugil liza Valenciennes in Samborombon Bay (Buenos Aires, Argentina). This new species was compared with two Parabrachiella species parasitic on mugilids: Parabrachiella exilis (Shiino, 1956) and Parabrachiella mugilis (Kabata, Raibaut et Ben Hassine, 1971). Parabrachiella platensis n. sp. differs from those species in the shape of posterior processes, the anal slit with two pairs of bipartite papillae, the size of cephalothorax, the trunk, the maxilla, the microhabitat on the host, and the lack of caudal rami. On the host, the new species was in the nostrils (a new site for a species of the genus Parabrachiella) and in the fins base. Some minor morphological differences were observed in relation to the locations on the host. The molecular analysis conducted based on mtDNA-COI between specimens of the new species on the fins and nostrils showed a genetic similarity of 99.8%. This percentage supports that the specimens found in nostrils and fins base could represent a single species. New studies on P. platensis n. sp., including infection of the same fish with the two forms, could bring some new information. Anyway according to the genetic information provided and the minimal morphological differences spotted we conclude that the two forms are a single specie. The differences observed are possibly influenced by the place of the host where the two forms of copepods were found, nostrils and fins. The new species was also molecularly compared to other five species of Parabrachiella including P. exilis (parasitizing mugilid from Chile), Parabrachiella anisotremis, Parabrachiella auriculata, Parabrachiella merluccii, and P. hugu (the last two sequences were taken from the GenBank). The genetic distance of 9% among P. platensis n. sp. and P. exilis, which is the close morphological related species, allow to states that these two copepods on mugilids belong to different species and then validating the morphological differences found between them.  2017 Elsevier B.V.","MA250","UE","","",""
"Effects of biodiversity on ecosystem functioning: A consensus of current knowledge","Humans are altering the composition of biological communities through a variety of activities that increase rates of species invasions and species extinctions, at all scales, from local to global. These changes in components of the Earth's biodiversity cause concern for ethical and aesthetic reasons, but they also have a strong potential to alter ecosystem properties and the goods and services they provide to humanity. Ecological experiments, observations, and theoretical developments show that ecosystem properties depend greatly on biodiversity in terms of the functional characteristics of organisms present in the ecosystem and the distribution and abundance of those organisms over space and time. Species effects act in concert with the effects of climate, resource availability, and disturbance regimes in influencing ecosystem properties. Human activities can modify all of the above factors; here we focus on modification of these biotic controls. The scientific community has come to a broad consensus on many aspects of the relationship between biodiversity and ecosystem functioning, including many points relevant to management of ecosystems. Further progress will require integration of knowledge about biotic and abiotic controls on ecosystem properties, how ecological communities are structured, and the forces driving species extinctions and invasions. To strengthen links to policy and management, we also need to integrate our ecological knowledge with understanding of the social and economic constraints of potential management practices. Understanding this complexity, while taking strong steps to minimize current losses of species, is necessary for responsible management of Earth's ecosystems and the diverse biota they contain. Based on our review of the scientific literature, we are certain of the following conclusions: 1)Species' functional characteristics strongly influence ecosystem properties. Functional characteristics operate in a variety of contexts, including effects of dominant species, keystone species', ecological engineers, and interactions among species (e.g., competition, facilitation, mutualism, disease, and predation). Relative abundance alone is not always a good predictor of the ecosystem-level importance of a species, as even relatively rare species (e.g., a keystone predator) can strongly influence pathways of energy and material flows. 2) Alteration of biota in ecosystems via species invasions and extinctions caused by human activities has altered ecosystem goods and services in many well-documented cases. Many of these changes are difficult, expensive, or impossible to reverse or fix with technological solutions. 3) The effects of species loss or changes in composition, and the mechanisms by which the effects manifest themselves, can differ among ecosystem properties, ecosystem types, and pathways of potential community change. 4) Some ecosystem properties are initially insensitive to species loss because (a) ecosystems may have multiple species that carry out similar functional roles, (b) some species may contribute relatively little to ecosystem properties, or (c) properties may be primarily controlled by abiotic environmental conditions. 5) More species are needed to insure a stable supply of ecosystem goods and services as spatial and temporal variability increases, which typically occurs as longer time periods and larger areas are considered. We have high confidence in the following conclusions: 1) Certain combinations of species are complementary in their patterns of resource use and can increase average rates of productivity and nutrient retention. At the same time, environmental conditions can influence the importance of complementarity in structuring communities. Identification of which and how many species act in a complementary way in complex communities is just beginning. 2) Susceptibility to invasion by exotic species is strongly influenced by species composition and, under similar environmental conditions, generally decreases with increasing species richness. However, several other factors, such as propagule pressure, disturbance regime, and resource availability also strongly influence invasion success and often override effects of species richness in comparisons across different sites or ecosystems. 3) Having a range of species that respond differently to different environmental perturbations can stabilize ecosystem process rates in response to disturbances and variation in abiotic conditions. Using practices that maintain a diversity of organisms of different functional effect and functional response types will help preserve a range of management options. Uncertainties remain and further research is necessary in the following areas: 1) Further resolution of the relationships among taxonomic diversity, functional diversity, and community structure is important for identifying mechanisms of biodiversity effects. 2) Multiple trophic levels are common to ecosystems but have been understudied in biodiversity/ecosystem functioning research. The response of ecosystem properties to varying composition and diversity of consumer organisms is much more complex than responses seen in experiments that vary only the diversity of primary producers. 3) Theoretical work on stability has outpaced experimental, work, especially field research. We need long-term experiments to be able to assess temporal stability, as well as experimental perturbations to assess response to and recovery from a variety of disturbances. Design and analysis of such experiments must account for several factors that covary with species diversity. 4) Because biodiversity both responds to and influences ecosystem properties, understanding the feedbacks involved is necessary to integrate results from experimental communities with patterns seen at broader scales. Likely patterns of extinction and invasion need to be linked to different drivers of global change, the forces that structure communities, and controls on ecosystem properties for the development of effective management and conservation strategies. 5) This paper focuses primarily on terrestrial systems, with some coverage of freshwater systems, because that is where most empirical and theoretical study has focused. While the fundamental principles described here should apply to marine systems, further study of that realm is necessary. Despite some uncertainties about the mechanisms and circumstances under which diversity influences ecosystem properties, incorporating diversity effects into policy and management is essential, especially in making decisions involving large temporal and spatial scales. Sacrificing those aspects of ecosystems that are difficult or impossible to reconstruct, such as diversity, simply because we are not yet certain about the extent and mechanisms by which they affect ecosystem properties, will restrict future management options even further. It is incumbent upon ecologists to communicate this need, and the values that can derive from such a perspective, to those charged with economic and policy decision-making.","MA113","UE","","",""
