"VanOppen20052403","Diversity of algal endosymbionts (zooxanthellae) in octocorals: The roles of geography and host relationships","Van Oppen, M.J.H. and Mieog, J.C. and Snchez, C.A. and Fabricius, K.E.","Molecular Ecology",14,"8","2403-2417",2005,"10.1111/j.1365-294X.2005.02545.x","The presence, genetic identity and diversity of algal endosymbionts (Symbiodinium) in 114 species from 69 genera (20 families) of octocorals from the Great Barrier Reef (GBR), the far eastern Pacific (EP) and the Caribbean was examined, and patterns of the octocoral-algal symbiosis were compared with patterns in the host phylogeny. Genetic analyses of the zooxanthellae were based on ribosomal DNA internal transcribed spacer 1 (ITS1) region. In the GBR samples, Symbiodinium clades A and G were encountered with A and G being rare. Clade B zooxanthellae have been previously reported from a GBR octocoral, but are also rare in octocorals from this region. Symbiodinium G has so far only been found in Foraminifera, but is rare in these organisms. In the Caribbean samples, only Symbiodinium clades B and C are present. Hence, Symbiodinium diversity at the level of phylogenetic clades is lower in octocorals from the Caribbean compared to those from the GBR. However, an unprecedented level of ITS1 diversity was observed within individual colonies of some Caribbean gorgonians, implying either that these simultaneously harbour multiple strains of clade B zooxanthellae, or that ITS1 heterogeneity exists within the genomes of some zooxanthellae. Intracladal diversity based on ITS should therefore be interpreted with caution, especially in cases where no independent evidence exists to support distinctiveness, such as ecological distribution or physiological characteristics. All samples from EP are azooxanthellate. Three unrelated GBR taxa that are described in the literature as azooxanthellate (Junceella fragilis, Euplexaura nuttingi and Stereonephthya sp. 1) contain clade G zooxanthellae, and their symbiotic association with zooxanthellae was confirmed by histology. These corals are pale in colour, whereas related azooxanthellate species are brightly coloured. The evolutionary loss or gain of zooxanthellae may have altered the light sensitivity of the host tissues, requiring the animals to adopt or reduce pigmentation. Finally, we superimposed patterns of the octocoral-algal symbiosis onto a molecular phylogeny of the host. The data show that many losses/gains of endosymbiosis have occurred during the evolution of octocorals. The ancestral state (azooxanthellate or zooxanthellate) in octocorals remains unclear, but the data suggest that on an evolutionary timescale octocorals can switch more easily between mixotrophy and heterotrophy compared to scleractinian corals, which coincides with a low reliance on photosynthetic carbon gain in the former group of organisms.  2005 Blackwell Publishing Ltd.",1,"MA96","","","",""
"Bshary2011271","A General Scheme to Predict Partner Control Mechanisms in Pairwise Cooperative Interactions Between Unrelated Individuals","Bshary, R. and Bronstein, J.L.","Ethology",117,"4","271-283",2011,"10.1111/j.1439-0310.2011.01882.x","Recent years have seen an explosion in the diversity of partner control mechanisms hypothesised to stabilise cooperative behaviour among unrelated individuals. Game theory suggests numerous strategies, each with specific decision rules that allow cooperators to control a non-contributing partner. This diversity of hypothetical strategies seems likely to reflect diversity in the types of intraspecific cooperation and interspecific mutualism that exist in nature. It is therefore important to provide a framework that explains similarities and differences between the various hypothetical strategies and that predicts how key parameters that describe the natural history of natural systems favour different control mechanisms. We develop a novel unifying framework for pairwise interactions between unrelated individuals, in which we link specific control mechanisms to specific game structures. The latter are defined by unique combinations of the states of five parameters that describe investment, aspects of the payoff matrix, the number of interactions and partner choice. We find that specific control mechanisms potentially have utility in a limited number of game structures; conversely, each game structure may typically offer a few competing control mechanisms. Our framework offers theoreticians specific problems that await mathematical exploration, while at the same time offering empiricists guidelines for evaluating the game structure and corresponding control mechanisms in their systems.  2011 Blackwell Verlag GmbH.",2,"MA4","","","",""
"Vermeij2011","Natural and human economies compared","Vermeij, G.J. and Leigh Jr., E.G.","Ecosphere",2,"4",NA,2011,"10.1890/ES11-00004.1","Human economies and natural ecosystems (natural economies) share fundamental properties. Both are adaptive, cooperative systems where agents-individuals and groups-compete for locally limiting resources needed to live and reproduce. Successful competitors differentially propagate better knowledge and technology for making a living. Competition has favored innovations, diversification (of species or human occupations), higher productivity, greater interdependence among economic agents, and the emergence of more powerful, interactive individuals and groups, so productivity, diversity, and scales of activity have tended to increase over time. Because economic innovations accumulate, these trends have accelerated over time in both natural and human economies. The shift from mainly genetic origin and transmission of adaptation in natural economies to mainly cultural adaptation among human beings has accelerated these trends dramatically, and made the modern human economy extraordinarily dependent on nonrenewable resources and much more vulnerable to monopolies and tragedies of the commons, internally generated threats less common or less destructive in natural economies. In nature, these internal disruptions are overcome by the advent of new agents, often not involved in causing these disruptions, that compete in new ways. We argue that a comparable shift in societal norms, which govern individual and group status in human society, is needed to keep monopolies and tragedies of the commons from harming both the human economy and the ecosystems on which we depend.  2011 Vermeij and Leigh.",2,"MA255","","","",""
"Maras1999245","Elephants, donuts and hamburgers: Young children co-operating to co-operate and co-operating to compete in two primary schools","Maras, P. and Lewis, A. and Simonds, L.","International Journal of Phytoremediation",19,"3","245-258",1999,"10.1080/0144341990190301","Abstract A total of 152 5-6-year-old schoolchildren worked alone or in groups, cooperatively within groups or competing against another group, over 4 weeks. New measures allowed us to consider their preferences for collective or individualistic styles. Three factors: individualism/collectivism, sociability and altruism were identified. The first two were found to be stable over time; the third changed and was related to whether the children worked co-operatively or competitively. Differences were found in collectivism/individualism. Girls (particularly older girls) preferred working co-operatively significantly more than boys at Time 1; however, this decreased over time for girls, whilst boys became less individualistic over time. Younger children scored significantly less than older children on a sociability factor, but this increased significantly over time compared to the older children--artificially in the group co-operative condition. Findings are discussed in light of curriculum and pedagogy of primary schools and social psychological research with children.  1999, Taylor & Francis Group, LLC.",1,"MA117","","","",""
"Diaz.Real2014","Repeatability of feather mite prevalence and intensity in passerine birds","Diaz-Real, J. and Serrano, D. and Prez-Tris, J. and Fernndez-Gonzlez, S. and Bermejo, A. and Calleja, J.A. and De La Puente, J. and De Palacio, D. and Martnez, J.L. and Moreno-Opo, R. and Ponce, C. and Fras, . and Tella, J.L. and Mller, A.P. and Figuerola, J. and Pap, P.L. and Kovcs, I. and Vgsi, C.I. and Melndez, L. and Blanco, G. and Aguilera, E. and Senar, J.C. and Galvn, I. and Atinzar, F. and Barba, E. and Cant, J.L. and Corts, V. and Monrs, J.S. and Piculo, R. and Vgeli, M. and Borras, A. and Navarro, C. and Mestre, A. and Jovani, R.","PLoS ONE",9,"9",NA,2014,"10.1371/journal.pone.0107341","Understanding why host species differ so much in symbiont loads and how this depends on ecological host and symbiont traits is a major issue in the ecology of symbiosis. A first step in this inquiry is to know whether observed differences among host species are species-specific traits or more related with host-symbiont environmental conditions. Here we analysed the repeatability (R) of the intensity and the prevalence of feather mites to partition within- and among-host species variance components. We compiled the largest dataset so far available: 119 Paleartic passerine bird species, 75,944 individual birds, ca. 1.8 million mites, seven countries, 23 study years. Several analyses and approaches were made to estimate R and adjusted repeatability (Radj) after controlling for potential confounding factors (breeding period, weather, habitat, spatial autocorrelation and researcher identity). The prevalence of feather mites was moderately repeatable (R = 0.26-0.53; Radj = 0.32-0.57); smaller values were found for intensity (R = 0.19-0.30; Radj = 0.18-0.30). These moderate repeatabilities show that prevalence and intensity of feather mites differ among species, but also that the high variation within species leads to considerable overlap among bird species. Differences in the prevalence and intensity of feather mites within bird species were small among habitats, suggesting that local factors are playing a secondary role. However, effects of local climatic conditions were partially observed for intensity.  2014 Diaz-Real et al. This is an open access article distributed under the terms of the Creative Commons Attribution License, which permits unrestricted use, distribution, and reproduction in any medium, provided the original author and source are credited.",1,"MA304","","","",""
"GuerreiroMartins2019","Food Sharing Patterns in Three Species of Callitrichid Monkeys (Callithrix jacchus, Leontopithecus chrysomelas, Saguinus midas): Individual and Species Differences","Guerreiro Martins, E.M. and de A. Moura, A.C. and Finkenwirth, C. and Griesser, M. and Burkart, J.M.","Journal of Comparative Psychology",NA,NA,NA,2019,"10.1037/com0000169","Food sharing (FS) in cooperatively breeding callitrichids is unusual among nonhuman primates because they regularly share significant amounts of preferred food with immatures and engage in proactive FS. However, it is still unclear which classes of individuals (males or females, breeders or helpers) engage most in FS, and whether differences exist among callitrichid species. In the first part of this study, we characterized general FS patterns in common marmosets (Callithrix jacchus). We found substantial adult-immature FS, and female breeders shared the least with immatures. This conflicts with previously published studies, where data were collected with the prevailing standard method of providing a food bowl to the entire group. In the second part, a comparison of our access-bias-free method and the standard method suggested that previous findings are likely the result of access bias. In the third part, we investigated species differences in adult-adult FS among common marmosets, golden-headed lion tamarins (Leontopithecus chrysomelas), and red-handed tamarins (Saguinus midas). As common marmosets show lower levels of interdependence within groups, we expected more adult-adult FS in tamarins compared with marmosets. Adult-adult FS was indeed more prevalent in tamarins and not exclusively directed from male breeders to female breeders. Therefore, our results suggest that adult- adult FS in marmosets mostly reflects the high energetic demands of female breeders, whereas in the more interdependent tamarins, it may be used to reinforce cooperative bonds between adult group members.  2019 American Psychological Association.",1,"MA152","","","",""
"X.ISI.000077801500011","Limits on the bathymetric distribution of keratose sponges: a field test in deep water","Maldonado, M and Young, CM","MARINE ECOLOGY PROGRESS SERIES",174,NA,"123-139",1998,"10.3354/meps174123","The keratose sponges (i.e. those in which the mineral skeleton is replaced by a collage nous skeleton) are generally restricted to shallow-water habitats, but the causes of this distinct bathymetric pattern remain unclear. Sharp pycnoclines at the depth of the upper slope may hinder colonization of deep waters because of thermal stress or reduced light and particulate food below the pycnodines. It is also possible that oligotrophy and loss of symbiotic cyanobacteria below the pycnocline may lead to a nutritional stress. Using manned submersibles in Exuma Sound, Bahamas, we determined that the pycnocline Lies between 70 and 100 m. We transplanted individuals of 2 keratose sponges (Aplysina fistularis and Ircinia felix) from their natural habitat on a shallow reef (4 m deep) to 3 depths (100, 200, 300 m) within or below the pycnocline to investigate mortality and changes in body size, shape and histology as a function of depth. We also recorded changes in populations of photosynthetic and heterotrophic symbiotic bacteria, as well as the parasitic polychaete Haplosyllis spongicola. By transplanting individuals of A. fistularis bearing buds for asexual propagation (fistules) and individuals of I. felix brooding embryos, we also tested the viability of reproductive propagules in deep-water environments. We found that, although these 2 sponges do not naturally occur at depths below 40 m, 62.5\% of A. fistularis and 42.8\% of I. felix survived at 100 m for 12 mo. No A. fistularis survived at 200 m, whereas 28.5\% of I. felix did. All sponges transplanted to 300 m died within 2 mo. Water tem temperature was the most Likely cause of sudden mortality at this depth. There were no significant differences in growth between individuals at the slope and controls on the shallow reef. Cyanobacteria were lost in individuals of I. felix that survived at 100 and 200 m, and these sponges repositioned oscules and formed chimney-like processes, probably to enhance water flow through the sponge and compensate for nutritional stress. By contrast, cyanobacteria were still abundant in individuals of A. fistularis surviving at a depth of 100 m, and these sponges did not change shape significantly apart from the loss of fistules. It appears, therefore, that the loss of cyanobacteria and the increasing oligotrophy with depth do not set the lower bathymetric limits of species. Removal of sponge tissues by the parasitic polychaete H. spongicola also appears not to aggravate significantly the nutritional stress experienced by sponges transplanted to deep water, at least to the extent that it may restrict the bathymetric distribution of the host. Despite the facts that only the species I. felix was heavily parasitized and that parasites survived within hosts at all depths, there was no significant difference in survival with depths between sponge species. A TEM (transmission electron microscope) examination of the mesohyl did not reveal significant cytological differences among sponges transplanted to various depths. At all depths, surviving individuals of both species showed archeocytes engaged in phagocytosis and digestion of cyanobacteria and/or heterotrophic bacteria. Similarly, collencytes and spongocytes were apparently secreting collagen, indicating that temperatures at 100 and 200 m do not inhibit the formation of the skeleton. Sponge recruitment derived from either asexual or sexual propagules was never observed at slope depths. Since adult sponges survived when they were artificially transported to deep waters, the inhibition of larval dispersal or settlement success (perhaps caused by the sharp decrease in temperature with increasing depth) emerges as the most plausible explanation for the shallow-water confinement of these keratose sponges.",2,"MA232","","","",""
"Komdeur2006729","Variation in individual investment strategies among social animals","Komdeur, J.","Ethology",112,"8","729-747",2006,"10.1111/j.1439-0310.2006.01243.x","Cooperation and conflict are ubiquitous features of life in the vast majority of animals and can occur over a wide range of functional contents and at various levels. In this review I describe known and less well-known proximate aspects of cooperation and conflict over reproductive behaviour in social animals, where individuals other than the genetic parents contribute to the provisioning of care ('alloparental care'). Traditionally the evolution of alloparental care is viewed as a two-step process: the decision to delay dispersal and independent breeding, usually as a consequence of the existence of constraints on independent breeding, and the decision to behave as alloparents by which individuals that have delayed dispersal gain a net fitness benefit. Behavioural ecological theory generally assumes that all individuals are similar in 'make-up' and that life history and behavioural decisions are facultative. However, there is probably more individual variation in the amount and type of social behaviour than originally anticipated. Here, I demonstrate that some of these differences in behaviours are because of environmental factors, which may be associated with 'reaction norms' or the genotype's quantitative phenotypic variation, or which may yield polyethisms. Most evolutionary models of animal cooperation are based on optimality approaches that do not consider individual genetic variation and maternal effects on the variation in the expression of social behaviour. Further research on the genetic basis of cooperations and subordinate-breeder interactions may be crucial for understanding the evolution of social behaviour. If we take individual differences into account our conclusions and explanations of social behaviour may change. Given the conceptual similarities between the various research disciplines addressing different types of cooperation and conflict over investment, the issues described here should lead to more mutual attraction between the different disciplines and stimulate further development in our understanding of cooperation strategies in general.  2006 The Author.",2,"MA405","","","",""
"X.ISI.000072639600002","Behavioral genetics and evolutionary psychology: Unified perspective on personality research","Segal, NL and Macdonald, KB","HUMAN BIOLOGY",70,"2","159-184",1998,NA,"Behavioral geneticists and evolutionary psychologists have generally pursued human behavioral analyses with little theoretical or methodological exchange. However, significant benefits might accrue from increased communication between these disciplines. The primary goals of this article are (1) to identify meaningful junctures between behavioral genetics and evolutionary psychology, (2) to describe behavioral genetic research designs and their applications to evolutionary analyses, and (3) to reassess current personality research in light of behavioral genetic and evolutionary concepts and techniques, The five-factor model of personality is conceptualized as subsuming variation in normative species-typical systems with adaptive functions in the human environment of evolutionary adaptation. Considered as universal evolved mechanisms, personality systems are often seen in dynamic conflict within individuals and as highly compartmentalized in their functioning between settings, However, genetically influenced individual differences in personality may also be understood within an evolutionary framework. Studies of the heritability of personality traits indicate broad-sense heritabilities in the 0.40-0.50 range with evidence of substantial nonadditive genetic variation and nonshared environmental influences. Evidence indicates that evolutionary theory (e.g., inclusive fitness theory) predicts patterns of social interaction (e.g., cooperation and bereavement) in relatives. Furthermore, variation in personality may constitute a range of viable strategies matching the opportunities available in the complex niche environment of human societies. Within this wide range of viable strategies, personality variation functions as a resource environment for individuals in the sense that personality variation is evaluated according to the interests of the evaluator (e.g., friendships, coalitions, or mate choice).",2,"MA30","","","",""
"Wang2013361","The Ecological Perspective of Microbial Communities in Two Pairs of Competitive Hawaiian Native and Invasive Macroalgae","Wang, X. and Liu, X. and Kono, S. and Wang, G.","Microbial Ecology",65,"2","361-370",2013,"10.1007/s00248-012-0144-5","Marine macroalgae are known to harbor large populations of microbial symbionts, and yet, microbe symbiosis in invasive macroalgae remains largely unknown. In this study, we applied molecular methods to study microbial communities associated with two invasive algae Acanthophora spicifera and Gracilaria salicornia and the two native algae Gracilaria coronopifolia and Laurencia nidifica at spatial and temporal scales in Hawaiian coral reef ecosystems. Bacterial communities of both the invasive and native macroalgae displayed little spatial and temporal variations, suggesting consistent and stable bacterial associations with these macroalgae. Results of this study identified three types of bacterial populations: nonspecific (present in both algal and water samples); algae-specific (found in all algal species); and species-specific (only found in individual species). The bacterial diversity of invasive algae was lower than that of their native counterparts at phylum and species levels. Notably, the vast majority (71 %) of bacterial communities associated with the invasive algae G. salicornia were representatives of Cyanobacteria, suggesting a potential ecological significance of symbiotic Cyanobacteria.  2012 Springer Science+Business Media New York.",2,"MA368","","","",""
"X.ISI.000404318100016","Hormonal underpinnings of status conflict: Testosterone and cortisol are related to decisions and satisfaction in the hawk-dove game","Mehta, Pranjal H. and DesJardins, Nicole M. Lawless and van Vugt, Mark and Josephs, Robert A.","HORMONES AND BEHAVIOR",92,"SI","141-154",2017,"10.1016/j.yhbeh.2017.03.009","A contribution to a special issue on Hormones and Human Competition. Testosterone is theorized to influence status-seeking behaviors such as social dominance and competitive behavior, but supporting evidence is mixed. The present study tested the roles of testosterone and cortisol in the hawk dove game, a dyadic economic decision-making paradigm in which earnings depend on one's own and the other player's choices. If one person selects the hawk strategy and the other person selects the dove strategy, the player who selected hawk attains a greater financial pay-off (status differentiation). The worst financial outcome occurs when both players choose the hawk strategy (status confrontation). Ninety-eight undergraduate students (42 men) provided saliva samples and played ten rounds of the hawk-dove game with another same-sex participant. In support of the hypothesis that testosterone is related to status concern, individuals higher in basal testosterone made more hawk decisions decisions that harmed the other player. Acute decreases in cortisol were also associated with more hawk decisions. There was some empirical support for the dual-hormone hypothesis as well: basal testosterone was positively related to satisfaction in the game among low basal-cortisol individuals but not among high basal-cortisol individuals. There were no significant sex differences in these hormonal effects. The present findings align with theories of hormones and status-seeking behavior at the individual level, but they also open up new avenues for research on hormone profiles at the collective level. Our results suggest that the presence of two or more high-testosterone members increases the likelihood of status confrontations over a limited resource that can undermine collective outcomes. (C) 2017 Elsevier Inc. All rights reserved.",1,"MA180","","","",""
"X.ISI.000251466400008","Lethal male-male combat in the parasitoid Melittobia acasta: are size and competitive environment important?","Reece, Sarah E. and Innocent, Tabitha M. and West, Stuart A.","ANIMAL BEHAVIOUR",74,"5","1163-1169",2007,"10.1016/j.anbehav.2006.10.027","Interactions between organisms can lie anywhere along the spectrum from fatal conflict to total cooperation. To understand this variation, knowledge of the strategies that individuals use to acquire their resources is required. We tested theoretical predictions relating to conflict behaviour in a species of parasitoid wasp, Melittobia acasta, in which males compete for mates in their closed, natal patches. They engage in lethal combat to gain access to the females developing in their host. Environmental factors and individual traits both influenced conflict behaviour and contest outcome: fighting behaviour increased with the density of competitors and larger contestants were more successful. Our results also indicate that opponent assessment did not influence conflict behaviour and contests were always resolved by fighting. Crown Copyright (C) 2007 Published by Elsevier Ltd on behalf of The Association for the Study of Animal Behaviour. All rights reserved.",2,"MA231","","","",""
